Sheet: ImportaciÃ³n de Productos
A1: Gestionix - Plantilla de ImportaciÃ³n de Productos
R7: Datos de Costo - Lo que te cuesta el producto | X7: Datos de Precio - En lo que vendes el producto al cliente | AF7: Productos del compuesto | AH7: Opciones avanzadas (opcional)
A8: Clave del producto (*) | B8: Nombre (*) | C8: DescripciÃ³n Detallada | D8: Tipo (*) Valores permitidos (Inventariable, Servicio, Compuesto, Variante) | E8: Variante: 1 | F8: Valor: 1 | G8: Variante: 2 (opcional) | H8: Valor: 2 (opcional) | I8: Variante: 3 (opcional) | J8: Valor: 3 (opcional) | K8: Clave de la variante (opcional) | L8: CÃ³digo de barras (13 dÃ­gitos) | M8: Existencia Inicial | N8: Unidad de medida (*) | O8: Clave SAT (ProdServ) | P8: Tara | Q8: Moneda Valores permitidos (MXN, USD, EUR) | R8: Costo antes de impuestos (*) | S8: Tipo de Impuesto (Trasladado o Retenido) | T8: DescripciÃ³n del impuesto (IVA, IEPS, ETC) | U8: Tasa del impuesto (Si no aplica, dejar en blanco) | V8: Importe del impuesto | W8: Costo total (*) (Importe antes de impuestos + Impuestos) | X8: Precio antes de impuestos (*) CARLOS | Y8: Tipo de Impuesto (Trasladado o Retenido) | Z8: DescripciÃ³n del impuesto (IVA, IEPS, ETC) | AA8: Tasa del impuesto (Si no aplica, dejar en blanco) | AB8: Importe del impuesto | AC8: Precio total (*) (Importe antes de impuestos + Impuestos) CARLOS | AD8: CategorÃ­a (Si tiene subcategorÃ­a separar con un guion "-") | AE8: Proveedor RazÃ³n Social | AF8: Clave del producto que compone el compuesto | AG8: Cantidad | AH8: MÃ­nimos | AI8: MÃ¡ximos | AJ8: Punto de reorden | AK8: UbicaciÃ³n fÃ­sica | AL8: Se vende en lÃ­nea | AM8: Se permite su venta | AN8: Se vende a granel | AO8: Ancho | AP8: Altura | AQ8: Largo | AR8: Peso | AS8: Marca | AT8: Imagen (URL)
A9: ECFCP | B9: ESTUCOP CHUKUM FINO CREMA KIT 20 KG | C9: MORTERO PARA ACABADO LISO COLOR CHUKUM | D9: Inventariable | M9: 0 | N9: SACO | O9: 30111504 | Q9: MXN | R9: 177.77 | S9: Trasladado | T9: IVA | U9: 0.16 | V9: of:=[.R9]*0.16 -> 28.4432 | W9: of:=[.R9]*1.16 -> 206.2132 | X9: 297.32 | Y9: Trasladado | Z9: IVA | AA9: 0.16 | AB9: of:=[.X9]*0.16 -> 47.5712 | AC9: of:=[.AB9]+[.X9] -> 344.8912 | AD9: MORTEROS | AE9: MONTSERRAT SANCHEZ CASTELLANOS | AL9: NO | AM9: SI | AN9: NO | AO9: 9 | AP9: 30 | AQ9: 37 | AR9: 20 | AS9: COP
A10: ECFF20 | B10: ESTUCOP CHUKUM FINO CREMA 20 KG (SIN CONCENTRADO) | C10: MORTERO PARA ACABADO LISO COLOR CREMA | D10: Inventariable | M10: 0 | N10: SACO | O10: 30111504 | Q10: MXN | R10: 162.9 | S10: Trasladado | T10: IVA | U10: 0.16 | V10: of:=[.R10]*0.16 -> 26.064 | W10: of:=[.R10]*1.16 -> 188.964 | X10: 273.18 | Y10: Trasladado | Z10: IVA | AA10: 0.16 | AB10: of:=[.X10]*0.16 -> 43.7088 | AC10: 317 | AD10: MORTEROS | AE10: MONTSERRAT SANCHEZ CASTELLANOS | AL10: NO | AM10: SI | AN10: NO | AO10: 9 | AP10: 30 | AQ10: 37 | AR10: 20 | AS10: COP
A11: CCHUKUM | B11: CONCENTRADO CHUKUM 125 ML | C11: PIGMENTO PARA MORTERO COP CHUKUM | D11: Inventariable | M11: 26 | N11: FRASCO | O11: 12171506 | Q11: MXN | R11: 14.86 | S11: Trasladado | T11: IVA | U11: 0.16 | V11: of:=[.R11]*0.16 -> 2.3776 | W11: of:=[.R11]*1.16 -> 17.2376 | X11: of:=[.AC11]/1.16 -> 24.13793103 | Y11: Trasladado | Z11: IVA | AA11: 0.16 | AB11: of:=[.X11]*0.16 -> 3.8620689648 | AC11: 28 | AD11: PIGMENTO | AE11: MONTSERRAT SANCHEZ CASTELLANOS | AL11: NO | AM11: SI | AN11: NO | AO11: 4 | AP11: 11.2 | AQ11: 6 | AR11: 0.125 | AS11: COP
A12: PIGCONCAP | B12: PIGMENTO GRIS CONCRETO 125 ML | C12: PIGMENTO PARA MORTERO COP CONCRETO APARENTE | D12: Inventariable | M12: 1 | N12: SACO | O12: 12171506 | Q12: MXN | R12: 46.37 | S12: Trasladado | T12: IVA | U12: 0.16 | V12: of:=[.R12]*0.16 -> 7.4192 | W12: of:=[.R12]*1.16 -> 53.7892 | X12: 75.3 | Y12: Trasladado | Z12: IVA | AA12: 0.16 | AB12: of:=[.X12]*0.16 -> 12.048 | AC12: 87.35 | AD12: PIGMENTO | AE12: MONTSERRAT SANCHEZ CASTELLANOS | AL12: NO | AM12: SI | AN12: NO | AO12: 4 | AP12: 11.2 | AQ12: 6 | AR12: 0.125 | AS12: COP
A13: S28EG | B13: ESTUCOP FINO GRIS 20 KG | C13: MORTERO PARA ACABADO LISO COLOR GRIS | D13: Inventariable | M13: 0 | N13: SACO | O13: 30111504 | Q13: MXN | R13: 139.71 | S13: Trasladado | T13: IVA | U13: 0.16 | V13: of:=[.R13]*0.16 -> 22.3536 | W13: of:=[.R13]*1.16 -> 162.0636 | X13: 235.52 | Y13: Trasladado | Z13: IVA | AA13: 0.16 | AB13: of:=[.X13]*0.16 -> 37.6832 | AC13: 273.2 | AD13: MORTEROS | AE13: MONTSERRAT SANCHEZ CASTELLANOS | AL13: NO | AM13: SI | AN13: NO | AO13: 9 | AP13: 30 | AQ13: 37 | AR13: 20 | AS13: COP
A14: S28EB | B14: ESTUCOP FINO BLANCO 20 KG | C14: MORTERO PARA ACABADO LISO COLOR BLANCO | D14: Inventariable | M14: 3 | N14: SACO | O14: 30111504 | Q14: MXN | R14: 195 | S14: Trasladado | T14: IVA | U14: 0.16 | V14: 31.21 | W14: 226.21 | X14: of:=[.AC14]/1.16 -> 325.3189655 | Y14: Trasladado | Z14: IVA | AA14: 0.16 | AB14: of:=[.X14]*0.16 -> 52.05103448 | AC14: 377.37 | AD14: MORTEROS | AE14: MONTSERRAT SANCHEZ CASTELLANOS | AL14: NO | AM14: SI | AN14: NO | AO14: 9 | AP14: 30 | AQ14: 37 | AR14: 20 | AS14: COP
A15: FX28 | B15: ESTUCOP FX FINO (FLEXIBLE) BLANCO 20 KG CONTRATIPO REDIMIX | C15: MORTERO CONTRATIPO REDIMIX COLOR BLANCO | D15: Inventariable | M15: 0 | N15: SACO | O15: 30111504 | Q15: MXN | R15: 196.19 | S15: Trasladado | T15: IVA | U15: 0.16 | V15: of:=[.R15]*0.16 -> 31.3904 | W15: of:=[.R15]*1.16 -> 227.5804 | X15: 327.23 | Y15: Trasladado | Z15: IVA | AA15: 0.16 | AB15: of:=[.X15]*0.16 -> 52.3568 | AC15: 379.59 | AD15: MORTEROS | AE15: MONTSERRAT SANCHEZ CASTELLANOS | AL15: NO | AM15: SI | AN15: NO | AO15: 9 | AP15: 30 | AQ15: 37 | AR15: 20 | AS15: COP
A16: S28EC | B16: ESTUCOP FINO CREMA 20 KG | C16: MORTERO PARA ACABADO LISO COLOR CREMA | D16: Inventariable | M16: 0 | N16: SACO | O16: 30111504 | Q16: MXN | R16: 183.11 | S16: Trasladado | T16: IVA | U16: 0.16 | V16: of:=[.R16]*0.16 -> 29.2976 | W16: of:=[.R16]*1.16 -> 212.4076 | X16: of:=[.AC16]/1.16 -> 305.991379310345 | Y16: Trasladado | Z16: IVA | AA16: 0.16 | AB16: of:=[.X16]*0.16 -> 48.9586206896552 | AC16: 354.95 | AD16: MORTEROS | AE16: MONTSERRAT SANCHEZ CASTELLANOS | AL16: NO | AM16: SI | AN16: NO | AO16: 9 | AP16: 30 | AQ16: 37 | AR16: 20 | AS16: COP
A17: S28AG | B17: ESTUCOP FINO CONCRETO APARENTE GRIS 20 KG | C17: MORTERO PARA ACABADO LISO COLOR GRIS CONCRETO APARENTE | D17: Inventariable | M17: 47 | N17: SACO | O17: 30111504 | Q17: MXN | R17: 151.6 | S17: Trasladado | T17: IVA | U17: 0.16 | V17: of:=[.R17]*0.16 -> 24.256 | W17: of:=[.R17]*1.16 -> 175.856 | X17: of:=[.AC17]/1.16 -> 254.827586206897 | Y17: Trasladado | Z17: IVA | AA17: 0.16 | AB17: of:=[.X17]*0.16 -> 40.7724137931035 | AC17: 295.6 | AD17: MORTEROS | AE17: MONTSERRAT SANCHEZ CASTELLANOS | AL17: NO | AM17: SI | AN17: NO | AO17: 9 | AP17: 30 | AQ17: 37 | AR17: 20 | AS17: COP
A18: MGF40 | B18: MASILLA COP GRIS CON FIBRA 40 KG | C18: MORTERO PARA ACABADO LISO COLOR CREMA | D18: Inventariable | M18: 2 | N18: SACO | O18: 30111504 | Q18: MXN | R18: 92.15 | S18: Trasladado | T18: IVA | U18: 0.16 | V18: 14.75 | W18: 106.9 | X18: of:=[.AC18]/1.16 -> 167.241379310345 | Y18: Trasladado | Z18: IVA | AA18: 0.16 | AB18: of:=[.X18]*0.16 -> 26.7586206896552 | AC18: 194 | AD18: MORTEROS | AE18: MONTSERRAT SANCHEZ CASTELLANOS | AL18: NO | AM18: SI | AN18: NO | AO18: 9 | AP18: 58 | AQ18: 40 | AR18: 40 | AS18: COP
A19: R40G | B19: REPELLO 3 EN 1 GRIS 40 KG | C19: MORTERO PARA ACABADO LISO COLOR CREMA | D19: Inventariable | M19: 57 | N19: SACO | O19: 30111504 | Q19: MXN | R19: 98.1 | S19: Trasladado | T19: IVA | U19: 0.16 | V19: of:=[.R19]*0.16 -> 15.696 | W19: of:=[.R19]*1.16 -> 113.796 | X19: of:=[.AC19]/1.16 -> 176.560344827586 | Y19: Trasladado | Z19: IVA | AA19: 0.16 | AB19: of:=[.X19]*0.16 -> 28.2496551724138 | AC19: 204.81 | AD19: MORTEROS | AE19: MONTSERRAT SANCHEZ CASTELLANOS | AL19: NO | AM19: SI | AN19: NO | AO19: 9 | AP19: 58 | AQ19: 40 | AR19: 40 | AS19: COP
A20: TFGRIS | B20: COPKRET TOP WALL GRIS 20 KG | C20: MICROCEMENTO COLOR GRIS | D20: Inventariable | M20: 0 | N20: CUBETA | O20: 30111504 | Q20: MXN | R20: 713.44 | S20: Trasladado | T20: IVA | U20: 0.16 | V20: of:=[.R20]*0.16 -> 114.1504 | W20: of:=[.R20]*1.16 -> 827.5904 | X20: of:=[.AC20]/1.16 -> 1175.87068965517 | Y20: Trasladado | Z20: IVA | AA20: 0.16 | AB20: of:=[.X20]*0.16 -> 188.139310344828 | AC20: 1364.01 | AD20: MORTEROS | AE20: MONTSERRAT SANCHEZ CASTELLANOS | AL20: NO | AM20: SI | AN20: NO | AO20: 31 | AP20: 37 | AQ20: 31 | AR20: 20 | AS20: COP
A21: TFN-20 | B21: COPKRET TOP WALL NEGRO 20 KG | C21: MICROCEMENTO COLOR NEGRO | D21: Inventariable | M21: 0 | N21: CUBETA | O21: 30111504 | Q21: MXN | R21: 713.44 | S21: Trasladado | T21: IVA | U21: 0.16 | V21: of:=[.R21]*0.16 -> 114.1504 | W21: of:=[.R21]*1.16 -> 827.5904 | X21: of:=[.AC21]/1.16 -> 1175.87068965517 | Y21: Trasladado | Z21: IVA | AA21: 0.16 | AB21: of:=[.X21]*0.16 -> 188.139310344828 | AC21: 1364.01 | AD21: MORTEROS | AE21: MONTSERRAT SANCHEZ CASTELLANOS | AL21: NO | AM21: SI | AN21: NO | AO21: 31 | AP21: 37 | AQ21: 31 | AR21: 20 | AS21: COP
A22: TFC20 | B22: COPKRET TOP WALL CREMA 20 KG | C22: MICROCEMENTO COLOR CREMA | D22: Inventariable | M22: 2 | N22: CUBETA | O22: 30111504 | Q22: MXN | R22: 713.44 | S22: Trasladado | T22: IVA | U22: 0.16 | V22: of:=[.R22]*0.16 -> 114.1504 | W22: of:=[.R22]*1.16 -> 827.5904 | X22: of:=[.AC22]/1.16 -> 1175.87068965517 | Y22: Trasladado | Z22: IVA | AA22: 0.16 | AB22: of:=[.X22]*0.16 -> 188.139310344828 | AC22: 1364.01 | AD22: MORTEROS | AE22: MONTSERRAT SANCHEZ CASTELLANOS | AL22: NO | AM22: SI | AN22: NO | AO22: 31 | AP22: 37 | AQ22: 31 | AR22: 20 | AS22: COP
A23: TF1800 | B23: COPKRET TOP WALL GRIS 1800 20 KG | C23: MICROCEMENTO COLOR NEGRO 1800 | D23: Inventariable | M23: 0 | N23: CUBETA | O23: 30111504 | Q23: MXN | R23: 713.44 | S23: Trasladado | T23: IVA | U23: 0.16 | V23: of:=[.R23]*0.16 -> 114.1504 | W23: of:=[.R23]*1.16 -> 827.5904 | X23: of:=[.AC23]/1.16 -> 1175.87068965517 | Y23: Trasladado | Z23: IVA | AA23: 0.16 | AB23: of:=[.X23]*0.16 -> 188.139310344828 | AC23: 1364.01 | AD23: MORTEROS | AE23: MONTSERRAT SANCHEZ CASTELLANOS | AL23: NO | AM23: SI | AN23: NO | AO23: 31 | AP23: 37 | AQ23: 31 | AR23: 20 | AS23: COP
A24: S28ABG | B24: ESTUCOP ALBERCA GRIS 20 KG | C24: RECUBRIMIENTO PARA ALBERCA COLOR GRIS | D24: Inventariable | M24: 1 | N24: SACO | O24: 30111504 | Q24: MXN | R24: 365.63 | S24: Trasladado | T24: IVA | U24: 0.16 | V24: 58.51 | W24: 424.14 | X24: of:=[.AC24]/1.16 -> 602.413793103448 | Y24: Trasladado | Z24: IVA | AA24: 0.16 | AB24: of:=[.X24]*0.16 -> 96.3862068965517 | AC24: 698.8 | AD24: MORTEROS | AE24: MONTSERRAT SANCHEZ CASTELLANOS | AL24: NO | AM24: SI | AN24: NO | AO24: 31 | AP24: 37 | AQ24: 31 | AR24: 20 | AS24: COP
A25: S28ABC | B25: ESTUCOP ALBERCA CREMA 20 KG | C25: RECUBRIMIENTO PARA ALBERCA COLOR CREMA | D25: Inventariable | M25: 0 | N25: SACO | O25: 30111504 | Q25: MXN | R25: 410.22 | S25: Trasladado | T25: IVA | U25: 0.16 | V25: of:=[.R25]*0.16 -> 65.6352 | W25: of:=[.R25]*1.16 -> 475.8552 | X25: of:=[.AC25]/1.16 -> 674.827586206897 | Y25: Trasladado | Z25: IVA | AA25: 0.16 | AB25: of:=[.X25]*0.16 -> 107.972413793103 | AC25: 782.8 | AD25: MORTEROS | AE25: MONTSERRAT SANCHEZ CASTELLANOS | AL25: NO | AM25: SI | AN25: NO | AO25: 31 | AP25: 37 | AQ25: 12 | AR25: 20 | AS25: COP
A26: EIIG20 | B26: IMPERMEABLE INMERSION GRIS 20 KG | C26: MORTERO IMPERMEABLE COLOR GRIS | D26: Inventariable | M26: 10 | N26: SACO | O26: 30111504 | Q26: MXN | R26: 267.54 | S26: Trasladado | T26: IVA | U26: 0.16 | V26: of:=[.R26]*0.16 -> 42.8064 | W26: of:=[.R26]*1.16 -> 310.3464 | X26: of:=[.AC26]/1.16 -> 443.112068965517 | Y26: Trasladado | Z26: IVA | AA26: 0.16 | AB26: of:=[.X26]*0.16 -> 70.8979310344828 | AC26: 514.01 | AD26: MORTEROS | AE26: MONTSERRAT SANCHEZ CASTELLANOS | AL26: NO | AM26: SI | AN26: NO | AO26: 31 | AP26: 37 | AQ26: 12 | AR26: 20 | AS26: COP
A27: PC1000G | B27: PLASTICOP 1000 4 LTS | C27: PROMOTOR DE ADHERENCIA PARA SUPERFICIES LISAS | D27: Inventariable | M27: 5 | N27: GALON | O27: 31201600 | Q27: MXN | R27: 208.09 | S27: Trasladado | T27: IVA | U27: 0.16 | V27: of:=[.R27]*0.16 -> 33.2944 | W27: 241.38 | X27: of:=[.AC27]/1.16 -> 346.551724137931 | Y27: Trasladado | Z27: IVA | AA27: 0.16 | AB27: of:=[.X27]*0.16 -> 55.448275862069 | AC27: 402 | AD27: SELLADORES Y ADITIVOS | AE27: MONTSERRAT SANCHEZ CASTELLANOS | AL27: NO | AM27: SI | AN27: NO | AO27: 20 | AP27: 19 | AQ27: 20 | AR27: 4 | AS27: COP
A28: PC1000C | B28: PLASTICOP 1000 19 LTS | C28: PROMOTOR DE ADHERENCIA PARA SUPERFICIES LISAS | D28: Inventariable | M28: 2 | N28: CUBETA | O28: 31201600 | Q28: MXN | R28: 891.79 | S28: Trasladado | T28: IVA | U28: 0.16 | V28: of:=[.R28]*0.16 -> 142.6864 | W28: of:=[.R28]*1.16 -> 1034.4764 | X28: of:=[.AC28]/1.16 -> 1465.51724137931 | Y28: Trasladado | Z28: IVA | AA28: 0.16 | AB28: of:=[.X28]*0.16 -> 234.48275862069 | AC28: 1700 | AD28: SELLADORES Y ADITIVOS | AE28: MONTSERRAT SANCHEZ CASTELLANOS | AL28: NO | AM28: SI | AN28: NO | AO28: 31 | AP28: 37 | AQ28: 31 | AR28: 19 | AS28: COP
A29: PB1000G | B29: PLASTIBOND 1000 TRANSPARENTE 4 LT | C29: ADHESIVO PARA CONCRETO | D29: Inventariable | M29: 0 | N29: GALON | O29: 31201600 | Q29: MXN | R29: 222.95 | S29: Trasladado | T29: IVA | U29: 0.16 | V29: of:=[.R29]*0.16 -> 35.672 | W29: of:=[.R29]*1.16 -> 258.622 | X29: of:=[.AC29]/1.16 -> 370.689655172414 | Y29: Trasladado | Z29: IVA | AA29: 0.16 | AB29: of:=[.X29]*0.16 -> 59.3103448275862 | AC29: 430 | AD29: SELLADORES Y ADITIVOS | AE29: MONTSERRAT SANCHEZ CASTELLANOS | AL29: NO | AM29: SI | AN29: NO | AO29: 20 | AP29: 19 | AQ29: 20 | AR29: 4 | AS29: COP
A30: PB1000C | B30: PLASTIBOND 1000 TRANSPARENTE 19 LT | C30: ADHESIVO PARA CONCRETO | D30: Inventariable | M30: 0 | N30: CUBETA | O30: 31201600 | Q30: MXN | R30: 989.89 | S30: Trasladado | T30: IVA | U30: 0.16 | V30: of:=[.R30]*0.16 -> 158.3824 | W30: of:=[.R30]*1.16 -> 1148.2724 | X30: of:=[.AC30]/1.16 -> 1624.81896551724 | Y30: Trasladado | Z30: IVA | AA30: 0.16 | AB30: of:=[.X30]*0.16 -> 259.971034482759 | AC30: 1884.79 | AD30: SELLADORES Y ADITIVOS | AE30: MONTSERRAT SANCHEZ CASTELLANOS | AL30: NO | AM30: SI | AN30: NO | AO30: 31 | AP30: 37 | AQ30: 31 | AR30: 19 | AS30: COP
A31: PB500G | B31: PLASTIBOND 500 TRANSPARENTE 4 LT | C31: ADHESIVO PARA CONCRETO | D31: Inventariable | M31: 0 | N31: GALON | O31: 31201600 | Q31: MXN | R31: 148.63 | S31: Trasladado | T31: IVA | U31: 0.16 | V31: of:=[.R31]*0.16 -> 23.7808 | W31: of:=[.R31]*1.16 -> 172.4108 | X31: of:=[.AC31]/1.16 -> 249.991379310345 | Y31: Trasladado | Z31: IVA | AA31: 0.16 | AB31: of:=[.X31]*0.16 -> 39.9986206896552 | AC31: 289.99 | AD31: SELLADORES Y ADITIVOS | AE31: MONTSERRAT SANCHEZ CASTELLANOS | AL31: NO | AM31: SI | AN31: NO | AO31: 20 | AP31: 19 | AQ31: 20 | AR31: 4 | AS31: COP
A32: PB500C | B32: PLASTIBOND 500 TRANSPARENTE 19 LT | C32: ADHESIVO PARA CONCRETO | D32: Inventariable | M32: 8 | N32: CUBETA | O32: 31201600 | Q32: MXN | R32: 529.14 | S32: Trasladado | T32: IVA | U32: 0.16 | V32: of:=[.R32]*0.16 -> 84.6624 | W32: of:=[.R32]*1.16 -> 613.8024 | X32: of:=[.AC32]/1.16 -> 876.560344827586 | Y32: Trasladado | Z32: IVA | AA32: 0.16 | AB32: of:=[.X32]*0.16 -> 140.249655172414 | AC32: 1016.81 | AD32: SELLADORES Y ADITIVOS | AE32: MONTSERRAT SANCHEZ CASTELLANOS | AL32: NO | AM32: SI | AN32: NO | AO32: 31 | AP32: 37 | AQ32: 31 | AR32: 19 | AS32: COP
A33: CSBA4 | B33: COP SILICON BASE AGUA 4 LTS | C33: REPELENTE AL AGUA BASE SILICÃN | D33: Inventariable | M33: 3 | N33: GALON | O33: 12164901 | Q33: MXN | R33: 237.22 | S33: Trasladado | T33: IVA | U33: 0.16 | V33: of:=[.R33]*0.16 -> 37.9552 | W33: of:=[.R33]*1.16 -> 275.1752 | X33: of:=[.AC33]/1.16 -> 393.870689655172 | Y33: Trasladado | Z33: IVA | AA33: 0.16 | AB33: of:=[.X33]*0.16 -> 63.0193103448276 | AC33: 456.89 | AD33: SELLADORES Y ADITIVOS | AE33: MONTSERRAT SANCHEZ CASTELLANOS | AL33: NO | AM33: SI | AN33: NO | AO33: 20 | AP33: 19 | AQ33: 20 | AR33: 4 | AS33: COP
A34: CSBA19 | B34: COP SILICON BASE AGUA 19 LTS | C34: REPELENTE AL AGUA BASE SILICÃN | D34: Inventariable | M34: 1 | N34: CUBETA | O34: 12164901 | Q34: MXN | R34: 950.65 | S34: Trasladado | T34: IVA | U34: 0.16 | V34: 152.11 | W34: 1102.76 | X34: of:=[.AC34]/1.16 -> 1561.10344827586 | Y34: Trasladado | Z34: IVA | AA34: 0.16 | AB34: of:=[.X34]*0.16 -> 249.776551724138 | AC34: 1810.88 | AD34: SELLADORES Y ADITIVOS | AE34: MONTSERRAT SANCHEZ CASTELLANOS | AL34: NO | AM34: SI | AN34: NO | AO34: 31 | AP34: 37 | AQ34: 31 | AR34: 19 | AS34: COP
A35: 947837 | B35: CEMPANEL LISO 6MM | C35: PLACA DE FIBROCEMENTO DE 1.22 M X 2.44 26.80KG | D35: Inventariable | M35: 4 | N35: PIEZA | O35: 30161505 | Q35: MXN | R35: 327.75 | S35: Trasladado | T35: IVA | U35: 0.16 | V35: of:=[.R35]*0.16 -> 52.44 | W35: of:=[.R35]*1.16 -> 380.19 | X35: of:=[.AC35]/1.16 -> 478.586206896552 | Y35: Trasladado | Z35: IVA | AA35: 0.16 | AB35: of:=[.X35]*0.16 -> 76.5737931034483 | AC35: 555.16 | AD35: FIBROCEMENTOS | AE35: MEXALIT INDUSTRIAL, S.A. DE C.V. | AL35: NO | AM35: SI | AN35: NO | AO35: 0.6 | AP35: 122 | AQ35: 244 | AR35: 26.8 | AS35: CEMPANEL
A36: 947715 | B36: CEMPANEL LISO 8MM | C36: PLACA DE FIBROCEMENTO DE 1.22 M X 2.44 35.70KG | D36: Inventariable | M36: 19 | N36: PIEZA | O36: 30161505 | Q36: MXN | R36: 431.25 | S36: Trasladado | T36: IVA | U36: 0.16 | V36: of:=[.R36]*0.16 -> 69 | W36: of:=[.R36]*1.16 -> 500.25 | X36: of:=[.AC36]/1.16 -> 630.396551724138 | Y36: Trasladado | Z36: IVA | AA36: 0.16 | AB36: of:=[.X36]*0.16 -> 100.863448275862 | AC36: 731.26 | AD36: FIBROCEMENTOS | AE36: MEXALIT INDUSTRIAL, S.A. DE C.V. | AL36: NO | AM36: SI | AN36: NO | AO36: 0.8 | AP36: 122 | AQ36: 244 | AR36: 5.7 | AS36: CEMPANEL
A37: 947623 | B37: CEMPANEL LISO 10MM | C37: PLACA DE FIBROCEMENTO DE 1.22 M X 2.44 44.60 KG | D37: Inventariable | M37: 21 | N37: PIEZA | O37: 30161505 | Q37: MXN | R37: 546.75 | S37: Trasladado | T37: IVA | U37: 0.16 | V37: of:=[.R37]*0.16 -> 87.48 | W37: of:=[.R37]*1.16 -> 634.23 | X37: of:=[.AC37]/1.16 -> 798.206896551724 | Y37: Trasladado | Z37: IVA | AA37: 0.16 | AB37: of:=[.X37]*0.16 -> 127.713103448276 | AC37: 925.92 | AD37: FIBROCEMENTOS | AE37: MEXALIT INDUSTRIAL, S.A. DE C.V. | AL37: NO | AM37: SI | AN37: NO | AO37: 1 | AP37: 122 | AQ37: 244 | AR37: 44.6 | AS37: CEMPANEL
A38: 947586 | B38: CEMPANEL LISO 12MM | C38: PLACA DE FIBROCEMENTO DE 1.22 M X 2.44 53.50 KG | D38: Inventariable | M38: 4 | N38: PIEZA | O38: 30161505 | Q38: MXN | R38: 655.5 | S38: Trasladado | T38: IVA | U38: 0.16 | V38: of:=[.R38]*0.16 -> 104.88 | W38: of:=[.R38]*1.16 -> 760.38 | X38: of:=[.AC38]/1.16 -> 957.01724137931 | Y38: Trasladado | Z38: IVA | AA38: 0.16 | AB38: of:=[.X38]*0.16 -> 153.12275862069 | AC38: 1110.14 | AD38: FIBROCEMENTOS | AE38: MEXALIT INDUSTRIAL, S.A. DE C.V. | AL38: NO | AM38: SI | AN38: NO | AO38: 1.2 | AP38: 122 | AQ38: 244 | AR38: 53.5 | AS38: CEMPANEL
A39: 947518 | B39: CEMPANEL LISO 18MM | C39: PLACA DE FIBROCEMENTO DE 1.22 M X 2.44 80.30 KG | D39: Inventariable | M39: 9 | N39: PIEZA | O39: 30161505 | Q39: MXN | R39: 985.5 | S39: Trasladado | T39: IVA | U39: 0.16 | V39: of:=[.R39]*0.16 -> 157.68 | W39: of:=[.R39]*1.16 -> 1143.18 | X39: of:=[.AC39]/1.16 -> 1438.79310344828 | Y39: Trasladado | Z39: IVA | AA39: 0.16 | AB39: of:=[.X39]*0.16 -> 230.206896551724 | AC39: 1669 | AD39: FIBROCEMENTOS | AE39: MEXALIT INDUSTRIAL, S.A. DE C.V. | AL39: NO | AM39: SI | AN39: NO | AO39: 1.8 | AP39: 122 | AQ39: 244 | AR39: 80.3 | AS39: CEMPANEL
A40: 1320644 | B40: PANEL LIGERO <<CEMROCK>> 10MM | C40: PLACA DE FIBROCEMENTO DE 1.22 M X 2.44 32.70 KG | D40: Inventariable | M40: 78 | N40: PIEZA | O40: 30161505 | Q40: MXN | R40: 432 | S40: Trasladado | T40: IVA | U40: 0.16 | V40: 69.12 | W40: 501.12 | X40: 627.72 | Y40: Trasladado | Z40: IVA | AA40: 0.16 | AB40: 99.3 | AC40: 727.02 | AD40: FIBROCEMENTOS | AE40: MEXALIT INDUSTRIAL, S.A. DE C.V. | AL40: NO | AM40: SI | AN40: NO | AO40: 1 | AP40: 122 | AQ40: 244 | AR40: 32.7 | AS40: CEMPANEL
A41: 948314 | B41: CEMPANEL BISELADO 12MM, 061X061 DE 6.70KG | C41: PLACA DE FIBROCEMENTO DE 0.61 X 0.61 | D41: Inventariable | M41: 0 | N41: PIEZA | O41: 30161505 | Q41: MXN | R41: 94.5 | S41: Trasladado | T41: IVA | U41: 0.16 | V41: of:=[.R41]*0.16 -> 15.12 | W41: of:=[.R41]*1.16 -> 109.62 | X41: of:=[.AC41]/1.16 -> 136.396551724138 | Y41: Trasladado | Z41: IVA | AA41: 0.16 | AB41: of:=[.X41]*0.16 -> 21.8234482758621 | AC41: 158.22 | AD41: FIBROCEMENTOS | AE41: MEXALIT INDUSTRIAL, S.A. DE C.V. | AL41: NO | AM41: SI | AN41: NO | AO41: 1.2 | AP41: 61 | AQ41: 61 | AR41: 6.7 | AS41: CEMPANEL
A42: 948073 | B42: CEMPANEL BISELADO 12MM, 061X1.22 DE 13.40 KG | C42: PLACA DE FIBROCEMENTO DE 0.61 X 1.22 M | D42: Inventariable | M42: 0 | N42: PIEZA | O42: 30161505 | Q42: MXN | R42: 189.75 | S42: Trasladado | T42: IVA | U42: 0.16 | V42: of:=[.R42]*0.16 -> 30.36 | W42: of:=[.R42]*1.16 -> 220.11 | X42: of:=[.AC42]/1.16 -> 273.793103448276 | Y42: Trasladado | Z42: IVA | AA42: 0.16 | AB42: of:=[.X42]*0.16 -> 43.8068965517242 | AC42: 317.6 | AD42: FIBROCEMENTOS | AE42: MEXALIT INDUSTRIAL, S.A. DE C.V. | AL42: NO | AM42: SI | AN42: NO | AO42: 1.2 | AP42: 61 | AQ42: 122 | AR42: 13.4 | AS42: CEMPANEL
A43: 947839 | B43: CEMPANEL BISELADO 12MM, 1.22X1.22X DE 26.80 KG | C43: PLACA DE FIBROCEMENTO DE 1.22 M X 1.22 M | D43: Inventariable | M43: 0 | N43: PIEZA | O43: 30161505 | Q43: MXN | R43: 379.5 | S43: Trasladado | T43: IVA | U43: 0.16 | V43: of:=[.R43]*0.16 -> 60.72 | W43: of:=[.R43]*1.16 -> 440.22 | X43: of:=[.AC43]/1.16 -> 547.586206896552 | Y43: Trasladado | Z43: IVA | AA43: 0.16 | AB43: of:=[.X43]*0.16 -> 87.6137931034483 | AC43: 635.2 | AD43: FIBROCEMENTOS | AE43: MEXALIT INDUSTRIAL, S.A. DE C.V. | AL43: NO | AM43: SI | AN43: NO | AO43: 1.2 | AP43: 122 | AQ43: 122 | AR43: 26.8 | AS43: CEMPANEL
A44: 947588 | B44: CEMPANEL BISELADO 12MM, 1.22X2.44 DE 53.50 KG | C44: PLACA DE FIBROCEMENTO DE 1.22 M X 2.44 | D44: Inventariable | M44: 0 | N44: PIEZA | O44: 30161505 | Q44: MXN | R44: 759.75 | S44: Trasladado | T44: IVA | U44: 0.16 | V44: of:=[.R44]*0.16 -> 121.56 | W44: of:=[.R44]*1.16 -> 881.31 | X44: of:=[.AC44]/1.16 -> 1096.01724137931 | Y44: Trasladado | Z44: IVA | AA44: 0.16 | AB44: of:=[.X44]*0.16 -> 175.36275862069 | AC44: 1271.38 | AD44: FIBROCEMENTOS | AE44: MEXALIT INDUSTRIAL, S.A. DE C.V. | AL44: NO | AM44: SI | AN44: NO | AO44: 1.2 | AP44: 122 | AQ44: 244 | AR44: 53.5 | AS44: CEMPANEL
A45: 947833 | B45: CEMPANEL RECTIFICADO 6MM | C45: PLACA DE FIBROCEMENTO DE 1.22 M X 2.44 | D45: Inventariable | M45: 0 | N45: PIEZA | O45: 30161505 | Q45: MXN | R45: 298.96 | S45: Trasladado | T45: IVA | U45: 0.16 | V45: of:=[.R45]*0.16 -> 47.8336 | W45: of:=[.R45]*1.16 -> 346.7936 | X45: of:=[.AC45]/1.16 -> 445.586206896552 | Y45: Trasladado | Z45: IVA | AA45: 0.16 | AB45: of:=[.X45]*0.16 -> 71.2937931034483 | AC45: 516.88 | AD45: FIBROCEMENTOS | AE45: MEXALIT INDUSTRIAL, S.A. DE C.V. | AL45: NO | AM45: SI | AN45: NO | AO45: 0.6 | AP45: 122 | AQ45: 244 | AR45: 26.8 | AS45: CEMPANEL
A46: 947710 | B46: CEMPANEL RECTIFICADO 8MM | C46: PLACA DE FIBROCEMENTO DE 1.22 M X 2.44 | D46: Inventariable | M46: 0 | N46: PIEZA | O46: 30161505 | Q46: MXN | R46: 466.5 | S46: Trasladado | T46: IVA | U46: 0.16 | V46: of:=[.R46]*0.16 -> 74.64 | W46: of:=[.R46]*1.16 -> 541.14 | X46: of:=[.AC46]/1.16 -> 677.396551724138 | Y46: Trasladado | Z46: IVA | AA46: 0.16 | AB46: of:=[.X46]*0.16 -> 108.383448275862 | AC46: 785.78 | AD46: FIBROCEMENTOS | AE46: MEXALIT INDUSTRIAL, S.A. DE C.V. | AL46: NO | AM46: SI | AN46: NO | AO46: 0.8 | AP46: 122 | AQ46: 244 | AR46: 35.7 | AS46: CEMPANEL
A47: 947617 | B47: CEMPANEL RECTIFICADO 12MM | C47: PLACA DE FIBROCEMENTO DE 1.22 M X 2.44 | D47: Inventariable | M47: 0 | N47: PIEZA | O47: 30161505 | Q47: MXN | R47: 574.5 | S47: Trasladado | T47: IVA | U47: 0.16 | V47: of:=[.R47]*0.16 -> 91.92 | W47: of:=[.R47]*1.16 -> 666.42 | X47: of:=[.AC47]/1.16 -> 826.724137931035 | Y47: Trasladado | Z47: IVA | AA47: 0.16 | AB47: of:=[.X47]*0.16 -> 132.275862068966 | AC47: 959 | AD47: FIBROCEMENTOS | AE47: MEXALIT INDUSTRIAL, S.A. DE C.V. | AL47: NO | AM47: SI | AN47: NO | AO47: 1.2 | AP47: 122 | AQ47: 244 | AR47: 44.6 | AS47: CEMPANEL
A48: 947581 | B48: CEMPANEL RECTIFICADO 18MM | C48: PLACA DE FIBROCEMENTO DE 1.22 M X 2.44 | D48: Inventariable | M48: 0 | N48: PIEZA | O48: 30161505 | Q48: MXN | R48: 684.75 | S48: Trasladado | T48: IVA | U48: 0.16 | V48: of:=[.R48]*0.16 -> 109.56 | W48: of:=[.R48]*1.16 -> 794.31 | X48: of:=[.AC48]/1.16 -> 996.017241379311 | Y48: Trasladado | Z48: IVA | AA48: 0.16 | AB48: of:=[.X48]*0.16 -> 159.36275862069 | AC48: 1155.38 | AD48: FIBROCEMENTOS | AE48: MEXALIT INDUSTRIAL, S.A. DE C.V. | AL48: NO | AM48: SI | AN48: NO | AO48: 1.8 | AP48: 122 | AQ48: 244 | AR48: 53.5 | AS48: CEMPANEL
A49: 979023 | B49: CEMPANEL RECTIFICADO BISELADO 12MM | C49: PLACA DE FIBROCEMENTO DE 0.66 X 1.22 M | D49: Inventariable | M49: 0 | N49: PIEZA | O49: 30161505 | Q49: MXN | R49: 253.5 | S49: Trasladado | T49: IVA | U49: 0.16 | V49: of:=[.R49]*0.16 -> 40.56 | W49: of:=[.R49]*1.16 -> 294.06 | X49: of:=[.AC49]/1.16 -> 358.793103448276 | Y49: Trasladado | Z49: IVA | AA49: 0.16 | AB49: of:=[.X49]*0.16 -> 57.4068965517241 | AC49: 416.2 | AD49: FIBROCEMENTOS | AE49: MEXALIT INDUSTRIAL, S.A. DE C.V. | AL49: NO | AM49: SI | AN49: NO | AO49: 1.2 | AP49: 61 | AQ49: 122 | AR49: 13.4 | AS49: CEMPANEL
A50: 977873 | B50: CEMPANEL RECTIFICADO BISELADO 12MM | C50: PLACA DE FIBROCEMENTO DE 1.22 M X 1.22 M | D50: Inventariable | M50: 0 | N50: PIEZA | O50: 30161505 | Q50: MXN | R50: 430.5 | S50: Trasladado | T50: IVA | U50: 0.16 | V50: of:=[.R50]*0.16 -> 68.88 | W50: of:=[.R50]*1.16 -> 499.38 | X50: of:=[.AC50]/1.16 -> 615.586206896552 | Y50: Trasladado | Z50: IVA | AA50: 0.16 | AB50: of:=[.X50]*0.16 -> 98.4937931034483 | AC50: 714.08 | AD50: FIBROCEMENTOS | AE50: MEXALIT INDUSTRIAL, S.A. DE C.V. | AL50: NO | AM50: SI | AN50: NO | AO50: 1.2 | AP50: 122 | AQ50: 122 | AR50: 26.8 | AS50: CEMPANEL
A51: 977874 | B51: CEMPANEL RECTIFICADO BISELADO 12MM | C51: PLACA DE FIBROCEMENTO DE 1.22 M X 2.44 | D51: Inventariable | M51: 0 | N51: PIEZA | O51: 30161505 | Q51: MXN | R51: 810.75 | S51: Trasladado | T51: IVA | U51: 0.16 | V51: of:=[.R51]*0.16 -> 129.72 | W51: of:=[.R51]*1.16 -> 940.47 | X51: of:=[.AC51]/1.16 -> 1164.01724137931 | Y51: Trasladado | Z51: IVA | AA51: 0.16 | AB51: of:=[.X51]*0.16 -> 186.24275862069 | AC51: 1350.26 | AD51: FIBROCEMENTOS | AE51: MEXALIT INDUSTRIAL, S.A. DE C.V. | AL51: NO | AM51: SI | AN51: NO | AO51: 1.2 | AP51: 122 | AQ51: 244 | AR51: 53.5 | AS51: CEMPANEL
A52: 977875 | B52: CEMPANEL RECTIFICADO BISELADO 12MM | C52: PLACA DE FIBROCEMENTO DE 1.22 M X 3.05 | D52: Inventariable | M52: 0 | N52: PIEZA | O52: 30161505 | Q52: MXN | R52: 1041.75 | S52: Trasladado | T52: IVA | U52: 0.16 | V52: of:=[.R52]*0.16 -> 166.68 | W52: of:=[.R52]*1.16 -> 1208.43 | X52: of:=[.AC52]/1.16 -> 1493.10344827586 | Y52: Trasladado | Z52: IVA | AA52: 0.16 | AB52: of:=[.X52]*0.16 -> 238.896551724138 | AC52: 1732 | AD52: FIBROCEMENTOS | AE52: MEXALIT INDUSTRIAL, S.A. DE C.V. | AL52: NO | AM52: SI | AN52: NO | AO52: 1.2 | AP52: 122 | AQ52: 305 | AR52: 66.9 | AS52: CEMPANEL
A53: 947835 | B53: CEMPANEL CEDAR 6MM | C53: PLACA DE FIBROCEMENTO DE 1.22 M X 2.44 | D53: Inventariable | M53: 48 | N53: PIEZA | O53: 30161505 | Q53: MXN | R53: 327.75 | S53: Trasladado | T53: IVA | U53: 0.16 | V53: of:=[.R53]*0.16 -> 52.44 | W53: of:=[.R53]*1.16 -> 380.19 | X53: of:=[.AC53]/1.16 -> 478.586206896552 | Y53: Trasladado | Z53: IVA | AA53: 0.16 | AB53: of:=[.X53]*0.16 -> 76.5737931034483 | AC53: 555.16 | AD53: FIBROCEMENTOS | AE53: MEXALIT INDUSTRIAL, S.A. DE C.V. | AL53: NO | AM53: SI | AN53: NO | AO53: 0.6 | AP53: 122 | AQ53: 244 | AR53: 26.8 | AS53: CEMPANEL
A54: 947712 | B54: CEMPANEL CEDAR 8MM | C54: PLACA DE FIBROCEMENTO DE 1.22 M X 2.44 | D54: Inventariable | M54: 0 | N54: PIEZA | O54: 30161505 | Q54: MXN | R54: 438 | S54: Trasladado | T54: IVA | U54: 0.16 | V54: of:=[.R54]*0.16 -> 70.08 | W54: of:=[.R54]*1.16 -> 508.08 | X54: of:=[.AC54]/1.16 -> 639.655172413793 | Y54: Trasladado | Z54: IVA | AA54: 0.16 | AB54: of:=[.X54]*0.16 -> 102.344827586207 | AC54: 742 | AD54: FIBROCEMENTOS | AE54: MEXALIT INDUSTRIAL, S.A. DE C.V. | AL54: NO | AM54: SI | AN54: NO | AO54: 0.8 | AP54: 122 | AQ54: 244 | AR54: 35.7 | AS54: CEMPANEL
A55: 947620 | B55: CEMPANEL CEDAR 10MM | C55: PLACA DE FIBROCEMENTO DE 1.22 M xX2.44 | D55: Inventariable | N55: PIEZA | O55: 30161505 | Q55: MXN | R55: 474 | S55: Trasladado | T55: IVA | U55: 0.16 | V55: of:=[.R55]*0.16 -> 75.84 | W55: of:=[.R55]*1.16 -> 549.84 | X55: of:=[.AC55]/1.16 -> 701.206896551724 | Y55: Trasladado | Z55: IVA | AA55: 0.16 | AB55: of:=[.X55]*0.16 -> 112.193103448276 | AC55: 813.4 | AD55: FIBROCEMENTOS | AE55: MEXALIT INDUSTRIAL, S.A. DE C.V. | AL55: NO | AM55: SI | AN55: NO | AO55: 1 | AP55: 122 | AQ55: 244 | AR55: 44.6 | AS55: CEMPANEL
A56: 947583 | B56: CEMPANEL CEDAR 12MM | C56: PLACA DE FIBROCEMENTO DE 1.22 M X 2.44 | D56: Inventariable | N56: PIEZA | O56: 30161505 | Q56: MXN | R56: 655.5 | S56: Trasladado | T56: IVA | U56: 0.16 | V56: of:=[.R56]*0.16 -> 104.88 | W56: of:=[.R56]*1.16 -> 760.38 | X56: of:=[.AC56]/1.16 -> 957.01724137931 | Y56: Trasladado | Z56: IVA | AA56: 0.16 | AB56: of:=[.X56]*0.16 -> 153.12275862069 | AC56: 1110.14 | AD56: FIBROCEMENTOS | AE56: MEXALIT INDUSTRIAL, S.A. DE C.V. | AL56: NO | AM56: SI | AN56: NO | AO56: 1.2 | AP56: 122 | AQ56: 244 | AR56: 53.5 | AS56: CEMPANEL
A57: 948271 | B57: CEMPLANK CEDAR 8MM | C57: DUELA DE FIBROCEMENTO DE 0.19 X 3.66 | D57: Inventariable | M57: 118 | N57: PIEZA | O57: 30161505 | Q57: MXN | R57: 113.25 | S57: Trasladado | T57: IVA | U57: 0.16 | V57: of:=[.R57]*0.16 -> 18.12 | W57: of:=[.R57]*1.16 -> 131.37 | X57: of:=[.AC57]/1.16 -> 163.793103448276 | Y57: Trasladado | Z57: IVA | AA57: 0.16 | AB57: of:=[.X57]*0.16 -> 26.2068965517241 | AC57: 190 | AD57: FIBROCEMENTOS | AE57: MEXALIT INDUSTRIAL, S.A. DE C.V. | AL57: NO | AM57: SI | AN57: NO | AO57: 0.8 | AP57: 122 | AQ57: 244 | AR57: 80.3 | AS57: CEMPANEL
A58: 1319857 | B58: CELOSIA IMAGE RECEPCION 18MM | C58: PLACA DE FIBROCEMENTO DE 1.22 M X 2.44 | D58: Inventariable | M58: 0 | N58: PIEZA | O58: 30161505 | Q58: MXN | R58: 2309.25 | S58: Trasladado | T58: IVA | U58: 0.16 | V58: of:=[.R58]*0.16 -> 369.48 | W58: of:=[.R58]*1.16 -> 2678.73 | X58: of:=[.AC58]/1.16 -> 3224.37068965517 | Y58: Trasladado | Z58: IVA | AA58: 0.16 | AB58: of:=[.X58]*0.16 -> 515.899310344828 | AC58: 3740.27 | AD58: FIBROCEMENTOS | AE58: MEXALIT INDUSTRIAL, S.A. DE C.V. | AL58: NO | AM58: SI | AN58: NO | AO58: 1.8 | AP58: 122 | AQ58: 244 | AR58: 80.3 | AS58: CEMPANEL
A59: 1319858 | B59: CELOSIA IMAGE TRIANGULO 18MM | C59: PLACA DE FIBROCEMENTO DE 1.22 M X 2.44 | D59: Inventariable | M59: 0 | N59: PIEZA | O59: 30161505 | Q59: MXN | R59: 1921.5 | S59: Trasladado | T59: IVA | U59: 0.16 | V59: of:=[.R59]*0.16 -> 307.44 | W59: of:=[.R59]*1.16 -> 2228.94 | X59: of:=[.AC59]/1.16 -> 2707.37068965517 | Y59: Trasladado | Z59: IVA | AA59: 0.16 | AB59: of:=[.X59]*0.16 -> 433.179310344828 | AC59: 3140.55 | AD59: FIBROCEMENTOS | AE59: MEXALIT INDUSTRIAL, S.A. DE C.V. | AL59: NO | AM59: SI | AN59: NO | AO59: 1.8 | AP59: 122 | AQ59: 244 | AR59: 80.3 | AS59: CEMPANEL
A60: 1319859 | B60: CELOSIA IMAGE CIRCULOS 18MM | C60: PLACA DE FIBROCEMENTO DE 1.22 M X 2.44 | D60: Inventariable | M60: 0 | N60: PIEZA | O60: 30161505 | Q60: MXN | R60: 1706.25 | S60: Trasladado | T60: IVA | U60: 0.16 | V60: of:=[.R60]*0.16 -> 273 | W60: of:=[.R60]*1.16 -> 1979.25 | X60: of:=[.AC60]/1.16 -> 2420.37068965517 | Y60: Trasladado | Z60: IVA | AA60: 0.16 | AB60: of:=[.X60]*0.16 -> 387.259310344828 | AC60: 2807.63 | AD60: FIBROCEMENTOS | AE60: MEXALIT INDUSTRIAL, S.A. DE C.V. | AL60: NO | AM60: SI | AN60: NO | AO60: 1.8 | AP60: 122 | AQ60: 244 | AR60: 80.3 | AS60: CEMPANEL
A61: 1319860 | B61: CELOSIA IMAGE MEDIO CIRCULO 18MM | C61: PLACA DE FIBROCEMENTO DE 1.22 M X 2.44 | D61: Inventariable | M61: 0 | N61: PIEZA | O61: 30161505 | Q61: MXN | R61: 2298 | S61: Trasladado | T61: IVA | U61: 0.16 | V61: of:=[.R61]*0.16 -> 367.68 | W61: of:=[.R61]*1.16 -> 2665.68 | X61: of:=[.AC61]/1.16 -> 3209.48275862069 | Y61: Trasladado | Z61: IVA | AA61: 0.16 | AB61: of:=[.X61]*0.16 -> 513.51724137931 | AC61: 3723 | AD61: FIBROCEMENTOS | AE61: MEXALIT INDUSTRIAL, S.A. DE C.V. | AL61: NO | AM61: SI | AN61: NO | AO61: 1.8 | AP61: 122 | AQ61: 244 | AR61: 80.3 | AS61: CEMPANEL
A62: 1319861 | B62: CELOSIA IMAGE PROCSA 18MM | C62: PLACA DE FIBROCEMENTO DE 1.22 M X 2.44 | D62: Inventariable | M62: 0 | N62: PIEZA | O62: 30161505 | Q62: MXN | R62: 2010.75 | S62: Trasladado | T62: IVA | U62: 0.16 | V62: of:=[.R62]*0.16 -> 321.72 | W62: of:=[.R62]*1.16 -> 2332.47 | X62: of:=[.AC62]/1.16 -> 2826.37068965517 | Y62: Trasladado | Z62: IVA | AA62: 0.16 | AB62: of:=[.X62]*0.16 -> 452.219310344828 | AC62: 3278.59 | AD62: FIBROCEMENTOS | AE62: MEXALIT INDUSTRIAL, S.A. DE C.V. | AL62: NO | AM62: SI | AN62: NO | AO62: 1.8 | AP62: 122 | AQ62: 244 | AR62: 80.3 | AS62: CEMPANEL
A63: 947709 | B63: ADHEPANEL 8MM | C63: PLACA DE FIBROCEMENTO DE 1.22 M X 2.44 | D63: Inventariable | M63: 0 | N63: PIEZA | O63: 30161505 | Q63: MXN | R63: 431.25 | S63: Trasladado | T63: IVA | U63: 0.16 | V63: of:=[.R63]*0.16 -> 69 | W63: of:=[.R63]*1.16 -> 500.25 | X63: of:=[.AC63]/1.16 -> 630.396551724138 | Y63: Trasladado | Z63: IVA | AA63: 0.16 | AB63: of:=[.X63]*0.16 -> 100.863448275862 | AC63: 731.26 | AD63: FIBROCEMENTOS | AE63: MEXALIT INDUSTRIAL, S.A. DE C.V. | AL63: NO | AM63: SI | AN63: NO | AO63: 0.8 | AP63: 122 | AQ63: 244 | AR63: 35.7 | AS63: CEMPANEL
A64: 947616 | B64: ADHEPANEL 10MM | C64: PLACA DE FIBROCEMENTO DE 1.22 M X 2.44 | D64: Inventariable | M64: 0 | N64: PIEZA | O64: 30161505 | Q64: MXN | R64: 539.25 | S64: Trasladado | T64: IVA | U64: 0.16 | V64: of:=[.R64]*0.16 -> 86.28 | W64: of:=[.R64]*1.16 -> 625.53 | X64: of:=[.AC64]/1.16 -> 788.206896551724 | Y64: Trasladado | Z64: IVA | AA64: 0.16 | AB64: of:=[.X64]*0.16 -> 126.113103448276 | AC64: 914.32 | AD64: FIBROCEMENTOS | AE64: MEXALIT INDUSTRIAL, S.A. DE C.V. | AL64: NO | AM64: SI | AN64: NO | AO64: 1 | AP64: 122 | AQ64: 244 | AR64: 44.6 | AS64: CEMPANEL
A65: 947579 | B65: ADHEPANEL 12MM | C65: PLACA DE FIBROCEMENTO DE 1.22 M X 2.44 | D65: Inventariable | M65: 0 | N65: PIEZA | O65: 30161505 | Q65: MXN | R65: 648.75 | S65: Trasladado | T65: IVA | U65: 0.16 | V65: of:=[.R65]*0.16 -> 103.8 | W65: of:=[.R65]*1.16 -> 752.55 | X65: of:=[.AC65]/1.16 -> 948.275862068966 | Y65: Trasladado | Z65: IVA | AA65: 0.16 | AB65: of:=[.X65]*0.16 -> 151.724137931035 | AC65: 1100 | AD65: FIBROCEMENTOS | AE65: MEXALIT INDUSTRIAL, S.A. DE C.V. | AL65: NO | AM65: SI | AN65: NO | AO65: 1.2 | AP65: 122 | AQ65: 244 | AR65: 53.5 | AS65: CEMPANEL
A66: 982315 | B66: PLYDECK JS 30MM | C66: DUELA 0.15 X 3.66M | D66: Inventariable | M66: 0 | N66: PIEZA | O66: 30161720 | Q66: MXN | R66: 537.75 | S66: Trasladado | T66: IVA | U66: 0.16 | V66: of:=[.R66]*0.16 -> 86.04 | W66: of:=[.R66]*1.16 -> 623.79 | X66: of:=[.AC66]/1.16 -> 749.163793103448 | Y66: Trasladado | Z66: IVA | AA66: 0.16 | AB66: of:=[.X66]*0.16 -> 119.866206896552 | AC66: 869.03 | AD66: FIBROCEMENTOS | AE66: MEXALIT INDUSTRIAL, S.A. DE C.V. | AL66: NO | AM66: SI | AN66: NO | AO66: 30 | AP66: 0.15 | AQ66: 3.66 | AR66: 20.73 | AS66: CEMPANEL
A67: 982285 | B67: CLIP PARA DECK TORN P/BROCA P/METAL | C67: CLIP PLASTICO DE FIJACION INTERMEDIO | D67: Inventariable | M67: 47 | N67: PIEZA | O67: 31163230 | Q67: MXN | R67: 2.87 | S67: Trasladado | T67: IVA | U67: 0.16 | V67: of:=[.R67]*0.16 -> 0.4592 | W67: of:=[.R67]*1.16 -> 3.3292 | X67: of:=[.AC67]/1.16 -> 3.82758620689655 | Y67: Trasladado | Z67: IVA | AA67: 0.16 | AB67: of:=[.X67]*0.16 -> 0.612413793103448 | AC67: 4.44 | AD67: CLIP | AE67: MEXALIT INDUSTRIAL, S.A. DE C.V. | AL67: NO | AM67: SI | AN67: NO | AO67: 1.5 | AP67: 1.03 | AQ67: 4.08 | AR67: 0.0004 | AS67: CEMPANEL
A68: 973744 | B68: CLIP PARA DECK UNIVERSAL TORN P/MADERA | C68: CLIP PARA DECK UNIVERSA | D68: Inventariable | N68: PIEZA | O68: 31163229 | Q68: MXN | R68: 30.26 | S68: Trasladado | T68: IVA | U68: 0.16 | V68: of:=[.R68]*0.16 -> 4.8416 | W68: of:=[.R68]*1.16 -> 35.1016 | X68: of:=[.AC68]/1.16 -> 30.2586206896552 | Y68: Trasladado | Z68: IVA | AA68: 0.16 | AB68: of:=[.X68]*0.16 -> 4.84137931034483 | AC68: 35.1 | AD68: CLIP | AE68: MEXALIT INDUSTRIAL, S.A. DE C.V. | AL68: NO | AM68: SI | AN68: NO | AS68: CEMPANEL
A69: 982292 | B69: CLIP ARRANQUE DECK TORN P/BROCA P/METAL | C69: CLIP ARRANQUE PARA DECK PARA METAL | D69: Inventariable | M69: 100 | N69: PIEZA | O69: 31163229 | Q69: MXN | R69: 23.67 | S69: Trasladado | T69: IVA | U69: 0.16 | V69: of:=[.R69]*0.16 -> 3.7872 | W69: of:=[.R69]*1.16 -> 27.4572 | X69: of:=[.AC69]/1.16 -> 31.8965517241379 | Y69: Trasladado | Z69: IVA | AA69: 0.16 | AB69: of:=[.X69]*0.16 -> 5.10344827586207 | AC69: 37 | AD69: CLIP | AE69: MEXALIT INDUSTRIAL, S.A. DE C.V. | AL69: NO | AM69: SI | AN69: NO | AO69: 0.9 | AP69: 0.26 | AQ69: 0.26 | AR69: 0.0002 | AS69: CEMPANEL
A70: 66967 | B70: TORNILLO PUNTA DE BROCA AVELLANADOR 1-1/4" | C70: TORNILLO ACABADO CERAMICO PARA CEMPANEL | D70: Inventariable | M70: 0 | N70: PIEZA | O70: 31161500 | Q70: MXN | R70: 0.57 | S70: Trasladado | T70: IVA | U70: 0.16 | V70: of:=[.R70]*0.16 -> 0.0912 | W70: of:=[.R70]*1.16 -> 0.6612 | X70: of:=[.AC70]/1.16 -> 0.758620689655172 | Y70: Trasladado | Z70: IVA | AA70: 0.16 | AB70: of:=[.X70]*0.16 -> 0.121379310344828 | AC70: 0.88 | AD70: TORNILLOS | AE70: MEXALIT INDUSTRIAL, S.A. DE C.V. | AL70: NO | AM70: SI | AN70: NO | AO70: 0.4 | AP70: 0.4 | AQ70: 3.17 | AR70: 0.0003 | AS70: CEMPANEL
A71: 66968 | B71: TORNILLO PUNTA DE BROCA AVELLANADOR 1" | C71: TORNILLO ACABADO CERAMICO PARA CEMPANEL | D71: Inventariable | M71: 0 | N71: PIEZA | O71: 31161500 | Q71: MXN | R71: 0.57 | S71: Trasladado | T71: IVA | U71: 0.16 | V71: of:=[.R71]*0.16 -> 0.0912 | W71: of:=[.R71]*1.16 -> 0.6612 | X71: of:=[.AC71]/1.16 -> 0.758620689655172 | Y71: Trasladado | Z71: IVA | AA71: 0.16 | AB71: of:=[.X71]*0.16 -> 0.121379310344828 | AC71: 0.88 | AD71: TORNILLOS | AE71: MEXALIT INDUSTRIAL, S.A. DE C.V. | AL71: NO | AM71: SI | AN71: NO | AO71: 0.4 | AP71: 0.4 | AQ71: 2.5 | AR71: 0.0002 | AS71: CEMPANEL
A72: 66776 | B72: CINTA FIBRA DE VIDRIO (23 m x 15 CM) | C72: SE USA COMO OPCIÃN A LAS TRADICIONALES CINTAS DE PAPEL QUE SE EMPLEAN PARA LOS APLACADOS DE CARTÃN-YESO, AUNQUE TAMBIÃN SE UTILIZA COMO MATERIAL PARA LA REPARACIÃN DE GRIETAS EN PAREDES. | D72: Inventariable | M72: 0 | N72: PIEZA | O72: 31201507 | Q72: MXN | R72: 101.25 | S72: Trasladado | T72: IVA | U72: 0.16 | V72: of:=[.R72]*0.16 -> 16.2 | W72: of:=[.R72]*1.16 -> 117.45 | X72: of:=[.AC72]/1.16 -> 136.551724137931 | Y72: Trasladado | Z72: IVA | AA72: 0.16 | AB72: of:=[.X72]*0.16 -> 21.848275862069 | AC72: 158.4 | AD72: CINTAS | AE72: MEXALIT INDUSTRIAL, S.A. DE C.V. | AL72: NO | AM72: SI | AN72: NO | AO72: 15 | AP72: 23 | AQ72: 23 | AR72: 0.326 | AS72: CEMPANEL
A73: SEC9137 | B73: CINTA FIBRA DE VIDRIO (4" x 45 M) AUTOADHERIBLE (BARI) | C73: SE USA COMO OPCIÃN A LAS TRADICIONALES CINTAS DE PAPEL QUE SE EMPLEAN PARA LOS APLACADOS DE CARTÃN-YESO, AUNQUE TAMBIÃN SE UTILIZA COMO MATERIAL PARA LA REPARACIÃN DE GRIETAS EN PAREDES. | D73: Inventariable | M73: 44 | N73: PIEZA | O73: 31201507 | Q73: MXN | R73: 49.49 | S73: Trasladado | T73: IVA | U73: 0.16 | V73: of:=[.R73]*0.16 -> 7.9184 | W73: of:=[.R73]*1.16 -> 57.4084 | X73: of:=[.AC73]/1.16 -> 69.2844827586207 | Y73: Trasladado | Z73: IVA | AA73: 0.16 | AB73: of:=[.X73]*0.16 -> 11.0855172413793 | AC73: 80.37 | AD73: CINTAS | AL73: NO | AM73: SI | AN73: NO | AO73: 10.16 | AP73: 45 | AQ73: 45 | AR73: 3 | AS73: BARI
A74: 948612 | B74: RESANADOR COLORCEL APM 1 LITRO | C74: PASTA PARA RESANE | D74: Inventariable | M74: 1 | N74: PIEZA | O74: 31201602 | Q74: MXN | R74: 50.25 | S74: Trasladado | T74: IVA | U74: 0.16 | V74: of:=[.R74]*0.16 -> 8.04 | W74: of:=[.R74]*1.16 -> 58.29 | X74: of:=[.AC74]/1.16 -> 69.8706896551724 | Y74: Trasladado | Z74: IVA | AA74: 0.16 | AB74: of:=[.X74]*0.16 -> 11.1793103448276 | AC74: 81.05 | AD74: PASTAS | AE74: MEXALIT INDUSTRIAL, S.A. DE C.V. | AL74: NO | AM74: SI | AN74: NO | AO74: 12 | AP74: 13 | AQ74: 12 | AR74: 3 | AS74: CEMPANEL
A75: 982801 | B75: SELLADOR PARA JUNTAS-HIBRIDO | C75: PASTA PARA JUNTAS | D75: Inventariable | M75: 0 | N75: PIEZA | O75: 31201600 | Q75: MXN | R75: 336.75 | S75: Trasladado | T75: IVA | U75: 0.16 | V75: of:=[.R75]*0.16 -> 53.88 | W75: of:=[.R75]*1.16 -> 390.63 | X75: of:=[.AC75]/1.16 -> 450.862068965517 | Y75: Trasladado | Z75: IVA | AA75: 0.16 | AB75: of:=[.X75]*0.16 -> 72.1379310344828 | AC75: 523 | AD75: PASTAS | AE75: MEXALIT INDUSTRIAL, S.A. DE C.V. | AL75: NO | AM75: SI | AN75: NO | AO75: 5 | AP75: 32 | AQ75: 32 | AR75: 1.6 | AS75: CEMPANEL
A76: 965645 | B76: BASE COAT HR CUB | C76: ES UNA PASTA ESPECIALMENTE DISEÃADA PARA EL TRATAMIENTO DE JUNTAS INVISIBLES | D76: Inventariable | M76: 0 | N76: CUBETA | O76: 31201600 | Q76: MXN | R76: 655.5 | S76: Trasladado | T76: IVA | U76: 0.16 | V76: of:=[.R76]*0.16 -> 104.88 | W76: of:=[.R76]*1.16 -> 760.38 | X76: of:=[.AC76]/1.16 -> 875.862068965517 | Y76: Trasladado | Z76: IVA | AA76: 0.16 | AB76: of:=[.X76]*0.16 -> 140.137931034483 | AC76: 1016 | AD76: PASTAS | AE76: MEXALIT INDUSTRIAL, S.A. DE C.V. | AL76: NO | AM76: SI | AN76: NO | AO76: 31 | AP76: 37 | AQ76: 31 | AR76: 25 | AS76: CEMPANEL
A77: 970214 | B77: PASTA PARA FLOTEADO CEMPANEL CUB 30 KG | C77: ES UNA PASTA ESPECIAL DISEÃADA PARA EL TRATAMIENTO DE SUPERFICIES EN PLACAS DE CEMPANELÂ® ESTÃNDAR EN APLICACIONES DE MUROS, FACHADAS Y PLAFONES; DE FÃCIL APLICACIÃN Y MANEJABILIDAD PARA NIVELAR O UNIFORMIZAR LA SUPERFICIE DESPUÃS DEL TRATAMIENTO DE JUNTAS. | D77: Inventariable | M77: 0 | N77: CUBETA | O77: 31201602 | Q77: MXN | R77: 646.5 | S77: Trasladado | T77: IVA | U77: 0.16 | V77: of:=[.R77]*0.16 -> 103.44 | W77: of:=[.R77]*1.16 -> 749.94 | X77: of:=[.AC77]/1.16 -> 863.793103448276 | Y77: Trasladado | Z77: IVA | AA77: 0.16 | AB77: of:=[.X77]*0.16 -> 138.206896551724 | AC77: 1002 | AD77: PASTAS | AE77: MEXALIT INDUSTRIAL, S.A. DE C.V. | AL77: NO | AM77: SI | AN77: NO | AO77: 31 | AP77: 37 | AQ77: 31 | AR77: 30 | AS77: CEMPANEL
A78: 947798 | B78: PASTA EXTERIOR GRANO FINO BLANCA | C78: ES UNA PASTA ESPECIAL DISEÃADA PARA EL TRATAMIENTO DE SUPERFICIES EN PLACAS DE CEMPANELÂ® ESTÃNDAR EN APLICACIONES DE MUROS, FACHADAS Y PLAFONES; DE FÃCIL APLICACIÃN Y MANEJABILIDAD PARA NIVELAR O UNIFORMIZAR LA SUPERFICIE DESPUÃS DEL TRATAMIENTO DE JUNTAS. | D78: Inventariable | M78: 0 | N78: CUBETA | O78: 31201602 | Q78: MXN | R78: 694.5 | S78: Trasladado | T78: IVA | U78: 0.16 | V78: of:=[.R78]*0.16 -> 111.12 | W78: of:=[.R78]*1.16 -> 805.62 | X78: of:=[.AC78]/1.16 -> 927.586206896552 | Y78: Trasladado | Z78: IVA | AA78: 0.16 | AB78: of:=[.X78]*0.16 -> 148.413793103448 | AC78: 1076 | AD78: PASTAS | AE78: MEXALIT INDUSTRIAL, S.A. DE C.V. | AL78: NO | AM78: SI | AN78: NO | AO78: 31 | AP78: 37 | AQ78: 31 | AR78: 30 | AS78: CEMPANEL
A79: 970099 | B79: HIDROFUGANTE CEMPANEL CUB 19 LT | C79: SELLADOR PARA CEMPANEL | D79: Inventariable | M79: 0 | N79: CUBETA | O79: 12164901 | Q79: MXN | R79: 2735.25 | S79: Trasladado | T79: IVA | U79: 0.16 | V79: of:=[.R79]*0.16 -> 437.64 | W79: of:=[.R79]*1.16 -> 3172.89 | X79: of:=[.AC79]/1.16 -> 3648.55172413793 | Y79: Trasladado | Z79: IVA | AA79: 0.16 | AB79: of:=[.X79]*0.16 -> 583.768275862069 | AC79: 4232.32 | AD79: SELLADORES Y ADITIVOS | AE79: MEXALIT INDUSTRIAL, S.A. DE C.V. | AL79: NO | AM79: SI | AN79: NO | AO79: 31 | AP79: 37 | AQ79: 31 | AR79: 19 | AS79: CEMPANEL
A80: MSC7219BCG | B80: BASE COAT, GRIS | C80: RECUBRIMIENTO BASE PARA FONDEO DE SUPERFICIES POROSA. | D80: Inventariable | M80: 54 | N80: SACO | O80: 30111504 | Q80: MXN | R80: 169.4 | S80: Trasladado | T80: IVA | U80: 0.16 | V80: of:=[.R80]*0.16 -> 27.104 | W80: of:=[.R80]*1.16 -> 196.504 | X80: of:=[.AC80]/1.16 -> 237.163793103448 | Y80: Trasladado | Z80: IVA | AA80: 0.16 | AB80: of:=[.X80]*0.16 -> 37.9462068965517 | AC80: 275.11 | AD80: MORTEROS | AE80: MORTEROS SECOS DEL CARIBE, S.A. DE C.V. | AL80: NO | AM80: SI | AN80: NO | AO80: 9 | AP80: 30 | AQ80: 50 | AR80: 20 | AS80: MOSECA
A81: MSC27218RG | B81: REPELLA-MOS GRIS (GRUESO) MANUAL | C81: REPELLO GRUESO | D81: Inventariable | M81: 45 | N81: SACO | O81: 30111504 | Q81: MXN | R81: 93.4 | S81: Trasladado | T81: IVA | U81: 0.16 | V81: of:=[.R81]*0.16 -> 14.944 | W81: of:=[.R81]*1.16 -> 108.344 | X81: of:=[.AC81]/1.16 -> 125.301724137931 | Y81: Trasladado | Z81: IVA | AA81: 0.16 | AB81: of:=[.X81]*0.16 -> 20.048275862069 | AC81: 145.35 | AD81: MORTEROS | AE81: MORTEROS SECOS DEL CARIBE, S.A. DE C.V. | AL81: NO | AM81: SI | AN81: NO | AO81: 10 | AP81: 58 | AQ81: 36 | AR81: 40 | AS81: MOSECA
A82: MSC27218MF | B82: MASILLA-MOS CON FIBRA | C82: RECUBRIMIENTO DE BLOCK, TABIQUE Y CONCRETO | D82: Inventariable | M82: 0 | N82: SACO | O82: 30111504 | Q82: MXN | R82: 80.2 | S82: Trasladado | T82: IVA | U82: 0.16 | V82: of:=[.R82]*0.16 -> 12.832 | W82: of:=[.R82]*1.16 -> 93.032 | X82: of:=[.AC82]/1.16 -> 112.275862068966 | Y82: Trasladado | Z82: IVA | AA82: 0.16 | AB82: of:=[.X82]*0.16 -> 17.9641379310345 | AC82: 130.24 | AD82: OXIDANTES DE CONCRETO | AE82: MORTEROS SECOS DEL CARIBE, S.A. DE C.V. | AL82: NO | AM82: SI | AN82: NO | AO82: 10 | AP82: 58 | AQ82: 36 | AR82: 40 | AS82: MOSECA
A83: 24022016 | B83: NATURAL STAIN GALÃN 3.8 LT CAOBA | C83: OXIDANTE PARA CONCRETO COLOR CAOBA | D83: Inventariable | M83: 3 | N83: GALON | O83: 12171511 | Q83: MXN | R83: 652.19 | S83: Trasladado | T83: IVA | U83: 0.16 | V83: of:=[.R83]*0.16 -> 104.3504 | W83: of:=[.R83]*1.16 -> 756.5404 | X83: of:=[.AC83]/1.16 -> 945.827586206897 | Y83: Trasladado | Z83: IVA | AA83: 0.16 | AB83: of:=[.X83]*0.16 -> 151.332413793103 | AC83: 1097.16 | AD83: OXIDANTES DE CONCRETO | AE83: BLENDER PENINSULA, S.A. DE C.V. | AL83: NO | AM83: SI | AN83: NO | AO83: 15 | AP83: 19 | AQ83: 18 | AR83: 3.8 | AS83: BLENDER
A84: 240220161 | B84: NATURAL STAIN GALÃN 3.8 LT TERRACOTA | C84: OXIDANTE PARA CONCRETO COLOR TERRACOTA | D84: Inventariable | M84: 0 | N84: GALON | O84: 12171511 | Q84: MXN | R84: 652.19 | S84: Trasladado | T84: IVA | U84: 0.16 | V84: of:=[.R84]*0.16 -> 104.3504 | W84: of:=[.R84]*1.16 -> 756.5404 | X84: of:=[.AC84]/1.16 -> 945.827586206897 | Y84: Trasladado | Z84: IVA | AA84: 0.16 | AB84: of:=[.X84]*0.16 -> 151.332413793103 | AC84: 1097.16 | AD84: OXIDANTES DE CONCRETO | AE84: BLENDER PENINSULA, S.A. DE C.V. | AL84: NO | AM84: SI | AN84: NO | AO84: 15 | AP84: 19 | AQ84: 18 | AR84: 3.8 | AS84: BLENDER
A85: 240220162 | B85: NATURAL STAIN GALÃN 3.8 LT NOGAL | C85: OXIDANTE PARA CONCRETO COLOR NOGAL | D85: Inventariable | M85: 3 | N85: GALON | O85: 12171511 | Q85: MXN | R85: 652.19 | S85: Trasladado | T85: IVA | U85: 0.16 | V85: of:=[.R85]*0.16 -> 104.3504 | W85: of:=[.R85]*1.16 -> 756.5404 | X85: of:=[.AC85]/1.16 -> 945.827586206897 | Y85: Trasladado | Z85: IVA | AA85: 0.16 | AB85: of:=[.X85]*0.16 -> 151.332413793103 | AC85: 1097.16 | AD85: OXIDANTES DE CONCRETO | AE85: BLENDER PENINSULA, S.A. DE C.V. | AL85: NO | AM85: SI | AN85: NO | AO85: 15 | AP85: 19 | AQ85: 18 | AR85: 3.8 | AS85: BLENDER
A86: 240220163 | B86: NATURAL STAIN GALÃN 3.8 LT LIME GREEN | C86: OXIDANTE PARA CONCRETO COLOR LIME GREEN | D86: Inventariable | M86: 1 | N86: GALON | O86: 12171511 | Q86: MXN | R86: 652.19 | S86: Trasladado | T86: IVA | U86: 0.16 | V86: of:=[.R86]*0.16 -> 104.3504 | W86: of:=[.R86]*1.16 -> 756.5404 | X86: of:=[.AC86]/1.16 -> 945.827586206897 | Y86: Trasladado | Z86: IVA | AA86: 0.16 | AB86: of:=[.X86]*0.16 -> 151.332413793103 | AC86: 1097.16 | AD86: OXIDANTES DE CONCRETO | AE86: BLENDER PENINSULA, S.A. DE C.V. | AL86: NO | AM86: SI | AN86: NO | AO86: 15 | AP86: 19 | AQ86: 18 | AR86: 3.8 | AS86: BLENDER
A87: 240220166 | B87: NATURAL STAIN GALÃN 3.8 LT BURNED RED | C87: OXIDANTE PARA CONCRETO COLOR BURNED RED | D87: Inventariable | M87: 0 | N87: GALON | O87: 12171511 | Q87: MXN | R87: 652.19 | S87: Trasladado | T87: IVA | U87: 0.16 | V87: of:=[.R87]*0.16 -> 104.3504 | W87: of:=[.R87]*1.16 -> 756.5404 | X87: of:=[.AC87]/1.16 -> 945.827586206897 | Y87: Trasladado | Z87: IVA | AA87: 0.16 | AB87: of:=[.X87]*0.16 -> 151.332413793103 | AC87: 1097.16 | AD87: OXIDANTES DE CONCRETO | AE87: BLENDER PENINSULA, S.A. DE C.V. | AL87: NO | AM87: SI | AN87: NO | AO87: 15 | AP87: 19 | AQ87: 18 | AR87: 3.8 | AS87: BLENDER
A88: 240220167 | B88: NATURAL STAIN GALÃN 3.8 LT CHOCOLATE | C88: OXIDANTE PARA CONCRETO COLOR CHOCOLATE | D88: Inventariable | M88: 0 | N88: GALON | O88: 12171511 | Q88: MXN | R88: 652.19 | S88: Trasladado | T88: IVA | U88: 0.16 | V88: of:=[.R88]*0.16 -> 104.3504 | W88: of:=[.R88]*1.16 -> 756.5404 | X88: of:=[.AC88]/1.16 -> 945.827586206897 | Y88: Trasladado | Z88: IVA | AA88: 0.16 | AB88: of:=[.X88]*0.16 -> 151.332413793103 | AC88: 1097.16 | AD88: OXIDANTES DE CONCRETO | AE88: BLENDER PENINSULA, S.A. DE C.V. | AL88: NO | AM88: SI | AN88: NO | AO88: 15 | AP88: 19 | AQ88: 18 | AR88: 3.8 | AS88: BLENDER
A89: 240220164 | B89: NATURAL STAIN GALÃN 3.8 LT PHOENIX | C89: OXIDANTE PARA CONCRETO COLOR PHOENIX | D89: Inventariable | M89: 1 | N89: GALON | O89: 12171511 | Q89: MXN | R89: 787.92 | S89: Trasladado | T89: IVA | U89: 0.16 | V89: of:=[.R89]*0.16 -> 126.0672 | W89: of:=[.R89]*1.16 -> 913.9872 | X89: of:=[.AC89]/1.16 -> 1135.84482758621 | Y89: Trasladado | Z89: IVA | AA89: 0.16 | AB89: of:=[.X89]*0.16 -> 181.735172413793 | AC89: 1317.58 | AD89: OXIDANTES DE CONCRETO | AE89: BLENDER PENINSULA, S.A. DE C.V. | AL89: NO | AM89: SI | AN89: NO | AO89: 15 | AP89: 19 | AQ89: 18 | AR89: 3.8 | AS89: BLENDER
A90: 240220165 | B90: NATURAL STAIN GALÃN 3.8 LT BLUE STONE | C90: OXIDANTE PARA CONCRETO COLOR BLUE STONE | D90: Inventariable | M90: 1 | N90: GALON | O90: 12171511 | Q90: MXN | R90: 985.6 | S90: Trasladado | T90: IVA | U90: 0.16 | V90: of:=[.R90]*0.16 -> 157.696 | W90: of:=[.R90]*1.16 -> 1143.296 | X90: of:=[.AC90]/1.16 -> 1412.59482758621 | Y90: Trasladado | Z90: IVA | AA90: 0.16 | AB90: of:=[.X90]*0.16 -> 226.015172413793 | AC90: 1638.61 | AD90: OXIDANTES DE CONCRETO | AE90: BLENDER PENINSULA, S.A. DE C.V. | AL90: NO | AM90: SI | AN90: NO | AO90: 15 | AP90: 19 | AQ90: 18 | AR90: 3.8 | AS90: BLENDER
A91: 240220168 | B91: NATURAL STAIN GALON 3.8 LT FOREST | C91: OXIDANTE PARA CONCRETO COLOR FOREST | D91: Inventariable | M91: 0 | N91: GALON | O91: 12171511 | Q91: MXN | R91: 855.68 | S91: Trasladado | T91: IVA | U91: 0.16 | V91: of:=[.R91]*0.16 -> 136.9088 | W91: of:=[.R91]*1.16 -> 992.5888 | X91: of:=[.AC91]/1.16 -> 1230.70689655172 | Y91: Trasladado | Z91: IVA | AA91: 0.16 | AB91: of:=[.X91]*0.16 -> 196.913103448276 | AC91: 1427.62 | AD91: OXIDANTES DE CONCRETO | AE91: BLENDER PENINSULA, S.A. DE C.V. | AL91: NO | AM91: SI | AN91: NO | AO91: 15 | AP91: 19 | AQ91: 18 | AR91: 3.8 | AS91: BLENDER
A92: BGR23620ND | B92: NATURAL DYE NEGRO / BLACK DIAMOND 3.8 LT | C92: OXIDANTE PARA CONCRETO COLOR BLACK DIAMOND | D92: Inventariable | M92: 2 | N92: GALON | O92: 12171511 | Q92: MXN | R92: 1102 | S92: Trasladado | T92: IVA | U92: 0.16 | V92: of:=[.R92]*0.16 -> 176.32 | W92: of:=[.R92]*1.16 -> 1278.32 | X92: of:=[.AC92]/1.16 -> 1575.56034482759 | Y92: Trasladado | Z92: IVA | AA92: 0.16 | AB92: of:=[.X92]*0.16 -> 252.089655172414 | AC92: 1827.65 | AD92: HARDENER | AE92: BLENDER PENINSULA, S.A. DE C.V. | AL92: NO | AM92: SI | AN92: NO | AO92: 15 | AP92: 19 | AQ92: 18 | AR92: 3.8 | AS92: BLENDER
A93: BPE22318H0 | B93: HARDENER BULTO SAND | C93: COLOR ENDURECEDOR PARA CONCRETO | D93: Inventariable | M93: 4 | N93: SACO | O93: 30111504 | Q93: MXN | R93: 142.27 | S93: Trasladado | T93: IVA | U93: 0.16 | V93: of:=[.R93]*0.16 -> 22.7632 | W93: of:=[.R93]*1.16 -> 165.0332 | X93: of:=[.AC93]/1.16 -> 242.284482758621 | Y93: Trasladado | Z93: IVA | AA93: 0.16 | AB93: of:=[.X93]*0.16 -> 38.7655172413793 | AC93: 281.05 | AD93: HARDENER | AE93: BLENDER PENINSULA, S.A. DE C.V. | AL93: NO | AM93: SI | AN93: NO | AO93: 7 | AP93: 39 | AQ93: 43 | AR93: 20 | AS93: BLENDER
A94: BPE3718HCP | B94: HARDENER BULTO COLORADO | C94: COLOR ENDURECEDOR PARA CONCRETO | D94: Inventariable | M94: 0 | N94: SACO | O94: 30111504 | Q94: MXN | R94: 142.27 | S94: Trasladado | T94: IVA | U94: 0.16 | V94: of:=[.R94]*0.16 -> 22.7632 | W94: of:=[.R94]*1.16 -> 165.0332 | X94: of:=[.AC94]/1.16 -> 242.284482758621 | Y94: Trasladado | Z94: IVA | AA94: 0.16 | AB94: of:=[.X94]*0.16 -> 38.7655172413793 | AC94: 281.05 | AD94: HARDENER | AE94: BLENDER PENINSULA, S.A. DE C.V. | AL94: NO | AM94: SI | AN94: NO | AO94: 7 | AP94: 39 | AQ94: 43 | AR94: 20 | AS94: BLENDER
A95: BPE22318H1 | B95: HARDENER BULTO PEACH | C95: COLOR ENDURECEDOR PARA CONCRETO | D95: Inventariable | M95: 0 | N95: SACO | O95: 30111504 | Q95: MXN | R95: 142.27 | S95: Trasladado | T95: IVA | U95: 0.16 | V95: of:=[.R95]*0.16 -> 22.7632 | W95: of:=[.R95]*1.16 -> 165.0332 | X95: of:=[.AC95]/1.16 -> 242.284482758621 | Y95: Trasladado | Z95: IVA | AA95: 0.16 | AB95: of:=[.X95]*0.16 -> 38.7655172413793 | AC95: 281.05 | AD95: HARDENER | AE95: BLENDER PENINSULA, S.A. DE C.V. | AL95: NO | AM95: SI | AN95: NO | AO95: 7 | AP95: 39 | AQ95: 43 | AR95: 20 | AS95: BLENDER
A96: BPE22318H2 | B96: HARDENER BULTO OBSIDIANE | C96: COLOR ENDURECEDOR PARA CONCRETO | D96: Inventariable | M96: 4 | N96: SACO | O96: 30111504 | Q96: MXN | R96: 142.27 | S96: Trasladado | T96: IVA | U96: 0.16 | V96: of:=[.R96]*0.16 -> 22.7632 | W96: of:=[.R96]*1.16 -> 165.0332 | X96: of:=[.AC96]/1.16 -> 242.284482758621 | Y96: Trasladado | Z96: IVA | AA96: 0.16 | AB96: of:=[.X96]*0.16 -> 38.7655172413793 | AC96: 281.05 | AD96: HARDENER | AE96: BLENDER PENINSULA, S.A. DE C.V. | AL96: NO | AM96: SI | AN96: NO | AO96: 7 | AP96: 39 | AQ96: 43 | AR96: 20 | AS96: BLENDER
A97: BPE22318H3 | B97: HARDENER BULTO TERRACOTA | C97: COLOR ENDURECEDOR PARA CONCRETO | D97: Inventariable | M97: 4 | N97: SACO | O97: 30111504 | Q97: MXN | R97: 142.27 | S97: Trasladado | T97: IVA | U97: 0.16 | V97: of:=[.R97]*0.16 -> 22.7632 | W97: of:=[.R97]*1.16 -> 165.0332 | X97: of:=[.AC97]/1.16 -> 242.284482758621 | Y97: Trasladado | Z97: IVA | AA97: 0.16 | AB97: of:=[.X97]*0.16 -> 38.7655172413793 | AC97: 281.05 | AD97: HARDENER | AE97: BLENDER PENINSULA, S.A. DE C.V. | AL97: NO | AM97: SI | AN97: NO | AO97: 7 | AP97: 39 | AQ97: 43 | AR97: 20 | AS97: BLENDER
A98: BPE22318H4 | B98: HARDENER BULTO GREY | C98: COLOR ENDURECEDOR PARA CONCRETO | D98: Inventariable | M98: 0 | N98: SACO | O98: 30111504 | Q98: MXN | R98: 142.27 | S98: Trasladado | T98: IVA | U98: 0.16 | V98: of:=[.R98]*0.16 -> 22.7632 | W98: of:=[.R98]*1.16 -> 165.0332 | X98: of:=[.AC98]/1.16 -> 242.284482758621 | Y98: Trasladado | Z98: IVA | AA98: 0.16 | AB98: of:=[.X98]*0.16 -> 38.7655172413793 | AC98: 281.05 | AD98: HARDENER | AE98: BLENDER PENINSULA, S.A. DE C.V. | AL98: NO | AM98: SI | AN98: NO | AO98: 7 | AP98: 39 | AQ98: 43 | AR98: 20 | AS98: BLENDER
A99: BPE22318H5 | B99: HARDENER BULTO YELLOW | C99: COLOR ENDURECEDOR PARA CONCRETO | D99: Inventariable | M99: 8 | N99: SACO | O99: 30111504 | Q99: MXN | R99: 142.27 | S99: Trasladado | T99: IVA | U99: 0.16 | V99: of:=[.R99]*0.16 -> 22.7632 | W99: of:=[.R99]*1.16 -> 165.0332 | X99: of:=[.AC99]/1.16 -> 242.284482758621 | Y99: Trasladado | Z99: IVA | AA99: 0.16 | AB99: of:=[.X99]*0.16 -> 38.7655172413793 | AC99: 281.05 | AD99: HARDENER | AE99: BLENDER PENINSULA, S.A. DE C.V. | AL99: NO | AM99: SI | AN99: NO | AO99: 7 | AP99: 39 | AQ99: 43 | AR99: 20 | AS99: BLENDER
A100: BPE22318H6 | B100: HARDENER BULTO CAPUCCINO | C100: COLOR ENDURECEDOR PARA CONCRETO | D100: Inventariable | M100: 0 | N100: SACO | O100: 30111504 | Q100: MXN | R100: 142.27 | S100: Trasladado | T100: IVA | U100: 0.16 | V100: of:=[.R100]*0.16 -> 22.7632 | W100: of:=[.R100]*1.16 -> 165.0332 | X100: of:=[.AC100]/1.16 -> 242.284482758621 | Y100: Trasladado | Z100: IVA | AA100: 0.16 | AB100: of:=[.X100]*0.16 -> 38.7655172413793 | AC100: 281.05 | AD100: HARDENER | AE100: BLENDER PENINSULA, S.A. DE C.V. | AL100: NO | AM100: SI | AN100: NO | AO100: 7 | AP100: 39 | AQ100: 43 | AR100: 20 | AS100: BLENDER
A101: BPE22318H7 | B101: HARDENER BULTO CORAL | C101: COLOR ENDURECEDOR PARA CONCRETO | D101: Inventariable | M101: 10 | N101: SACO | O101: 30111504 | Q101: MXN | R101: 142.27 | S101: Trasladado | T101: IVA | U101: 0.16 | V101: of:=[.R101]*0.16 -> 22.7632 | W101: of:=[.R101]*1.16 -> 165.0332 | X101: of:=[.AC101]/1.16 -> 242.284482758621 | Y101: Trasladado | Z101: IVA | AA101: 0.16 | AB101: of:=[.X101]*0.16 -> 38.7655172413793 | AC101: 281.05 | AD101: HARDENER | AE101: BLENDER PENINSULA, S.A. DE C.V. | AL101: NO | AM101: SI | AN101: NO | AO101: 7 | AP101: 39 | AQ101: 43 | AR101: 20 | AS101: BLENDER
A102: BPE22318H8 | B102: HARDENER BULTO PLUMB | C102: COLOR ENDURECEDOR PARA CONCRETO | D102: Inventariable | M102: 1 | N102: SACO | O102: 30111504 | Q102: MXN | R102: 142.27 | S102: Trasladado | T102: IVA | U102: 0.16 | V102: of:=[.R102]*0.16 -> 22.7632 | W102: of:=[.R102]*1.16 -> 165.0332 | X102: of:=[.AC102]/1.16 -> 242.284482758621 | Y102: Trasladado | Z102: IVA | AA102: 0.16 | AB102: of:=[.X102]*0.16 -> 38.7655172413793 | AC102: 281.05 | AD102: HARDENER | AE102: BLENDER PENINSULA, S.A. DE C.V. | AL102: NO | AM102: SI | AN102: NO | AO102: 7 | AP102: 39 | AQ102: 43 | AR102: 20 | AS102: BLENDER
A103: BPE22318H9 | B103: HARDENER BULTO ORANGE | C103: COLOR ENDURECEDOR PARA CONCRETO | D103: Inventariable | M103: 3 | N103: SACO | O103: 30111504 | Q103: MXN | R103: 142.27 | S103: Trasladado | T103: IVA | U103: 0.16 | V103: of:=[.R103]*0.16 -> 22.7632 | W103: of:=[.R103]*1.16 -> 165.0332 | X103: of:=[.AC103]/1.16 -> 242.284482758621 | Y103: Trasladado | Z103: IVA | AA103: 0.16 | AB103: of:=[.X103]*0.16 -> 38.7655172413793 | AC103: 281.05 | AD103: HARDENER | AE103: BLENDER PENINSULA, S.A. DE C.V. | AL103: NO | AM103: SI | AN103: NO | AO103: 7 | AP103: 39 | AQ103: 43 | AR103: 20 | AS103: BLENDER
A104: BPE3718MAR | B104: HARDENER BULTO MARFIL | C104: COLOR ENDURECEDOR PARA CONCRETO | D104: Inventariable | M104: 2 | N104: SACO | O104: 30111504 | Q104: MXN | R104: 142.27 | S104: Trasladado | T104: IVA | U104: 0.16 | V104: of:=[.R104]*0.16 -> 22.7632 | W104: of:=[.R104]*1.16 -> 165.0332 | X104: of:=[.AC104]/1.16 -> 242.284482758621 | Y104: Trasladado | Z104: IVA | AA104: 0.16 | AB104: of:=[.X104]*0.16 -> 38.7655172413793 | AC104: 281.05 | AD104: HARDENER | AE104: BLENDER PENINSULA, S.A. DE C.V. | AL104: NO | AM104: SI | AN104: NO | AO104: 7 | AP104: 39 | AQ104: 43 | AR104: 20 | AS104: BLENDER
A105: 120520162S | B105: SEAL-ACRYL 25% LATA 4 LT | C105: SELLADOR ACRILICO BRILLOSO | D105: Inventariable | M105: 1 | N105: GALON | O105: 31201600 | Q105: MXN | R105: 310.3 | S105: Trasladado | T105: IVA | U105: 0.16 | V105: of:=[.R105]*0.16 -> 49.648 | W105: of:=[.R105]*1.16 -> 359.948 | X105: of:=[.AC105]/1.16 -> 468.965517241379 | Y105: Trasladado | Z105: IVA | AA105: 0.16 | AB105: of:=[.X105]*0.16 -> 75.0344827586207 | AC105: 544 | AD105: SELLADORES Y ADITIVOS | AE105: BLENDER PENINSULA, S.A. DE C.V. | AL105: NO | AM105: SI | AN105: NO | AO105: 16.5 | AP105: 20.5 | AQ105: 16.5 | AR105: 4 | AS105: BLENDER
A106: 120620162S | B106: SEAL-ACRYL 30% LATA 4 LT | C106: SELLADOR ACRILICO BRILLOSO | D106: Inventariable | M106: 0 | N106: GALON | O106: 31201600 | Q106: MXN | R106: 342.4 | S106: Trasladado | T106: IVA | U106: 0.16 | V106: of:=[.R106]*0.16 -> 54.784 | W106: of:=[.R106]*1.16 -> 397.184 | X106: of:=[.AC106]/1.16 -> 513.844827586207 | Y106: Trasladado | Z106: IVA | AA106: 0.16 | AB106: of:=[.X106]*0.16 -> 82.2151724137931 | AC106: 596.06 | AD106: SELLADORES Y ADITIVOS | AE106: BLENDER PENINSULA, S.A. DE C.V. | AL106: NO | AM106: SI | AN106: NO | AO106: 16.5 | AP106: 20.5 | AQ106: 16.5 | AR106: 4 | AS106: BLENDER
A107: 120520163S | B107: SEAL-ACRYL 25% CUB. 19 LTS | C107: SELLADOR ACRILICO BRILLOSO | D107: Inventariable | M107: 5 | N107: CUBETA | O107: 31201600 | Q107: MXN | R107: 1380.3 | S107: Trasladado | T107: IVA | U107: 0.16 | V107: of:=[.R107]*0.16 -> 220.848 | W107: of:=[.R107]*1.16 -> 1601.148 | X107: of:=[.AC107]/1.16 -> 1993.10344827586 | Y107: Trasladado | Z107: IVA | AA107: 0.16 | AB107: of:=[.X107]*0.16 -> 318.896551724138 | AC107: 2312 | AD107: SELLADORES Y ADITIVOS | AE107: BLENDER PENINSULA, S.A. DE C.V. | AL107: NO | AM107: SI | AN107: NO | AO107: 31 | AP107: 37 | AQ107: 50 | AR107: 19 | AS107: BLENDER
A108: 120520164S | B108: SEAL-ACRYL 25% TAMBOR 200 LT | C108: SELLADOR ACRILICO BRILLOSO | D108: Inventariable | M108: 0 | N108: TAMBOR | O108: 31201600 | Q108: MXN | R108: 12947 | S108: Trasladado | T108: IVA | U108: 0.16 | V108: of:=[.R108]*0.16 -> 2071.52 | W108: of:=[.R108]*1.16 -> 15018.52 | X108: of:=[.AC108]/1.16 -> 18427.5862068966 | Y108: Trasladado | Z108: IVA | AA108: 0.16 | AB108: of:=[.X108]*0.16 -> 2948.41379310345 | AC108: 21376 | AD108: SELLADORES Y ADITIVOS | AE108: BLENDER PENINSULA, S.A. DE C.V. | AL108: NO | AM108: SI | AN108: NO | AO108: 31 | AP108: 31 | AQ108: 120 | AR108: 200 | AS108: BLENDER
A109: 120620161S | B109: SEAL-ACRYL 30% CUB. 19 LTS. | C109: SELLADOR ACRILICO BRILLOSO | D109: Inventariable | M109: 0 | N109: CUBETA | O109: 31201600 | Q109: MXN | R109: 1449.85 | S109: Trasladado | T109: IVA | U109: 0.16 | V109: of:=[.R109]*0.16 -> 231.976 | W109: of:=[.R109]*1.16 -> 1681.826 | X109: of:=[.AC109]/1.16 -> 2090.51724137931 | Y109: Trasladado | Z109: IVA | AA109: 0.16 | AB109: of:=[.X109]*0.16 -> 334.48275862069 | AC109: 2425 | AD109: SELLADORES Y ADITIVOS | AE109: BLENDER PENINSULA, S.A. DE C.V. | AL109: NO | AM109: SI | AN109: NO | AO109: 31 | AP109: 37 | AQ109: 50 | AR109: 19 | AS109: BLENDER
A110: 120520173S | B110: SEAL-ACRYL & SEAL WB 30% CUB. 19 LT | C110: SELLADOR Y PROTECTOR ANTI-POLVEO ACRÃLICO BASE AGUA. | D110: Inventariable | M110: 2 | N110: CUBETA | O110: 31201600 | Q110: MXN | R110: 1449.85 | S110: Trasladado | T110: IVA | U110: 0.16 | V110: of:=[.R110]*0.16 -> 231.976 | W110: of:=[.R110]*1.16 -> 1681.826 | X110: of:=[.AC110]/1.16 -> 2090.13793103448 | Y110: Trasladado | Z110: IVA | AA110: 0.16 | AB110: of:=[.X110]*0.16 -> 334.422068965517 | AC110: 2424.56 | AD110: SELLADORES Y ADITIVOS | AE110: BLENDER PENINSULA, S.A. DE C.V. | AL110: NO | AM110: SI | AN110: NO | AO110: 31 | AP110: 37 | AQ110: 31 | AR110: 19 | AS110: BLENDER
A111: 120520172S | B111: SEAL-ACRYL & SEAL WB 30% GALON 4 LT | C111: WB ES UNA SOLUCIÃN ACRÃLICA BASE AGUA CON BAJO OLOR. TIENE UNA APARIENCIA BLANCA QUE AL SECARSE FORMA UNA PELÃCULA TRANSPARENTE BRILLANTE Y ALTAMENTE RESISTENTE. | D111: Inventariable | M111: 3 | N111: GALON | O111: 31201600 | Q111: MXN | R111: 295.17 | S111: Trasladado | T111: IVA | U111: 0.16 | V111: of:=[.R111]*0.16 -> 47.2272 | W111: of:=[.R111]*1.16 -> 342.3972 | X111: 513.84 | Y111: Trasladado | Z111: IVA | AA111: 0.16 | AB111: of:=[.X111]*0.16 -> 82.2144 | AC111: 596.06 | AD111: SELLADORES Y ADITIVOS | AE111: BLENDER PENINSULA, S.A. DE C.V. | AL111: NO | AM111: SI | AN111: NO | AO111: 15 | AP111: 19 | AQ111: 18 | AR111: 4 | AS111: BLENDER
A112: BGR15618CT | B112: BLENDER CITRUS (DESENGRASANTE) 3.8 LTS | C112: DESENGRASANTE BASE AGUA DE ALTO DESEMPEÃO | D112: Inventariable | M112: 1 | N112: GALON | O112: 47131821 | Q112: MXN | R112: 377.68 | S112: Trasladado | T112: IVA | U112: 0.16 | V112: of:=[.R112]*0.16 -> 60.4288 | W112: of:=[.R112]*1.16 -> 438.1088 | X112: of:=[.AC112]/1.16 -> 563.23275862069 | Y112: Trasladado | Z112: IVA | AA112: 0.16 | AB112: of:=[.X112]*0.16 -> 90.1172413793104 | AC112: 653.35 | AD112: DESENGRASANTES | AE112: BLENDER PENINSULA, S.A. DE C.V. | AL112: NO | AM112: SI | AN112: NO | AO112: 13 | AP112: 28 | AQ112: 23 | AR112: 3.8 | AS112: BLENDER
A113: 121130109 | B113: PEGACRETO-SE 19 LT | C113: ADHESIVO PARA CONCRETO | D113: Inventariable | M113: 1 | N113: CUBETA | O113: 31201600 | Q113: MXN | R113: 811.8 | S113: Trasladado | T113: IVA | U113: 0.16 | V113: of:=[.R113]*0.16 -> 129.888 | W113: of:=[.R113]*1.16 -> 941.688 | X113: of:=[.AC113]/1.16 -> 1353 | Y113: Trasladado | Z113: IVA | AA113: 0.16 | AB113: of:=[.X113]*0.16 -> 216.48 | AC113: 1569.48 | AD113: SELLADORES Y ADITIVOS | AE113: CURACRETO, S.A. DE C.V. | AL113: NO | AM113: SI | AN113: NO | AO113: 31 | AP113: 37 | AQ113: 50 | AR113: 19 | AS113: CURACRETO
A114: 351210142 | B114: FLEXOCRETO-100 METRO | C114: MEMBRANA PARA IMPERMEABILIZAR | D114: Inventariable | M114: 2 | N114: ROLLO | O114: 30151505 | Q114: MXN | R114: 372.6 | S114: Trasladado | T114: IVA | U114: 0.16 | V114: 58.92 | W114: 431.52 | X114: 621 | Y114: Trasladado | Z114: IVA | AA114: 0.16 | AB114: 109.36 | AC114: 720.36 | AD114: IMPERMEABILIZANTES | AE114: CURACRETO, S.A. DE C.V. | AO114: 150 | AP114: 110 | AQ114: 150 | AR114: 7
A115: 0351220143 | B115: FLEXOCRETO-200 METRO | C115: MEMBRANA PARA IMPERMEABILIZAR | D115: Inventariable | M115: 4 | N115: ROLLO | O115: 30151505 | Q115: MXN | R115: 1172.4 | S115: Trasladado | T115: IVA | U115: 0.16 | V115: of:=[.R115]*0.16 -> 187.584 | W115: of:=[.R115]*1.16 -> 1359.984 | X115: 1954 | Y115: Trasladado | Z115: IVA | AA115: 0.16 | AB115: of:=[.X115]*0.16 -> 312.64 | AC115: 2266.64 | AD115: IMPERMEABILIZANTES | AE115: CURACRETO, S.A. DE C.V. | AL115: NO | AM115: SI | AN115: NO | AO115: 150 | AP115: 110 | AQ115: 150 | AR115: 7 | AS115: CURACRETO
A116: 092000011J | B116: POLICRETO BLANCO CART. BLANCO 300 ML | C116: ES UN SELLADOR PARA JUNTAS, DE UN SÃLO COMPONENTE, FABRICADO A BASE DE RESINAS DE POLIURETANO. | D116: Inventariable | M116: 0 | N116: PIEZA | O116: 31201600 | Q116: MXN | R116: 97 | S116: Trasladado | T116: IVA | U116: 0.16 | V116: of:=[.R116]*0.16 -> 15.52 | W116: of:=[.R116]*1.16 -> 112.52 | X116: of:=[.AC116]/1.16 -> 125 | Y116: Trasladado | Z116: IVA | AA116: 0.16 | AB116: of:=[.X116]*0.16 -> 20 | AC116: 145 | AD116: SELLADORES Y ADITIVOS | AE116: CURACRETO, S.A. DE C.V. | AL116: NO | AM116: SI | AN116: NO | AO116: 4.6 | AP116: 21.4 | AQ116: 21.4 | AR116: 0.3 | AS116: CURACRETO
A117: 092000021J | B117: POLICRETO GRIS CART. BLANCO 300 ML | C117: ES UN SELLADOR PARA JUNTAS, DE UN SÃLO COMPONENTE, FABRICADO A BASE DE RESINAS DE POLIURETANO. | D117: Inventariable | M117: 0 | N117: PIEZA | O117: 31201600 | Q117: MXN | R117: 97 | S117: Trasladado | T117: IVA | U117: 0.16 | V117: of:=[.R117]*0.16 -> 15.52 | W117: of:=[.R117]*1.16 -> 112.52 | X117: of:=[.AC117]/1.16 -> 125 | Y117: Trasladado | Z117: IVA | AA117: 0.16 | AB117: of:=[.X117]*0.16 -> 20 | AC117: 145 | AD117: SELLADORES Y ADITIVOS | AE117: CURACRETO, S.A. DE C.V. | AL117: NO | AM117: SI | AN117: NO | AO117: 4.6 | AP117: 21.4 | AQ117: 21.4 | AR117: 0.3 | AS117: CURACRETO
A118: 422030140 | B118: BACKER ROD 1/4" (CAJA 1219 ML, 2 CARRETES 609 M C/U) | C118: TIRA DE POLIETILENO FLEXIBLE CON UNA PELÃCULA EXTERIOR RESISTENTE AL AGUA. | D118: Inventariable | M118: 1110 | N118: ROLLO | O118: 31201600 | Q118: MXN | R118: 865.8 | S118: Trasladado | T118: IVA | U118: 0.16 | V118: of:=[.R118]*0.16 -> 138.528 | W118: of:=[.R118]*1.16 -> 1004.328 | X118: of:=[.AC118]/1.16 -> 1.99137931034483 | Y118: Trasladado | Z118: IVA | AA118: 0.16 | AB118: of:=[.X118]*0.16 -> 0.318620689655172 | AC118: 2.31 | AD118: SELLADORES Y ADITIVOS | AE118: CURACRETO, S.A. DE C.V. | AL118: NO | AM118: SI | AN118: NO | AO118: 3 | AP118: 1219 | AQ118: 1219 | AR118: 2 | AS118: CURACRETO
B119: REPELCRETO A GALON 4 L | C119: REFINADOS, CARGAS MINERALES, FIBRAS DE REFUERZO Y SOLVENTES DE | D119: Inventariable | M119: 0 | N119: GALON | O119: 12164901 | Q119: USD | R119: 116.8 | S119: Trasladado | T119: IVA | U119: 0.16 | V119: of:=[.R119]*0.16 -> 18.688 | W119: of:=[.R119]*1.16 -> 135.488 | X119: 9.69 | Y119: Trasladado | Z119: IVA | AA119: 0.16 | AB119: of:=[.X119]*0.16 -> 1.5504 | AC119: of:=[.X119]*1.16 -> 11.2404 | AD119: SELLADORES Y ADITIVOS | AE119: CURACRETO, S.A. DE C.V. | AL119: NO | AM119: SI | AN119: NO | AO119: 15 | AP119: 19 | AQ119: 18 | AR119: 4 | AS119: CURACRETO
A120: 0362110109 | B120: REPELCRETO-A CUB 19 L | C120: RÃPIDA EVAPORACIÃN. | D120: Inventariable | M120: 0 | N120: CUBETA | O120: 12164901 | Q120: USD | R120: 466 | S120: Trasladado | T120: IVA | U120: 0.16 | V120: of:=[.R120]*0.16 -> 74.56 | W120: of:=[.R120]*1.16 -> 540.56 | X120: 38.66 | Y120: Trasladado | Z120: IVA | AA120: 0.16 | AB120: of:=[.X120]*0.16 -> 6.1856 | AC120: of:=[.X120]*1.16 -> 44.8456 | AD120: SELLADORES Y ADITIVOS | AE120: CURACRETO, S.A. DE C.V. | AL120: NO | AM120: SI | AN120: NO | AO120: 31 | AP120: 37 | AQ120: 20 | AR120: 19 | AS120: CURACRETO
A121: 0362120131 | B121: REPELCRETO-S GALON 4 L | C121: SELLADOR PARA CONCRETO BASE SOLVENTE | D121: Inventariable | M121: 0 | N121: GALON | O121: 12164901 | Q121: USD | R121: 371.14 | S121: Trasladado | T121: IVA | U121: 0.16 | V121: of:=[.R121]*0.16 -> 59.3824 | W121: of:=[.R121]*1.16 -> 430.5224 | X121: 30.79 | Y121: Trasladado | Z121: IVA | AA121: 0.16 | AB121: of:=[.X121]*0.16 -> 4.9264 | AC121: of:=[.X121]*1.16 -> 35.7164 | AD121: SELLADORES Y ADITIVOS | AE121: CURACRETO, S.A. DE C.V. | AL121: NO | AM121: SI | AN121: NO | AO121: 15 | AP121: 19 | AQ121: 18 | AR121: 4 | AS121: CURACRETO
A122: 0362120105 | B122: REPELCRETO-S CUB. 19 L | C122: SELLADOR PARA CONCRETO BASE SOLVENTE | D122: Inventariable | M122: 1 | N122: CUBETA | O122: 12164901 | Q122: USD | R122: 1738.67 | S122: Trasladado | T122: IVA | U122: 0.16 | V122: of:=[.R122]*0.16 -> 278.1872 | W122: of:=[.R122]*1.16 -> 2016.8572 | X122: 144.24 | Y122: Trasladado | Z122: IVA | AA122: 0.16 | AB122: of:=[.X122]*0.16 -> 23.0784 | AC122: of:=[.X122]*1.16 -> 167.3184 | AD122: SELLADORES Y ADITIVOS | AE122: CURACRETO, S.A. DE C.V. | AL122: NO | AM122: SI | AN122: NO | AO122: 31 | AP122: 37 | AQ122: 20 | AR122: 19 | AS122: CURACRETO
A123: 0901010131 | B123: PLASTICRETO GALON 4 L | C123: ES UNA PASTA DE COLOR NEGRO FORMULADO A BASE DE ASFALTOS SELECCIONADOS, ACEITES PLASTIFICANTES, CARGAS MINERALES Y FIBRAS DE REFUERZO Y SOLVENTES. | D123: Inventariable | M123: 1 | N123: GALON | O123: 31201600 | Q123: MXN | R123: 237 | S123: Trasladado | T123: IVA | U123: 0.16 | V123: of:=[.R123]*0.16 -> 37.92 | W123: of:=[.R123]*1.16 -> 274.92 | X123: 394.83 | Y123: Trasladado | Z123: IVA | AA123: 0.16 | AB123: of:=[.X123]*0.16 -> 63.1728 | AC123: of:=[.X123]*1.16 -> 458.0028 | AD123: IMPERMEABILIZANTES | AE123: CURACRETO, S.A. DE C.V. | AL123: NO | AM123: SI | AN123: NO | AO123: 16.5 | AP123: 20.5 | AQ123: 20.5 | AR123: 4 | AS123: CURACRETO
A124: 0901010102 | B124: PLASTICRETO LATA 1 L | C124: ES UNA PASTA DE COLOR NEGRO FORMULADO A BASE DE ASFALTOS SELECCIONADOS, ACEITES PLASTIFICANTES, CARGAS MINERALES Y FIBRAS DE REFUERZO Y SOLVENTES. | D124: Inventariable | M124: 0 | N124: LITRO | O124: 31201600 | Q124: MXN | R124: 96.6 | S124: Trasladado | T124: IVA | U124: 0.16 | V124: of:=[.R124]*0.16 -> 15.456 | W124: of:=[.R124]*1.16 -> 112.056 | X124: 160.34 | Y124: Trasladado | Z124: IVA | AA124: 0.16 | AB124: of:=[.X124]*0.16 -> 25.6544 | AC124: of:=[.X124]*1.16 -> 185.9944 | AD124: IMPERMEABILIZANTES | AE124: CURACRETO, S.A. DE C.V. | AL124: NO | AM124: SI | AN124: NO | AO124: 8 | AP124: 10 | AQ124: 8 | AR124: 1 | AS124: CURACRETO
A125: 0311110133 | B125: PRIMERCRETO A GALON 4 L | C125: ES UN SELLADOR TAPAPOROS, DE BAJA VISCOSIDAD EN EMULSIÃN ACUOSA, QUE SE UTILIZA COMO BASE PARA IMPERMEABILIZACIONES. | D125: Inventariable | M125: 2 | N125: GALON | O125: 30141500 | Q125: MXN | R125: 142.8 | S125: Trasladado | T125: IVA | U125: 0.16 | V125: of:=[.R125]*0.16 -> 22.848 | W125: of:=[.R125]*1.16 -> 165.648 | X125: 226 | Y125: Trasladado | Z125: IVA | AA125: 0.16 | AB125: of:=[.X125]*0.16 -> 36.16 | AC125: of:=[.X125]*1.16 -> 262.16 | AD125: IMPERMEABILIZANTES | AE125: CURACRETO, S.A. DE C.V. | AL125: NO | AM125: SI | AN125: NO | AO125: 20 | AP125: 19 | AQ125: 20 | AR125: 4 | AS125: CURACRETO
A126: 12S12070909 | B126: ACRILCRETO P. BLANCO 7 AÃOS FIBRATADO CUB. 19 LT | C126: IMPERMEABILIZANTE FIBRATADAO | D126: Inventariable | M126: 2 | N126: CUBETA | O126: 30141500 | Q126: MXN | R126: 1218 | S126: Trasladado | T126: IVA | U126: 0.16 | V126: of:=[.R126]*0.16 -> 194.88 | W126: of:=[.R126]*1.16 -> 1412.88 | X126: 1219.82 | Y126: Trasladado | Z126: IVA | AA126: 0.16 | AB126: of:=[.X126]*0.16 -> 195.1712 | AC126: of:=[.X126]*1.16 -> 1414.9912 | AD126: IMPERMEABILIZANTES | AE126: CURACRETO, S.A. DE C.V. | AL126: NO | AM126: SI | AN126: NO | AO126: 31 | AP126: 37 | AQ126: 31 | AR126: 19 | AS126: CURACRETO
A127: 1211030909 | B127: ACRILCRETO BLANCO 3 AÃOS CUB. 19 L | C127: IMPERMEABILIZANTE | D127: Inventariable | M127: 2 | N127: CUBETA | O127: 30141500 | Q127: MXN | R127: 742.2 | S127: Trasladado | T127: IVA | U127: 0.16 | V127: of:=[.R127]*0.16 -> 118.752 | W127: of:=[.R127]*1.16 -> 860.952 | X127: 1146 | Y127: Trasladado | Z127: IVA | AA127: 0.16 | AB127: of:=[.X127]*0.16 -> 183.36 | AC127: of:=[.X127]*1.16 -> 1329.36 | AD127: IMPERMEABILIZANTES | AE127: CURACRETO, S.A. DE C.V. | AL127: NO | AM127: SI | AN127: NO | AO127: 31 | AP127: 37 | AQ127: 31 | AR127: 19 | AS127: CURACRETO
A128: 1211030933 | B128: ACRILCRETO BLANCO 3 AÃOS LATA 4 L | C128: IMPERMEABILIZANTE | D128: Inventariable | M128: 0 | N128: GALON | O128: 30141500 | Q128: MXN | R128: 184.2 | S128: Trasladado | T128: IVA | U128: 0.16 | V128: of:=[.R128]*0.16 -> 29.472 | W128: of:=[.R128]*1.16 -> 213.672 | X128: 266.38 | Y128: Trasladado | Z128: IVA | AA128: 0.16 | AB128: of:=[.X128]*0.16 -> 42.6208 | AC128: of:=[.X128]*1.16 -> 309.0008 | AD128: IMPERMEABILIZANTES | AE128: CURACRETO, S.A. DE C.V. | AL128: NO | AM128: SI | AN128: NO | AO128: 20 | AP128: 19 | AQ128: 20 | AR128: 4 | AS128: CURACRETO
A129: 1211050909 | B129: ACRILCRETO BLANCO 5 AÃOS CUB. 19 L | C129: IMPERMEABILIZANTES | D129: Inventariable | M129: 1 | N129: CUBETA | O129: 30141500 | Q129: MXN | R129: 856.8 | S129: Trasladado | T129: IVA | U129: 0.16 | V129: of:=[.R129]*0.16 -> 137.088 | W129: of:=[.R129]*1.16 -> 993.888 | X129: 1322 | Y129: Trasladado | Z129: IVA | AA129: 0.16 | AB129: of:=[.X129]*0.16 -> 211.52 | AC129: of:=[.X129]*1.16 -> 1533.52 | AD129: IMPERMEABILIZANTES | AE129: CURACRETO, S.A. DE C.V. | AL129: NO | AM129: SI | AN129: NO | AO129: 31 | AP129: 37 | AQ129: 31 | AR129: 19 | AS129: CURACRETO
A130: 1211050933 | B130: ACRILCRETO BLANCO 5 AÃOS LATA 4 L | C130: IMPERMEABILIZANTE | D130: Inventariable | M130: 0 | N130: GALON | O130: 30141500 | Q130: MXN | R130: 206.4 | S130: Trasladado | T130: IVA | U130: 0.16 | V130: of:=[.R130]*0.16 -> 33.024 | W130: of:=[.R130]*1.16 -> 239.424 | X130: 298 | Y130: Trasladado | Z130: IVA | AA130: 0.16 | AB130: of:=[.X130]*0.16 -> 47.68 | AC130: of:=[.X130]*1.16 -> 345.68 | AD130: IMPERMEABILIZANTES | AE130: CURACRETO, S.A. DE C.V. | AL130: NO | AM130: SI | AN130: NO | AO130: 20 | AP130: 19 | AQ130: 20 | AR130: 4 | AS130: CURACRETO
A131: 0312100131 | B131: VAPORCRETO W LATA 4 L | C131: IMPERMEABILIZANTE ASFÃLTICO AHULADO, FIBRATADO Y BARRERA DE VAPOR BASE SOLVENTE, APLICABLE SOBRE SUPERFICIES SECAS O HÃMEDAS. | D131: Inventariable | M131: 0 | N131: GALON | O131: 12164901 | Q131: MXN | R131: 280.2 | S131: Trasladado | T131: IVA | U131: 0.16 | V131: of:=[.R131]*0.16 -> 44.832 | W131: of:=[.R131]*1.16 -> 325.032 | X131: 467 | Y131: Trasladado | Z131: IVA | AA131: 0.16 | AB131: of:=[.X131]*0.16 -> 74.72 | AC131: of:=[.X131]*1.16 -> 541.72 | AD131: IMPERMEABILIZANTES | AE131: CURACRETO, S.A. DE C.V. | AL131: NO | AM131: SI | AN131: NO | AO131: 17 | AP131: 20 | AQ131: 17 | AR131: 4 | AS131: CURACRETO
A132: 0312140105 | B132: VAPORCRETO CUB. 19 L | C132: IMPERMEABILIZANTE ASFÃLTICO | D132: Inventariable | M132: 1 | N132: CUBETA | O132: 12164901 | Q132: MXN | R132: 1161 | S132: Trasladado | T132: IVA | U132: 0.16 | V132: of:=[.R132]*0.16 -> 185.76 | W132: of:=[.R132]*1.16 -> 1346.76 | X132: 1746 | Y132: Trasladado | Z132: IVA | AA132: 0.16 | AB132: of:=[.X132]*0.16 -> 279.36 | AC132: of:=[.X132]*1.16 -> 2025.36 | AD132: IMPERMEABILIZANTES | AE132: CURACRETO, S.A. DE C.V. | AL132: NO | AM132: SI | AN132: NO | AO132: 31 | AP132: 37 | AQ132: 31 | AR132: 19 | AS132: CURACRETO
A133: 0312140131 | B133: VAPORCRETO LATA4 L | C133: IMPERMEABILIZANTE ASFÃLTICO | D133: Inventariable | M133: 0 | N133: GALON | O133: 12164901 | Q133: MXN | R133: 234.6 | S133: Trasladado | T133: IVA | U133: 0.16 | V133: of:=[.R133]*0.16 -> 37.536 | W133: of:=[.R133]*1.16 -> 272.136 | X133: 391 | Y133: Trasladado | Z133: IVA | AA133: 0.16 | AB133: of:=[.X133]*0.16 -> 62.56 | AC133: of:=[.X133]*1.16 -> 453.56 | AD133: IMPERMEABILIZANTES | AE133: CURACRETO, S.A. DE C.V. | AL133: NO | AM133: SI | AN133: NO | AO133: 17 | AP133: 20 | AQ133: 17 | AR133: 4 | AS133: CURACRETO
A134: 0521300109 | B134: MOLDUCRETO JR CUB. 19 L | C134: DESMOLDANTE PARA CIMBRAS | D134: Inventariable | M134: 1 | N134: CUBETA | O134: 12162305 | Q134: MXN | R134: 441.6 | S134: Trasladado | T134: IVA | U134: 0.16 | V134: of:=[.R134]*0.16 -> 70.656 | W134: of:=[.R134]*1.16 -> 512.256 | X134: 736 | Y134: Trasladado | Z134: IVA | AA134: 0.16 | AB134: of:=[.X134]*0.16 -> 117.76 | AC134: of:=[.X134]*1.16 -> 853.76 | AD134: DESMOLDANTE | AE134: CURACRETO, S.A. DE C.V. | AL134: NO | AM134: SI | AN134: NO | AO134: 31 | AP134: 37 | AQ134: 31 | AR134: 19 | AS134: CURACRETO
A135: 0212110109 | B135: FRAGUACRETO CUBETA 19 L | C135: ACELERANTE DEL FRAGUADO INSTANTÃNEO | D135: Inventariable | M135: 3 | N135: CUBETA | O135: 12162305 | Q135: MXN | R135: 571.8 | S135: Trasladado | T135: IVA | U135: 0.16 | V135: of:=[.R135]*0.16 -> 91.488 | W135: of:=[.R135]*1.16 -> 663.288 | X135: 953 | Y135: Trasladado | Z135: IVA | AA135: 0.16 | AB135: of:=[.X135]*0.16 -> 152.48 | AC135: of:=[.X135]*1.16 -> 1105.48 | AD135: SELLADORES Y ADITIVOS | AE135: CURACRETO, S.A. DE C.V. | AL135: NO | AM135: SI | AN135: NO | AO135: 21.5 | AP135: 36 | AQ135: 27 | AR135: 19 | AS135: CURACRETO
A136: 0212110133 | B136: FRAGUACRETO GAL. 4 L | C136: ACELERANTE DEL FRAGUADO INSTANTÃNEO | D136: Inventariable | M136: 0 | N136: GALON | O136: 12162305 | Q136: MXN | R136: 154.8 | S136: Trasladado | T136: IVA | U136: 0.16 | V136: of:=[.R136]*0.16 -> 24.768 | W136: of:=[.R136]*1.16 -> 179.568 | X136: 258 | Y136: Trasladado | Z136: IVA | AA136: 0.16 | AB136: of:=[.X136]*0.16 -> 41.28 | AC136: of:=[.X136]*1.16 -> 299.28 | AD136: SELLADORES Y ADITIVOS | AE136: CURACRETO, S.A. DE C.V. | AL136: NO | AM136: SI | AN136: NO | AO136: 15 | AP136: 19 | AQ136: 18 | AR136: 4 | AS136: CURACRETO
A137: 211110109 | B137: ACELERACRETO CUB. 19 L | C137: ACELERANTE DEL FRAGUADO Y DENSIFICADOR DEL CONCRETO. | D137: Inventariable | M137: 0 | N137: CUBETA | O137: 12162305 | Q137: MXN | R137: 480.6 | S137: Trasladado | T137: IVA | U137: 0.16 | V137: of:=[.R137]*0.16 -> 76.896 | W137: of:=[.R137]*1.16 -> 557.496 | X137: 801 | Y137: Trasladado | Z137: IVA | AA137: 0.16 | AB137: of:=[.X137]*0.16 -> 128.16 | AC137: of:=[.X137]*1.16 -> 929.16 | AD137: SELLADORES Y ADITIVOS | AE137: CURACRETO, S.A. DE C.V. | AL137: NO | AM137: SI | AN137: NO | AO137: 21.5 | AP137: 36 | AQ137: 27 | AR137: 19 | AS137: CURACRETO
A138: 0211110133 | B138: ACELERACRETO LATA 4 L | C138: ACELERANTE DEL FRAGUADO Y DENSIFICADOR DEL CONCRETO. | D138: Inventariable | M138: 1 | N138: GALON | O138: 12162305 | Q138: MXN | R138: 127.2 | S138: Trasladado | T138: IVA | U138: 0.16 | V138: of:=[.R138]*0.16 -> 20.352 | W138: of:=[.R138]*1.16 -> 147.552 | X138: 212 | Y138: Trasladado | Z138: IVA | AA138: 0.16 | AB138: of:=[.X138]*0.16 -> 33.92 | AC138: of:=[.X138]*1.16 -> 245.92 | AD138: SELLADORES Y ADITIVOS | AE138: CURACRETO, S.A. DE C.V. | AL138: NO | AM138: SI | AN138: NO | AO138: 15 | AP138: 19 | AQ138: 18 | AR138: 4 | AS138: CURACRETO
A139: 0291110158 | B139: ESTABLICRETO NF SACO 50 KG | C139: CEMENTO HIDRÃULICOÂ SIN CONTRACCIÃN. NO METÃLICO. | D139: Inventariable | M139: 2 | N139: SACO | O139: 30111504 | Q139: MXN | R139: 1390.8 | S139: Trasladado | T139: IVA | U139: 0.16 | V139: of:=[.R139]*0.16 -> 222.528 | W139: of:=[.R139]*1.16 -> 1613.328 | X139: 849 | Y139: Trasladado | Z139: IVA | AA139: 0.16 | AB139: of:=[.X139]*0.16 -> 135.84 | AC139: of:=[.X139]*1.16 -> 984.84 | AD139: MORTEROS | AE139: CURACRETO, S.A. DE C.V. | AL139: NO | AM139: SI | AN139: NO | AO139: 12 | AP139: 50 | AQ139: 25 | AR139: 50 | AS139: CURACRETO
A140: 029112031Y | B140: MORTERCRETO INTEGRAL POLVO N 20 KG | C140: COMPUESTO HIDRÃFOBO QUE SELLA LOS POROS CAPILARES DEL CONCRETO REDUCIENDO SU PERMEABILIDAD. | D140: Inventariable | M140: 4 | N140: SACO | O140: 30111504 | Q140: MXN | R140: 244.8 | S140: Trasladado | T140: IVA | U140: 0.16 | V140: of:=[.R140]*0.16 -> 39.168 | W140: of:=[.R140]*1.16 -> 283.968 | X140: 408 | Y140: Trasladado | Z140: IVA | AA140: 0.16 | AB140: of:=[.X140]*0.16 -> 65.28 | AC140: of:=[.X140]*1.16 -> 473.28 | AD140: MORTEROS | AE140: CURACRETO, S.A. DE C.V. | AL140: NO | AM140: SI | AN140: NO | AO140: 8 | AP140: 50 | AQ140: 25 | AR140: 20 | AS140: CURACRETO
A141: 1011310258 | B141: SILICACRETO BULTO 50 KG | C141: ARENA SILICA DE GRANULOMETRÃA UNIFORME | D141: Inventariable | M141: 3 | N141: SACO | O141: 30111504 | Q141: MXN | R141: 231.6 | S141: Trasladado | T141: IVA | U141: 0.16 | V141: of:=[.R141]*0.16 -> 37.056 | W141: of:=[.R141]*1.16 -> 268.656 | X141: 386 | Y141: Trasladado | Z141: IVA | AA141: 0.16 | AB141: of:=[.X141]*0.16 -> 61.76 | AC141: of:=[.X141]*1.16 -> 447.76 | AD141: MORTEROS | AE141: CURACRETO, S.A. DE C.V. | AL141: NO | AM141: SI | AN141: NO | AO141: 12 | AP141: 50 | AQ141: 25 | AR141: 50 | AS141: CURACRETO
A142: 7915001XLT | B142: CORROCRETO 1 LT | C142: RECUBRIMIENTO BASE AGUA PARA EL TRATAMIENTO DE SUPERFICIES OXIDADAS. | D142: Inventariable | M142: 2 | N142: LITRO | O142: 15121800 | Q142: MXN | R142: 176.29 | S142: Trasladado | T142: IVA | U142: 0.16 | V142: of:=[.R142]*0.16 -> 28.2064 | W142: of:=[.R142]*1.16 -> 204.4964 | X142: of:=[.AC142]/1.16 -> 175.862069 | Y142: Trasladado | Z142: IVA | AA142: 0.16 | AB142: of:=[.X142]*0.16 -> 28.13793104 | AC142: 204 | AD142: SELLADORES Y ADITIVOS | AE142: CURACRETO, S.A. DE C.V. | AL142: NO | AM142: SI | AN142: NO | AO142: 5 | AP142: 21.2 | AQ142: 5 | AR142: 1 | AS142: CURACRETO
A143: 791500109 | B143: CORROCRETO 19LT | C143: RECUBRIMIENTO BASE AGUA PARA EL TRATAMIENTO DE SUPERFICIES OXIDADAS. | D143: Inventariable | M143: 0 | N143: CUBETA | O143: 15121800 | Q143: MXN | R143: 1952.3 | S143: Trasladado | T143: IVA | U143: 0.16 | V143: of:=[.R143]*0.16 -> 312.368 | W143: of:=[.R143]*1.16 -> 2264.668 | X143: 2656 | Y143: Trasladado | Z143: IVA | AA143: 0.16 | AB143: of:=[.X143]*0.16 -> 424.96 | AC143: of:=[.X143]*1.16 -> 3080.96 | AD143: SELLADORES Y ADITIVOS | AE143: CURACRETO, S.A. DE C.V. | AL143: NO | AM143: SI | AN143: NO | AO143: 31 | AP143: 37 | AQ143: 31 | AR143: 19 | AS143: CURACRETO
A144: LAG06 | B144: LIJA DE AGUA GRANO 60 | C144: LIJA DE AGUA GRANO 60 | D144: Inventariable | M144: 6 | N144: PIEZA | O144: 11101502 | Q144: MXN | R144: 5.35 | S144: Trasladado | T144: IVA | U144: 0.16 | V144: of:=[.R144]*0.16 -> 0.856 | W144: of:=[.R144]*1.16 -> 6.206 | X144: 7.65 | Y144: Trasladado | Z144: IVA | AA144: 0.16 | AB144: of:=[.X144]*0.16 -> 1.224 | AC144: of:=[.X144]*1.16 -> 8.874 | AD144: LIJAS | AE144: BROCHAS Y PRODUCTOS S. DE R.L. DE C.V. | AL144: NO | AM144: SI | AN144: NO | AO144: 23 | AP144: 29 | AQ144: 29 | AR144: 300 | AS144: BYP
A145: LAG08 | B145: LIJA DE AGUA GRANO 80 | C145: LIJA DE AGUA GRANO 80 | D145: Inventariable | M145: 37 | N145: PIEZA | O145: 11101502 | Q145: MXN | R145: 5.35 | S145: Trasladado | T145: IVA | U145: 0.16 | V145: of:=[.R145]*0.16 -> 0.856 | W145: of:=[.R145]*1.16 -> 6.206 | X145: 7.65 | Y145: Trasladado | Z145: IVA | AA145: 0.16 | AB145: of:=[.X145]*0.16 -> 1.224 | AC145: of:=[.X145]*1.16 -> 8.874 | AD145: LIJAS | AE145: BROCHAS Y PRODUCTOS S. DE R.L. DE C.V. | AL145: NO | AM145: SI | AN145: NO | AO145: 23 | AP145: 29 | AQ145: 29 | AR145: 300 | AS145: BYP
A146: LAG10 | B146: LIJA DE AGUA GRANO 100 | C146: LIJA DE AGUA GRANO 100 | D146: Inventariable | M146: 14 | N146: PIEZA | O146: 11101502 | Q146: MXN | R146: 5.35 | S146: Trasladado | T146: IVA | U146: 0.16 | V146: of:=[.R146]*0.16 -> 0.856 | W146: of:=[.R146]*1.16 -> 6.206 | X146: 7.65 | Y146: Trasladado | Z146: IVA | AA146: 0.16 | AB146: of:=[.X146]*0.16 -> 1.224 | AC146: of:=[.X146]*1.16 -> 8.874 | AD146: LIJAS | AE146: BROCHAS Y PRODUCTOS S. DE R.L. DE C.V. | AL146: NO | AM146: SI | AN146: NO | AO146: 23 | AP146: 29 | AQ146: 29 | AR146: 300 | AS146: BYP
A147: LAG120 | B147: LIJA DE AGUA GRANO 120 | C147: LIJA DE AGUA GRANO 120 | D147: Inventariable | M147: 0 | N147: PIEZA | O147: 11101502 | Q147: MXN | R147: 5.35 | S147: Trasladado | T147: IVA | U147: 0.16 | V147: of:=[.R147]*0.16 -> 0.856 | W147: of:=[.R147]*1.16 -> 6.206 | X147: 7.65 | Y147: Trasladado | Z147: IVA | AA147: 0.16 | AB147: of:=[.X147]*0.16 -> 1.224 | AC147: of:=[.X147]*1.16 -> 8.874 | AD147: LIJAS | AE147: BROCHAS Y PRODUCTOS S. DE R.L. DE C.V. | AL147: NO | AM147: SI | AN147: NO | AO147: 23 | AP147: 29 | AQ147: 29 | AR147: 300 | AS147: BYP
A148: LAG15 | B148: LIJA DE AGUA GRANO 150 | C148: LIJA DE AGUA GRANO 150 | D148: Inventariable | M148: 25 | N148: PIEZA | O148: 11101502 | Q148: MXN | R148: 5.35 | S148: Trasladado | T148: IVA | U148: 0.16 | V148: of:=[.R148]*0.16 -> 0.856 | W148: of:=[.R148]*1.16 -> 6.206 | X148: 7.65 | Y148: Trasladado | Z148: IVA | AA148: 0.16 | AB148: of:=[.X148]*0.16 -> 1.224 | AC148: of:=[.X148]*1.16 -> 8.874 | AD148: LIJAS | AE148: BROCHAS Y PRODUCTOS S. DE R.L. DE C.V. | AL148: NO | AM148: SI | AN148: NO | AO148: 23 | AP148: 29 | AQ148: 29 | AR148: 300 | AS148: BYP
A149: LAG18 | B149: LIJA DE AGUA GRANO 180 | C149: LIJA DE AGUA GRANO 180 | D149: Inventariable | M149: 25 | N149: PIEZA | O149: 11101502 | Q149: MXN | R149: 5.35 | S149: Trasladado | T149: IVA | U149: 0.16 | V149: of:=[.R149]*0.16 -> 0.856 | W149: of:=[.R149]*1.16 -> 6.206 | X149: 7.65 | Y149: Trasladado | Z149: IVA | AA149: 0.16 | AB149: of:=[.X149]*0.16 -> 1.224 | AC149: of:=[.X149]*1.16 -> 8.874 | AD149: LIJAS | AE149: BROCHAS Y PRODUCTOS S. DE R.L. DE C.V. | AL149: NO | AM149: SI | AN149: NO | AO149: 23 | AP149: 29 | AQ149: 29 | AR149: 300 | AS149: BYP
A150: LAG22 | B150: LIJA DE AGUA GRANO 220 | C150: LIJA DE AGUA GRANO 220 | D150: Inventariable | M150: 0 | N150: PIEZA | O150: 11101502 | Q150: MXN | R150: 5.35 | S150: Trasladado | T150: IVA | U150: 0.16 | V150: of:=[.R150]*0.16 -> 0.856 | W150: of:=[.R150]*1.16 -> 6.206 | X150: 7.65 | Y150: Trasladado | Z150: IVA | AA150: 0.16 | AB150: of:=[.X150]*0.16 -> 1.224 | AC150: of:=[.X150]*1.16 -> 8.874 | AD150: LIJAS | AE150: BROCHAS Y PRODUCTOS S. DE R.L. DE C.V. | AL150: NO | AM150: SI | AN150: NO | AO150: 23 | AP150: 29 | AQ150: 29 | AR150: 300 | AS150: BYP
A151: LAG24 | B151: LIJA DE AGUA GRANO 240 | C151: LIJA DE AGUA GRANO 240 | D151: Inventariable | M151: 0 | N151: PIEZA | O151: 11101502 | Q151: MXN | R151: 5.35 | S151: Trasladado | T151: IVA | U151: 0.16 | V151: of:=[.R151]*0.16 -> 0.856 | W151: of:=[.R151]*1.16 -> 6.206 | X151: 7.65 | Y151: Trasladado | Z151: IVA | AA151: 0.16 | AB151: of:=[.X151]*0.16 -> 1.224 | AC151: of:=[.X151]*1.16 -> 8.874 | AD151: LIJAS | AE151: BROCHAS Y PRODUCTOS S. DE R.L. DE C.V. | AL151: NO | AM151: SI | AN151: NO | AO151: 23 | AP151: 29 | AQ151: 29 | AR151: 300 | AS151: BYP
A152: LAG32 | B152: LIJA DE AGUA GRANO 320 | C152: LIJA DE AGUA GRANO 320 | D152: Inventariable | M152: 50 | N152: PIEZA | O152: 11101502 | Q152: MXN | R152: 5.35 | S152: Trasladado | T152: IVA | U152: 0.16 | V152: of:=[.R152]*0.16 -> 0.856 | W152: of:=[.R152]*1.16 -> 6.206 | X152: 7.65 | Y152: Trasladado | Z152: IVA | AA152: 0.16 | AB152: of:=[.X152]*0.16 -> 1.224 | AC152: of:=[.X152]*1.16 -> 8.874 | AD152: LIJAS | AE152: BROCHAS Y PRODUCTOS S. DE R.L. DE C.V. | AL152: NO | AM152: SI | AN152: NO | AO152: 23 | AP152: 29 | AQ152: 29 | AR152: 300 | AS152: BYP
A153: LAG40 | B153: LIJA DE AGUA GRANO 400 | C153: LIJA DE AGUA GRANO 400 | D153: Inventariable | M153: 25 | N153: PIEZA | O153: 11101502 | Q153: MXN | R153: 5.35 | S153: Trasladado | T153: IVA | U153: 0.16 | V153: of:=[.R153]*0.16 -> 0.856 | W153: of:=[.R153]*1.16 -> 6.206 | X153: 7.65 | Y153: Trasladado | Z153: IVA | AA153: 0.16 | AB153: of:=[.X153]*0.16 -> 1.224 | AC153: of:=[.X153]*1.16 -> 8.874 | AD153: LIJAS | AE153: BROCHAS Y PRODUCTOS S. DE R.L. DE C.V. | AL153: NO | AM153: SI | AN153: NO | AO153: 23 | AP153: 29 | AQ153: 29 | AR153: 300 | AS153: BYP
A154: LAG80 | B154: LIJA DE AGUA GRANO 800 | C154: LIJA DE AGUA GRANO 800 | D154: Inventariable | M154: 0 | N154: PIEZA | O154: 11101502 | Q154: MXN | R154: 5.35 | S154: Trasladado | T154: IVA | U154: 0.16 | V154: of:=[.R154]*0.16 -> 0.856 | W154: of:=[.R154]*1.16 -> 6.206 | X154: 7.65 | Y154: Trasladado | Z154: IVA | AA154: 0.16 | AB154: of:=[.X154]*0.16 -> 1.224 | AC154: of:=[.X154]*1.16 -> 8.874 | AD154: LIJAS | AE154: BROCHAS Y PRODUCTOS S. DE R.L. DE C.V. | AL154: NO | AM154: SI | AN154: NO | AO154: 23 | AP154: 29 | AQ154: 29 | AR154: 300 | AS154: BYP
A155: LAG12 | B155: LIJA DE AGUA GRANO 1200 | C155: LIJA DE AGUA GRANO 1200 | D155: Inventariable | M155: 0 | N155: PIEZA | O155: 11101502 | Q155: MXN | R155: 5.35 | S155: Trasladado | T155: IVA | U155: 0.16 | V155: of:=[.R155]*0.16 -> 0.856 | W155: of:=[.R155]*1.16 -> 6.206 | X155: 7.65 | Y155: Trasladado | Z155: IVA | AA155: 0.16 | AB155: of:=[.X155]*0.16 -> 1.224 | AC155: of:=[.X155]*1.16 -> 8.874 | AD155: LIJAS | AE155: BROCHAS Y PRODUCTOS S. DE R.L. DE C.V. | AL155: NO | AM155: SI | AN155: NO | AO155: 23 | AP155: 29 | AQ155: 29 | AR155: 300 | AS155: BYP
A156: BSU05 | B156: BROCHA LA SUPER 1/2" | C156: BROCHA DE CERDA NATURAL DE USO DOMESTICO, TODA CLASE DE PINTURAS CORTE RECTO | D156: Inventariable | M156: 0 | N156: PIEZA | O156: 31211904 | Q156: MXN | R156: 3.82 | S156: Trasladado | T156: IVA | U156: 0.16 | V156: of:=[.R156]*0.16 -> 0.6112 | W156: of:=[.R156]*1.16 -> 4.4312 | X156: 5.45 | Y156: Trasladado | Z156: IVA | AA156: 0.16 | AB156: of:=[.X156]*0.16 -> 0.872 | AC156: of:=[.X156]*1.16 -> 6.322 | AD156: BROCHAS | AE156: BROCHAS Y PRODUCTOS S. DE R.L. DE C.V. | AL156: NO | AM156: SI | AN156: NO | AO156: 1.5 | AP156: 17 | AQ156: 2 | AR156: 0.01 | AS156: BYP
A157: BSU10 | B157: BROCHA LA SUPER 1" | C157: BROCHA DE CERDA NATURAL DE USO DOMESTICO, TODA CLASE DE PINTURAS CORTE RECTO | D157: Inventariable | M157: 15 | N157: PIEZA | O157: 31211904 | Q157: MXN | R157: 5.32 | S157: Trasladado | T157: IVA | U157: 0.16 | V157: of:=[.R157]*0.16 -> 0.8512 | W157: of:=[.R157]*1.16 -> 6.1712 | X157: 7.6 | Y157: Trasladado | Z157: IVA | AA157: 0.16 | AB157: of:=[.X157]*0.16 -> 1.216 | AC157: of:=[.X157]*1.16 -> 8.816 | AD157: BROCHAS | AE157: BROCHAS Y PRODUCTOS S. DE R.L. DE C.V. | AL157: NO | AM157: SI | AN157: NO | AO157: 1.5 | AP157: 19 | AQ157: 3 | AR157: 0.02 | AS157: BYP
A158: BSU15 | B158: BROCHA LA SUPER 1-1/2" | C158: BROCHA DE CERDA NATURAL DE USO DOMESTICO, TODA CLASE DE PINTURAS CORTE RECTO | D158: Inventariable | M158: 33 | N158: PIEZA | O158: 31211904 | Q158: MXN | R158: 6.27 | S158: Trasladado | T158: IVA | U158: 0.16 | V158: of:=[.R158]*0.16 -> 1.0032 | W158: of:=[.R158]*1.16 -> 7.2732 | X158: 8.95 | Y158: Trasladado | Z158: IVA | AA158: 0.16 | AB158: of:=[.X158]*0.16 -> 1.432 | AC158: of:=[.X158]*1.16 -> 10.382 | AD158: BROCHAS | AE158: BROCHAS Y PRODUCTOS S. DE R.L. DE C.V. | AL158: NO | AM158: SI | AN158: NO | AO158: 1.5 | AP158: 19 | AQ158: 4 | AR158: 0.03 | AS158: BYP
A159: BSU20 | B159: BROCHA LA SUPER 2" | C159: BROCHA DE CERDA NATURAL DE USO DOMESTICO, TODA CLASE DE PINTURAS CORTE RECTO | D159: Inventariable | M159: 5 | N159: PIEZA | O159: 31211904 | Q159: MXN | R159: 8.23 | S159: Trasladado | T159: IVA | U159: 0.16 | V159: of:=[.R159]*0.16 -> 1.3168 | W159: of:=[.R159]*1.16 -> 9.5468 | X159: 11.75 | Y159: Trasladado | Z159: IVA | AA159: 0.16 | AB159: of:=[.X159]*0.16 -> 1.88 | AC159: of:=[.X159]*1.16 -> 13.63 | AD159: BROCHAS | AE159: BROCHAS Y PRODUCTOS S. DE R.L. DE C.V. | AL159: NO | AM159: SI | AN159: NO | AO159: 1.5 | AP159: 19 | AQ159: 5 | AR159: 0.03 | AS159: BYP
A160: BSU25 | B160: BROCHA LA SUPER 2-1/2" | C160: BROCHA DE CERDA NATURAL DE USO DOMESTICO, TODA CLASE DE PINTURAS CORTE RECTO | D160: Inventariable | M160: 24 | N160: PIEZA | O160: 31211904 | Q160: MXN | R160: 10.47 | S160: Trasladado | T160: IVA | U160: 0.16 | V160: of:=[.R160]*0.16 -> 1.6752 | W160: of:=[.R160]*1.16 -> 12.1452 | X160: 14.95 | Y160: Trasladado | Z160: IVA | AA160: 0.16 | AB160: of:=[.X160]*0.16 -> 2.392 | AC160: of:=[.X160]*1.16 -> 17.342 | AD160: BROCHAS | AE160: BROCHAS Y PRODUCTOS S. DE R.L. DE C.V. | AL160: NO | AM160: SI | AN160: NO | AO160: 1.5 | AP160: 20 | AQ160: 6.4 | AR160: 0.04 | AS160: BYP
A161: BSU30 | B161: BROCHA LA SUPER 3" | C161: BROCHA DE CERDA NATURAL DE USO DOMESTICO, TODA CLASE DE PINTURAS CORTE RECTO | D161: Inventariable | M161: 0 | N161: PIEZA | O161: 31211904 | Q161: MXN | R161: 12.95 | S161: Trasladado | T161: IVA | U161: 0.16 | V161: of:=[.R161]*0.16 -> 2.072 | W161: of:=[.R161]*1.16 -> 15.022 | X161: 18.5 | Y161: Trasladado | Z161: IVA | AA161: 0.16 | AB161: of:=[.X161]*0.16 -> 2.96 | AC161: of:=[.X161]*1.16 -> 21.46 | AD161: BROCHAS | AE161: BROCHAS Y PRODUCTOS S. DE R.L. DE C.V. | AL161: NO | AM161: SI | AN161: NO | AO161: 1.5 | AP161: 21 | AQ161: 8 | AR161: 0.08 | AS161: BYP
A162: BSU40 | B162: BROCHA LA SUPER 4" | C162: BROCHA DE CERDA NATURAL DE USO DOMESTICO, TODA CLASE DE PINTURAS CORTE RECTO | D162: Inventariable | M162: 4 | N162: PIEZA | O162: 31211904 | Q162: MXN | R162: 19.43 | S162: Trasladado | T162: IVA | U162: 0.16 | V162: of:=[.R162]*0.16 -> 3.1088 | W162: of:=[.R162]*1.16 -> 22.5388 | X162: 27.75 | Y162: Trasladado | Z162: IVA | AA162: 0.16 | AB162: of:=[.X162]*0.16 -> 4.44 | AC162: of:=[.X162]*1.16 -> 32.19 | AD162: BROCHAS | AE162: BROCHAS Y PRODUCTOS S. DE R.L. DE C.V. | AL162: NO | AM162: SI | AN162: NO | AO162: 1.5 | AP162: 22 | AQ162: 10 | AR162: 0.08 | AS162: BYP
A163: BSU50 | B163: BROCHA LA SUPER 5" | C163: BROCHA DE CERDA NATURAL DE USO DOMESTICO, TODA CLASE DE PINTURAS CORTE RECTO | D163: Inventariable | M163: 30 | N163: PIEZA | O163: 31211904 | Q163: MXN | R163: 25.27 | S163: Trasladado | T163: IVA | U163: 0.16 | V163: of:=[.R163]*0.16 -> 4.0432 | W163: of:=[.R163]*1.16 -> 29.3132 | X163: 36.1 | Y163: Trasladado | Z163: IVA | AA163: 0.16 | AB163: of:=[.X163]*0.16 -> 5.776 | AC163: of:=[.X163]*1.16 -> 41.876 | AD163: BROCHAS | AE163: BROCHAS Y PRODUCTOS S. DE R.L. DE C.V. | AL163: NO | AM163: SI | AN163: NO | AO163: 1.5 | AP163: 24 | AQ163: 13 | AR163: 0.09 | AS163: BYP
A164: BSU60 | B164: BROCHA LA SUPER 6" | C164: BROCHA DE CERDA NATURAL DE USO DOMESTICO, TODA CLASE DE PINTURAS CORTE RECTO | D164: Inventariable | M164: 36 | N164: PIEZA | O164: 31211904 | Q164: MXN | R164: 27.58 | S164: Trasladado | T164: IVA | U164: 0.16 | V164: of:=[.R164]*0.16 -> 4.4128 | W164: of:=[.R164]*1.16 -> 31.9928 | X164: 39.4 | Y164: Trasladado | Z164: IVA | AA164: 0.16 | AB164: of:=[.X164]*0.16 -> 6.304 | AC164: of:=[.X164]*1.16 -> 45.704 | AD164: BROCHAS | AE164: BROCHAS Y PRODUCTOS S. DE R.L. DE C.V. | AL164: NO | AM164: SI | AN164: NO | AO164: 1.5 | AP164: 25 | AQ164: 15 | AR164: 0.18 | AS164: BYP
A165: BCB10 | B165: BROCHA CHIP 1" | C165: BROCHA DE CERDA NATURAL BLANCA CON MANGO DE MADERA NATURAL, TODA CLASE DE PINTURAS CORTE RECTO | D165: Inventariable | N165: PIEZA | O165: 31211904 | Q165: MXN | R165: 4.13 | S165: Trasladado | T165: IVA | U165: 0.16 | V165: of:=[.R165]*0.16 -> 0.6608 | W165: of:=[.R165]*1.16 -> 4.7908 | X165: 5.9 | Y165: Trasladado | Z165: IVA | AA165: 0.16 | AB165: of:=[.X165]*0.16 -> 0.944 | AC165: of:=[.X165]*1.16 -> 6.844 | AD165: BROCHAS | AE165: BROCHAS Y PRODUCTOS S. DE R.L. DE C.V. | AL165: NO | AM165: SI | AN165: NO | AO165: 1.5 | AP165: 19 | AQ165: 3 | AR165: 0.02 | AS165: BYP
A166: BCB15 | B166: BROCHA CHIP 1-1/2" | C166: BROCHA DE CERDA NATURAL BLANCA CON MANGO DE MADERA NATURAL, TODA CLASE DE PINTURAS CORTE RECTO | D166: Inventariable | N166: PIEZA | O166: 31211904 | Q166: MXN | R166: 5.11 | S166: Trasladado | T166: IVA | U166: 0.16 | V166: of:=[.R166]*0.16 -> 0.8176 | W166: of:=[.R166]*1.16 -> 5.9276 | X166: 7.3 | Y166: Trasladado | Z166: IVA | AA166: 0.16 | AB166: of:=[.X166]*0.16 -> 1.168 | AC166: of:=[.X166]*1.16 -> 8.468 | AD166: BROCHAS | AE166: BROCHAS Y PRODUCTOS S. DE R.L. DE C.V. | AL166: NO | AM166: SI | AN166: NO | AO166: 1.5 | AP166: 19 | AQ166: 4 | AR166: 0.03 | AS166: BYP
A167: BCB20 | B167: BROCHA CHIP 2" | C167: BROCHA DE CERDA NATURAL BLANCA CON MANGO DE MADERA NATURAL, TODA CLASE DE PINTURAS CORTE RECTO | D167: Inventariable | M167: 74 | N167: PIEZA | O167: 31211904 | Q167: MXN | R167: 6.58 | S167: Trasladado | T167: IVA | U167: 0.16 | V167: of:=[.R167]*0.16 -> 1.0528 | W167: of:=[.R167]*1.16 -> 7.6328 | X167: 9.4 | Y167: Trasladado | Z167: IVA | AA167: 0.16 | AB167: of:=[.X167]*0.16 -> 1.504 | AC167: of:=[.X167]*1.16 -> 10.904 | AD167: BROCHAS | AE167: BROCHAS Y PRODUCTOS S. DE R.L. DE C.V. | AL167: NO | AM167: SI | AN167: NO | AO167: 1.5 | AP167: 19 | AQ167: 5 | AR167: 0.03 | AS167: BYP
A168: BCB25 | B168: BROCHA CHIP 2-1/2" | C168: BROCHA DE CERDA NATURAL BLANCA CON MANGO DE MADERA NATURAL, TODA CLASE DE PINTURAS CORTE RECTO | D168: Inventariable | N168: PIEZA | O168: 31211904 | Q168: MXN | R168: 7.42 | S168: Trasladado | T168: IVA | U168: 0.16 | V168: of:=[.R168]*0.16 -> 1.1872 | W168: of:=[.R168]*1.16 -> 8.6072 | X168: 10.6 | Y168: Trasladado | Z168: IVA | AA168: 0.16 | AB168: of:=[.X168]*0.16 -> 1.696 | AC168: of:=[.X168]*1.16 -> 12.296 | AD168: BROCHAS | AE168: BROCHAS Y PRODUCTOS S. DE R.L. DE C.V. | AL168: NO | AM168: SI | AN168: NO | AO168: 1.5 | AP168: 19 | AQ168: 4 | AR168: 0.04 | AS168: BYP
A169: BCB30 | B169: BROCHA CHIP 3" | C169: BROCHA DE CERDA NATURAL BLANCA CON MANGO DE MADERA NATURAL, TODA CLASE DE PINTURAS CORTE RECTO | D169: Inventariable | N169: PIEZA | O169: 31211904 | Q169: MXN | R169: 9.31 | S169: Trasladado | T169: IVA | U169: 0.16 | V169: of:=[.R169]*0.16 -> 1.4896 | W169: of:=[.R169]*1.16 -> 10.7996 | X169: 13.3 | Y169: Trasladado | Z169: IVA | AA169: 0.16 | AB169: of:=[.X169]*0.16 -> 2.128 | AC169: of:=[.X169]*1.16 -> 15.428 | AD169: BROCHAS | AE169: BROCHAS Y PRODUCTOS S. DE R.L. DE C.V. | AL169: NO | AM169: SI | AN169: NO | AO169: 1.5 | AP169: 21 | AQ169: 8 | AR169: 0.08 | AS169: BYP
A170: BCB40 | B170: BROCHA CHIP 4" | C170: BROCHA DE CERDA NATURAL BLANCA CON MANGO DE MADERA NATURAL, TODA CLASE DE PINTURAS CORTE RECTO | D170: Inventariable | N170: PIEZA | O170: 31211904 | Q170: MXN | R170: 13.62 | S170: Trasladado | T170: IVA | U170: 0.16 | V170: of:=[.R170]*0.16 -> 2.1792 | W170: of:=[.R170]*1.16 -> 15.7992 | X170: 19.45 | Y170: Trasladado | Z170: IVA | AA170: 0.16 | AB170: of:=[.X170]*0.16 -> 3.112 | AC170: of:=[.X170]*1.16 -> 22.562 | AD170: BROCHAS | AE170: BROCHAS Y PRODUCTOS S. DE R.L. DE C.V. | AL170: NO | AM170: SI | AN170: NO | AO170: 1.5 | AP170: 22 | AQ170: 10 | AR170: 0.08 | AS170: BYP
A171: BCA10 | B171: BROCHA CAMELUS 1" | C171: BROCHA ESPECIAL DE PELO EXTRA FINO, LIBRE DE GRASAS Y ACEITES, CORTE RECTO | D171: Inventariable | N171: PIEZA | O171: 31211904 | Q171: MXN | R171: 11.76 | S171: Trasladado | T171: IVA | U171: 0.16 | V171: of:=[.R171]*0.16 -> 1.8816 | W171: of:=[.R171]*1.16 -> 13.6416 | X171: 16.8 | Y171: Trasladado | Z171: IVA | AA171: 0.16 | AB171: of:=[.X171]*0.16 -> 2.688 | AC171: of:=[.X171]*1.16 -> 19.488 | AD171: BROCHAS | AE171: BROCHAS Y PRODUCTOS S. DE R.L. DE C.V. | AL171: NO | AM171: SI | AN171: NO | AO171: 1.5 | AP171: 19 | AQ171: 3 | AR171: 0.02 | AS171: BYP
A172: BCA05 | B172: BROCHA CAMELUS 1/2" | C172: BROCHA ESPECIAL DE PELO EXTRA FINO, LIBRE DE GRASAS Y ACEITES, CORTE RECTO | D172: Inventariable | M172: 8 | N172: PIEZA | O172: 31211904 | Q172: MXN | R172: 9.7 | S172: Trasladado | T172: IVA | U172: 0.16 | V172: of:=[.R172]*0.16 -> 1.552 | W172: of:=[.R172]*1.16 -> 11.252 | X172: 13.85 | Y172: Trasladado | Z172: IVA | AA172: 0.16 | AB172: of:=[.X172]*0.16 -> 2.216 | AC172: of:=[.X172]*1.16 -> 16.066 | AD172: BROCHAS | AE172: BROCHAS Y PRODUCTOS S. DE R.L. DE C.V. | AL172: NO | AM172: SI | AN172: NO | AO172: 1.5 | AP172: 17 | AQ172: 2 | AR172: 0.01 | AS172: BYP
A173: BCA15 | B173: BROCHA CAMELUS 1-1/2" | C173: BROCHA ESPECIAL DE PELO EXTRA FINO, LIBRE DE GRASAS Y ACEITES, CORTE RECTO | D173: Inventariable | M173: 11 | N173: PIEZA | O173: 31211904 | Q173: MXN | R173: 15.65 | S173: Trasladado | T173: IVA | U173: 0.16 | V173: of:=[.R173]*0.16 -> 2.504 | W173: of:=[.R173]*1.16 -> 18.154 | X173: 22.35 | Y173: Trasladado | Z173: IVA | AA173: 0.16 | AB173: of:=[.X173]*0.16 -> 3.576 | AC173: of:=[.X173]*1.16 -> 25.926 | AD173: BROCHAS | AE173: BROCHAS Y PRODUCTOS S. DE R.L. DE C.V. | AL173: NO | AM173: SI | AN173: NO | AO173: 1.5 | AP173: 19 | AQ173: 4 | AR173: 0.03 | AS173: BYP
A174: BCA20 | B174: BROCHA CAMELUS 2" | C174: BROCHA ESPECIAL DE PELO EXTRA FINO, LIBRE DE GRASAS Y ACEITES, CORTE RECTO | D174: Inventariable | M174: 12 | N174: PIEZA | O174: 31211904 | Q174: MXN | R174: 26.18 | S174: Trasladado | T174: IVA | U174: 0.16 | V174: of:=[.R174]*0.16 -> 4.1888 | W174: of:=[.R174]*1.16 -> 30.3688 | X174: 37.4 | Y174: Trasladado | Z174: IVA | AA174: 0.16 | AB174: of:=[.X174]*0.16 -> 5.984 | AC174: of:=[.X174]*1.16 -> 43.384 | AD174: BROCHAS | AE174: BROCHAS Y PRODUCTOS S. DE R.L. DE C.V. | AL174: NO | AM174: SI | AN174: NO | AO174: 1.5 | AP174: 19 | AQ174: 5 | AR174: 0.03 | AS174: BYP
A175: BCA30 | B175: BROCHA CAMELUS 3" | C175: BROCHA ESPECIAL DE PELO EXTRA FINO, LIBRE DE GRASAS Y ACEITES, CORTE RECTO | D175: Inventariable | M175: 18 | N175: PIEZA | O175: 31211904 | Q175: MXN | R175: 42.07 | S175: Trasladado | T175: IVA | U175: 0.16 | V175: of:=[.R175]*0.16 -> 6.7312 | W175: of:=[.R175]*1.16 -> 48.8012 | X175: 60.1 | Y175: Trasladado | Z175: IVA | AA175: 0.16 | AB175: of:=[.X175]*0.16 -> 9.616 | AC175: of:=[.X175]*1.16 -> 69.716 | AD175: BROCHAS | AE175: BROCHAS Y PRODUCTOS S. DE R.L. DE C.V. | AL175: NO | AM175: SI | AN175: NO | AO175: 1.5 | AP175: 21 | AQ175: 8 | AR175: 0.08 | AS175: BYP
A176: BCA40 | B176: BROCHA CAMELUS 4" | C176: BROCHA ESPECIAL DE PELO EXTRA FINO, LIBRE DE GRASAS Y ACEITES, CORTE RECTO | D176: Inventariable | M176: 12 | N176: PIEZA | O176: 31211904 | Q176: MXN | R176: 48.23 | S176: Trasladado | T176: IVA | U176: 0.16 | V176: of:=[.R176]*0.16 -> 7.7168 | W176: of:=[.R176]*1.16 -> 55.9468 | X176: 68.9 | Y176: Trasladado | Z176: IVA | AA176: 0.16 | AB176: of:=[.X176]*0.16 -> 11.024 | AC176: of:=[.X176]*1.16 -> 79.924 | AD176: BROCHAS | AE176: BROCHAS Y PRODUCTOS S. DE R.L. DE C.V. | AL176: NO | AM176: SI | AN176: NO | AO176: 1.5 | AP176: 22 | AQ176: 10 | AR176: 0.09 | AS176: BYP
A177: BLP0025 | B177: BROCHA LA PROFESIONAL 2-1/2" | C177: BROCHA CON SERDA ABUDANTE EXTRA LARGA PARA ACABADO EN MENOR TIEMPO | D177: Inventariable | N177: PIEZA | O177: 31211904 | Q177: MXN | R177: 30.31 | S177: Trasladado | T177: IVA | U177: 0.16 | V177: of:=[.R177]*0.16 -> 4.8496 | W177: of:=[.R177]*1.16 -> 35.1596 | X177: 32.25 | Y177: Trasladado | Z177: IVA | AA177: 0.16 | AB177: of:=[.X177]*0.16 -> 5.16 | AC177: of:=[.X177]*1.16 -> 37.41 | AD177: BROCHAS | AE177: BROCHAS Y PRODUCTOS S. DE R.L. DE C.V. | AL177: NO | AM177: SI | AN177: NO | AO177: 1.5 | AP177: 20 | AQ177: 6.4 | AR177: 0.04 | AS177: BYP
A178: BLP0030 | B178: BROCHA LA PROFESIONAL 3" | C178: BROCHA CON SERDA ABUDANTE EXTRA LARGA PARA ACABADO EN MENOR TIEMPO | D178: Inventariable | N178: PIEZA | O178: 31211904 | Q178: MXN | R178: 41.69 | S178: Trasladado | T178: IVA | U178: 0.16 | V178: of:=[.R178]*0.16 -> 6.6704 | W178: of:=[.R178]*1.16 -> 48.3604 | X178: 138.8 | Y178: Trasladado | Z178: IVA | AA178: 0.16 | AB178: of:=[.X178]*0.16 -> 22.208 | AC178: of:=[.X178]*1.16 -> 161.008 | AD178: BROCHAS | AE178: BROCHAS Y PRODUCTOS S. DE R.L. DE C.V. | AL178: NO | AM178: SI | AN178: NO | AO178: 1.5 | AP178: 21 | AQ178: 8 | AR178: 0.05 | AS178: BYP
A179: BLP0040 | B179: BROCHA LA PROFESIONAL 4" | C179: BROCHA CON SERDA ABUDANTE EXTRA LARGA PARA ACABADO EN MENOR TIEMPO | D179: Inventariable | N179: PIEZA | O179: 31211904 | Q179: MXN | R179: 59.15 | S179: Trasladado | T179: IVA | U179: 0.16 | V179: of:=[.R179]*0.16 -> 9.464 | W179: of:=[.R179]*1.16 -> 68.614 | X179: 19.8 | Y179: Trasladado | Z179: IVA | AA179: 0.16 | AB179: of:=[.X179]*0.16 -> 3.168 | AC179: of:=[.X179]*1.16 -> 22.968 | AD179: BROCHAS | AE179: BROCHAS Y PRODUCTOS S. DE R.L. DE C.V. | AL179: NO | AM179: SI | AN179: NO | AO179: 1.5 | AP179: 22 | AQ179: 10 | AR179: 0.08 | AS179: BYP
A180: BLP0050 | B180: BROCHA LA PROFESIONAL 5" | C180: BROCHA CON SERDA ABUDANTE EXTRA LARGA PARA ACABADO EN MENOR TIEMPO | D180: Inventariable | N180: PIEZA | O180: 31211904 | Q180: MXN | R180: 69.48 | S180: Trasladado | T180: IVA | U180: 0.16 | V180: of:=[.R180]*0.16 -> 11.1168 | W180: of:=[.R180]*1.16 -> 80.5968 | X180: 17.65 | Y180: Trasladado | Z180: IVA | AA180: 0.16 | AB180: of:=[.X180]*0.16 -> 2.824 | AC180: of:=[.X180]*1.16 -> 20.474 | AD180: BROCHAS | AE180: BROCHAS Y PRODUCTOS S. DE R.L. DE C.V. | AL180: NO | AM180: SI | AN180: NO | AO180: 1.5 | AP180: 24 | AQ180: 13 | AR180: 0.09 | AS180: BYP
A181: BLP0060 | B181: BROCHA LA PROFESIONAL 6" | C181: BROCHA CON SERDA ABUDANTE EXTRA LARGA PARA ACABADO EN MENOR TIEMPO | D181: Inventariable | N181: PIEZA | O181: 31211904 | Q181: MXN | R181: 88.87 | S181: Trasladado | T181: IVA | U181: 0.16 | V181: of:=[.R181]*0.16 -> 14.2192 | W181: of:=[.R181]*1.16 -> 103.0892 | X181: 14.2 | Y181: Trasladado | Z181: IVA | AA181: 0.16 | AB181: of:=[.X181]*0.16 -> 2.272 | AC181: of:=[.X181]*1.16 -> 16.472 | AD181: BROCHAS | AE181: BROCHAS Y PRODUCTOS S. DE R.L. DE C.V. | AL181: NO | AM181: SI | AN181: NO | AO181: 1.5 | AP181: 25 | AQ181: 15 | AR181: 0.18 | AS181: BYP
A182: BMA05 | B182: BROCHA LA MAESTRA 1/2" | C182: BROCHA DE SERDA NATURAL PARA ACABADO UNIFORME | D182: Inventariable | N182: PIEZA | O182: 31211904 | Q182: MXN | R182: 5.32 | S182: Trasladado | T182: IVA | U182: 0.16 | V182: of:=[.R182]*0.16 -> 0.8512 | W182: of:=[.R182]*1.16 -> 6.1712 | X182: 21.05 | Y182: Trasladado | Z182: IVA | AA182: 0.16 | AB182: of:=[.X182]*0.16 -> 3.368 | AC182: of:=[.X182]*1.16 -> 24.418 | AD182: BROCHAS | AE182: BROCHAS Y PRODUCTOS S. DE R.L. DE C.V. | AL182: NO | AM182: SI | AN182: NO | AO182: 1.5 | AP182: 17 | AQ182: 2 | AR182: 0.01 | AS182: BYP
A183: BMA10 | B183: BROCHA LA MAESTRA 1" | C183: BROCHA DE SERDA NATURAL PARA ACABADO UNIFORME | D183: Inventariable | N183: PIEZA | O183: 31211904 | Q183: MXN | R183: 8.05 | S183: Trasladado | T183: IVA | U183: 0.16 | V183: of:=[.R183]*0.16 -> 1.288 | W183: of:=[.R183]*1.16 -> 9.338 | X183: 7.6 | Y183: Trasladado | Z183: IVA | AA183: 0.16 | AB183: of:=[.X183]*0.16 -> 1.216 | AC183: of:=[.X183]*1.16 -> 8.816 | AD183: BROCHAS | AE183: BROCHAS Y PRODUCTOS S. DE R.L. DE C.V. | AL183: NO | AM183: SI | AN183: NO | AO183: 1.5 | AP183: 19 | AQ183: 3 | AR183: 0.02 | AS183: BYP
A184: BMA15 | B184: BROCHA LA MAESTRA 1-1/2" | C184: BROCHA DE SERDA NATURAL PARA ACABADO UNIFORME | D184: Inventariable | N184: PIEZA | O184: 31211904 | Q184: MXN | R184: 11.13 | S184: Trasladado | T184: IVA | U184: 0.16 | V184: of:=[.R184]*0.16 -> 1.7808 | W184: of:=[.R184]*1.16 -> 12.9108 | X184: 11.5 | Y184: Trasladado | Z184: IVA | AA184: 0.16 | AB184: of:=[.X184]*0.16 -> 1.84 | AC184: of:=[.X184]*1.16 -> 13.34 | AD184: BROCHAS | AE184: BROCHAS Y PRODUCTOS S. DE R.L. DE C.V. | AL184: NO | AM184: SI | AN184: NO | AO184: 1.5 | AP184: 19 | AQ184: 4 | AR184: 0.03 | AS184: BYP
A185: BMA20 | B185: BROCHA LA MAESTRA 2" | C185: BROCHA DE SERDA NATURAL PARA ACABADO UNIFORME | D185: Inventariable | N185: PIEZA | O185: 31211904 | Q185: MXN | R185: 14.21 | S185: Trasladado | T185: IVA | U185: 0.16 | V185: of:=[.R185]*0.16 -> 2.2736 | W185: of:=[.R185]*1.16 -> 16.4836 | X185: 15.9 | Y185: Trasladado | Z185: IVA | AA185: 0.16 | AB185: of:=[.X185]*0.16 -> 2.544 | AC185: of:=[.X185]*1.16 -> 18.444 | AD185: BROCHAS | AE185: BROCHAS Y PRODUCTOS S. DE R.L. DE C.V. | AL185: NO | AM185: SI | AN185: NO | AO185: 1.5 | AP185: 19 | AQ185: 5 | AR185: 0.03 | AS185: BYP
A186: BMA25 | B186: BROCHA LA MAESTRA 2-1/2" | C186: BROCHA DE SERDA NATURAL PARA ACABADO UNIFORME | D186: Inventariable | N186: PIEZA | O186: 31211904 | Q186: MXN | R186: 16.98 | S186: Trasladado | T186: IVA | U186: 0.16 | V186: of:=[.R186]*0.16 -> 2.7168 | W186: of:=[.R186]*1.16 -> 19.6968 | X186: 20.3 | Y186: Trasladado | Z186: IVA | AA186: 0.16 | AB186: of:=[.X186]*0.16 -> 3.248 | AC186: of:=[.X186]*1.16 -> 23.548 | AD186: BROCHAS | AE186: BROCHAS Y PRODUCTOS S. DE R.L. DE C.V. | AL186: NO | AM186: SI | AN186: NO | AO186: 1.5 | AP186: 19 | AQ186: 4 | AR186: 0.04 | AS186: BYP
A187: BMA30 | B187: BROCHA LA MAESTRA 3" | C187: BROCHA DE SERDA NATURAL PARA ACABADO UNIFORME | D187: Inventariable | N187: PIEZA | O187: 31211904 | Q187: MXN | R187: 26.39 | S187: Trasladado | T187: IVA | U187: 0.16 | V187: of:=[.R187]*0.16 -> 4.2224 | W187: of:=[.R187]*1.16 -> 30.6124 | X187: 24.45 | Y187: Trasladado | Z187: IVA | AA187: 0.16 | AB187: of:=[.X187]*0.16 -> 3.912 | AC187: of:=[.X187]*1.16 -> 28.362 | AD187: BROCHAS | AE187: BROCHAS Y PRODUCTOS S. DE R.L. DE C.V. | AL187: NO | AM187: SI | AN187: NO | AO187: 1.5 | AP187: 21 | AQ187: 8 | AR187: 0.05 | AS187: BYP
A188: BMA40 | B188: BROCHA LA MAESTRA 4" | C188: BROCHA DE SERDA NATURAL PARA ACABADO UNIFORME | D188: Inventariable | N188: PIEZA | O188: 31211904 | Q188: MXN | R188: 40.85 | S188: Trasladado | T188: IVA | U188: 0.16 | V188: of:=[.R188]*0.16 -> 6.536 | W188: of:=[.R188]*1.16 -> 47.386 | X188: 37.7 | Y188: Trasladado | Z188: IVA | AA188: 0.16 | AB188: of:=[.X188]*0.16 -> 6.032 | AC188: of:=[.X188]*1.16 -> 43.732 | AD188: BROCHAS | AE188: BROCHAS Y PRODUCTOS S. DE R.L. DE C.V. | AL188: NO | AM188: SI | AN188: NO | AO188: 1.5 | AP188: 22 | AQ188: 10 | AR188: 0.08 | AS188: BYP
A189: BMA50 | B189: BROCHA LA MAESTRA 5" | C189: BROCHA DE SERDA NATURAL PARA ACABADO UNIFORME | D189: Inventariable | N189: PIEZA | O189: 31211904 | Q189: MXN | R189: 50.09 | S189: Trasladado | T189: IVA | U189: 0.16 | V189: of:=[.R189]*0.16 -> 8.0144 | W189: of:=[.R189]*1.16 -> 58.1044 | X189: 58.35 | Y189: Trasladado | Z189: IVA | AA189: 0.16 | AB189: of:=[.X189]*0.16 -> 9.336 | AC189: of:=[.X189]*1.16 -> 67.686 | AD189: BROCHAS | AE189: BROCHAS Y PRODUCTOS S. DE R.L. DE C.V. | AL189: NO | AM189: SI | AN189: NO | AO189: 1.5 | AP189: 24 | AQ189: 13 | AR189: 0.09 | AS189: BYP
A190: BMA60 | B190: BROCHA LA MAESTRA 6" | C190: BROCHA DE SERDA NATURAL PARA ACABADO UNIFORME | D190: Inventariable | N190: PIEZA | O190: 31211904 | Q190: MXN | R190: 53.59 | S190: Trasladado | T190: IVA | U190: 0.16 | V190: of:=[.R190]*0.16 -> 8.5744 | W190: of:=[.R190]*1.16 -> 62.1644 | X190: 71.55 | Y190: Trasladado | Z190: IVA | AA190: 0.16 | AB190: of:=[.X190]*0.16 -> 11.448 | AC190: of:=[.X190]*1.16 -> 82.998 | AD190: BROCHAS | AE190: BROCHAS Y PRODUCTOS S. DE R.L. DE C.V. | AL190: NO | AM190: SI | AN190: NO | AO190: 1.5 | AP190: 25 | AQ190: 15 | AR190: 0.18 | AS190: BYP
A191: BRE05 | B191: BROCHA LA REGIA 1/2" | C191: BROCHA DE SERDA NATURAL | D191: Inventariable | N191: PIEZA | O191: 31211904 | Q191: MXN | R191: 5.29 | S191: Trasladado | T191: IVA | U191: 0.16 | V191: of:=[.R191]*0.16 -> 0.8464 | W191: of:=[.R191]*1.16 -> 6.1364 | X191: 76.65 | Y191: Trasladado | Z191: IVA | AA191: 0.16 | AB191: of:=[.X191]*0.16 -> 12.264 | AC191: of:=[.X191]*1.16 -> 88.914 | AD191: BROCHAS | AE191: BROCHAS Y PRODUCTOS S. DE R.L. DE C.V. | AL191: NO | AM191: SI | AN191: NO | AO191: 1.5 | AP191: 17 | AQ191: 2 | AR191: 0.01 | AS191: BYP
A192: BRE10 | B192: BROCHA LA REGIA 1" | C192: BROCHA DE SERDA NATURAL | D192: Inventariable | N192: PIEZA | O192: 31211904 | Q192: MXN | R192: 7.88 | S192: Trasladado | T192: IVA | U192: 0.16 | V192: of:=[.R192]*0.16 -> 1.2608 | W192: of:=[.R192]*1.16 -> 9.1408 | X192: 7.55 | Y192: Trasladado | Z192: IVA | AA192: 0.16 | AB192: of:=[.X192]*0.16 -> 1.208 | AC192: of:=[.X192]*1.16 -> 8.758 | AD192: BROCHAS | AE192: BROCHAS Y PRODUCTOS S. DE R.L. DE C.V. | AL192: NO | AM192: SI | AN192: NO | AO192: 1.5 | AP192: 19 | AQ192: 3 | AR192: 0.02 | AS192: BYP
A193: BRE15 | B193: BROCHA LA REGIA 1-1/2" | C193: BROCHA DE SERDA NATURAL | D193: Inventariable | N193: PIEZA | O193: 31211904 | Q193: MXN | R193: 10.71 | S193: Trasladado | T193: IVA | U193: 0.16 | V193: of:=[.R193]*0.16 -> 1.7136 | W193: of:=[.R193]*1.16 -> 12.4236 | X193: 11.25 | Y193: Trasladado | Z193: IVA | AA193: 0.16 | AB193: of:=[.X193]*0.16 -> 1.8 | AC193: of:=[.X193]*1.16 -> 13.05 | AD193: BROCHAS | AE193: BROCHAS Y PRODUCTOS S. DE R.L. DE C.V. | AL193: NO | AM193: SI | AN193: NO | AO193: 1.5 | AP193: 19 | AQ193: 4 | AR193: 0.03 | AS193: BYP
A194: BRE20 | B194: BROCHA LA REGIA 2" | C194: BROCHA DE SERDA NATURAL | D194: Inventariable | N194: PIEZA | O194: 31211904 | Q194: MXN | R194: 14.07 | S194: Trasladado | T194: IVA | U194: 0.16 | V194: of:=[.R194]*0.16 -> 2.2512 | W194: of:=[.R194]*1.16 -> 16.3212 | X194: 15.3 | Y194: Trasladado | Z194: IVA | AA194: 0.16 | AB194: of:=[.X194]*0.16 -> 2.448 | AC194: of:=[.X194]*1.16 -> 17.748 | AD194: BROCHAS | AE194: BROCHAS Y PRODUCTOS S. DE R.L. DE C.V. | AL194: NO | AM194: SI | AN194: NO | AO194: 1.5 | AP194: 19 | AQ194: 5 | AR194: 0.03 | AS194: BYP
A195: BRE25 | B195: BROCHA LA REGIA 2-1/2" | C195: BROCHA DE SERDA NATURAL | D195: Inventariable | N195: PIEZA | O195: 31211904 | Q195: MXN | R195: 16.49 | S195: Trasladado | T195: IVA | U195: 0.16 | V195: of:=[.R195]*0.16 -> 2.6384 | W195: of:=[.R195]*1.16 -> 19.1284 | X195: 20.1 | Y195: Trasladado | Z195: IVA | AA195: 0.16 | AB195: of:=[.X195]*0.16 -> 3.216 | AC195: of:=[.X195]*1.16 -> 23.316 | AD195: BROCHAS | AE195: BROCHAS Y PRODUCTOS S. DE R.L. DE C.V. | AL195: NO | AM195: SI | AN195: NO | AO195: 1.5 | AP195: 19 | AQ195: 4 | AR195: 0.04 | AS195: BYP
A196: BRE30 | B196: BROCHA LA REGIA 3" | C196: BROCHA DE SERDA NATURAL | D196: Inventariable | N196: PIEZA | O196: 31211904 | Q196: MXN | R196: 25.1 | S196: Trasladado | T196: IVA | U196: 0.16 | V196: of:=[.R196]*0.16 -> 4.016 | W196: of:=[.R196]*1.16 -> 29.116 | X196: 23.55 | Y196: Trasladado | Z196: IVA | AA196: 0.16 | AB196: of:=[.X196]*0.16 -> 3.768 | AC196: of:=[.X196]*1.16 -> 27.318 | AD196: BROCHAS | AE196: BROCHAS Y PRODUCTOS S. DE R.L. DE C.V. | AL196: NO | AM196: SI | AN196: NO | AO196: 1.5 | AP196: 21 | AQ196: 8 | AR196: 0.05 | AS196: BYP
A197: BRE40 | B197: BROCHA LA REGIA 4" | C197: BROCHA DE SERDA NATURAL | D197: Inventariable | N197: PIEZA | O197: 31211904 | Q197: MXN | R197: 38.96 | S197: Trasladado | T197: IVA | U197: 0.16 | V197: of:=[.R197]*0.16 -> 6.2336 | W197: of:=[.R197]*1.16 -> 45.1936 | X197: 35.85 | Y197: Trasladado | Z197: IVA | AA197: 0.16 | AB197: of:=[.X197]*0.16 -> 5.736 | AC197: of:=[.X197]*1.16 -> 41.586 | AD197: BROCHAS | AE197: BROCHAS Y PRODUCTOS S. DE R.L. DE C.V. | AL197: NO | AM197: SI | AN197: NO | AO197: 1.5 | AP197: 22 | AQ197: 10 | AR197: 0.08 | AS197: BYP
A198: BRE50 | B198: BROCHA LA REGIA 5" | C198: BROCHA DE SERDA NATURAL | D198: Inventariable | N198: PIEZA | O198: 31211904 | Q198: MXN | R198: 48.65 | S198: Trasladado | T198: IVA | U198: 0.16 | V198: of:=[.R198]*0.16 -> 7.784 | W198: of:=[.R198]*1.16 -> 56.434 | X198: 55.65 | Y198: Trasladado | Z198: IVA | AA198: 0.16 | AB198: of:=[.X198]*0.16 -> 8.904 | AC198: of:=[.X198]*1.16 -> 64.554 | AD198: BROCHAS | AE198: BROCHAS Y PRODUCTOS S. DE R.L. DE C.V. | AL198: NO | AM198: SI | AN198: NO | AO198: 1.5 | AP198: 24 | AQ198: 13 | AR198: 0.09 | AS198: BYP
A199: BRE60 | B199: BROCHA LA REGIA 6" | C199: BROCHA DE SERDA NATURAL | D199: Inventariable | N199: PIEZA | O199: 31211904 | Q199: MXN | R199: 51.14 | S199: Trasladado | T199: IVA | U199: 0.16 | V199: of:=[.R199]*0.16 -> 8.1824 | W199: of:=[.R199]*1.16 -> 59.3224 | X199: 69.5 | Y199: Trasladado | Z199: IVA | AA199: 0.16 | AB199: of:=[.X199]*0.16 -> 11.12 | AC199: of:=[.X199]*1.16 -> 80.62 | AD199: BROCHAS | AE199: BROCHAS Y PRODUCTOS S. DE R.L. DE C.V. | AL199: NO | AM199: SI | AN199: NO | AO199: 1.5 | AP199: 25 | AQ199: 15 | AR199: 0.18 | AS199: BYP
A200: BPM05 | B200: BROCHA PREMIUM 1/2" | C200: BROCHA CON MEZCLA DE FILAMENTOS QUE PERMITE MAYOR CARGA Y DESCARGA DE PINTURA | D200: Inventariable | M200: 17 | N200: PIEZA | O200: 31211904 | Q200: MXN | R200: 4.41 | S200: Trasladado | T200: IVA | U200: 0.16 | V200: of:=[.R200]*0.16 -> 0.7056 | W200: of:=[.R200]*1.16 -> 5.1156 | X200: 6.3 | Y200: Trasladado | Z200: IVA | AA200: 0.16 | AB200: of:=[.X200]*0.16 -> 1.008 | AC200: of:=[.X200]*1.16 -> 7.308 | AD200: BROCHAS | AE200: BROCHAS Y PRODUCTOS S. DE R.L. DE C.V. | AL200: NO | AM200: SI | AN200: NO | AO200: 1.5 | AP200: 17 | AQ200: 2 | AR200: 0.01 | AS200: BYP
A201: BPM10 | B201: BROCHA PREMIUM 1" | C201: BROCHA CON MEZCLA DE FILAMENTOS QUE PERMITE MAYOR CARGA Y DESCARGA DE PINTURA | D201: Inventariable | M201: 4 | N201: PIEZA | O201: 31211904 | Q201: MXN | R201: 6.41 | S201: Trasladado | T201: IVA | U201: 0.16 | V201: of:=[.R201]*0.16 -> 1.0256 | W201: of:=[.R201]*1.16 -> 7.4356 | X201: 9.15 | Y201: Trasladado | Z201: IVA | AA201: 0.16 | AB201: of:=[.X201]*0.16 -> 1.464 | AC201: of:=[.X201]*1.16 -> 10.614 | AD201: BROCHAS | AE201: BROCHAS Y PRODUCTOS S. DE R.L. DE C.V. | AL201: NO | AM201: SI | AN201: NO | AO201: 1.5 | AP201: 19 | AQ201: 3 | AR201: 0.02 | AS201: BYP
A202: BPM15 | B202: BROCHA PREMIUM 1 1/2" | C202: BROCHA CON MEZCLA DE FILAMENTOS QUE PERMITE MAYOR CARGA Y DESCARGA DE PINTURA | D202: Inventariable | N202: PIEZA | O202: 31211904 | Q202: MXN | R202: 8.65 | S202: Trasladado | T202: IVA | U202: 0.16 | V202: of:=[.R202]*0.16 -> 1.384 | W202: of:=[.R202]*1.16 -> 10.034 | X202: 12.35 | Y202: Trasladado | Z202: IVA | AA202: 0.16 | AB202: of:=[.X202]*0.16 -> 1.976 | AC202: of:=[.X202]*1.16 -> 14.326 | AD202: BROCHAS | AE202: BROCHAS Y PRODUCTOS S. DE R.L. DE C.V. | AL202: NO | AM202: SI | AN202: NO | AO202: 1.5 | AP202: 19 | AQ202: 4 | AR202: 0.03 | AS202: BYP
A203: BPM20 | B203: BROCHA PREMIUM 2" | C203: BROCHA CON MEZCLA DE FILAMENTOS QUE PERMITE MAYOR CARGA Y DESCARGA DE PINTURA | D203: Inventariable | N203: PIEZA | O203: 31211904 | Q203: MXN | R203: 11.31 | S203: Trasladado | T203: IVA | U203: 0.16 | V203: of:=[.R203]*0.16 -> 1.8096 | W203: of:=[.R203]*1.16 -> 13.1196 | X203: 16.15 | Y203: Trasladado | Z203: IVA | AA203: 0.16 | AB203: of:=[.X203]*0.16 -> 2.584 | AC203: of:=[.X203]*1.16 -> 18.734 | AD203: BROCHAS | AE203: BROCHAS Y PRODUCTOS S. DE R.L. DE C.V. | AL203: NO | AM203: SI | AN203: NO | AO203: 1.5 | AP203: 19 | AQ203: 5 | AR203: 0.03 | AS203: BYP
A204: BPM25 | B204: BROCHA PREMIUM 2 1/2" | C204: BROCHA CON MEZCLA DE FILAMENTOS QUE PERMITE MAYOR CARGA Y DESCARGA DE PINTURA | D204: Inventariable | N204: PIEZA | O204: 31211904 | Q204: MXN | R204: 13.51 | S204: Trasladado | T204: IVA | U204: 0.16 | V204: of:=[.R204]*0.16 -> 2.1616 | W204: of:=[.R204]*1.16 -> 15.6716 | X204: 19.3 | Y204: Trasladado | Z204: IVA | AA204: 0.16 | AB204: of:=[.X204]*0.16 -> 3.088 | AC204: of:=[.X204]*1.16 -> 22.388 | AD204: BROCHAS | AE204: BROCHAS Y PRODUCTOS S. DE R.L. DE C.V. | AL204: NO | AM204: SI | AN204: NO | AO204: 1.5 | AP204: 19 | AQ204: 4 | AR204: 0.04 | AS204: BYP
A205: BPM30 | B205: BROCHA PREMIUM 3" | C205: BROCHA CON MEZCLA DE FILAMENTOS QUE PERMITE MAYOR CARGA Y DESCARGA DE PINTURA | D205: Inventariable | N205: PIEZA | O205: 31211904 | Q205: MXN | R205: 19.98 | S205: Trasladado | T205: IVA | U205: 0.16 | V205: of:=[.R205]*0.16 -> 3.1968 | W205: of:=[.R205]*1.16 -> 23.1768 | X205: 28.55 | Y205: Trasladado | Z205: IVA | AA205: 0.16 | AB205: of:=[.X205]*0.16 -> 4.568 | AC205: of:=[.X205]*1.16 -> 33.118 | AD205: BROCHAS | AE205: BROCHAS Y PRODUCTOS S. DE R.L. DE C.V. | AL205: NO | AM205: SI | AN205: NO | AO205: 1.5 | AP205: 21 | AQ205: 8 | AR205: 0.05 | AS205: BYP
A206: BPM40 | B206: BROCHA PREMIUM 4" | C206: BROCHA CON MEZCLA DE FILAMENTOS QUE PERMITE MAYOR CARGA Y DESCARGA DE PINTURA | D206: Inventariable | N206: PIEZA | O206: 31211904 | Q206: MXN | R206: 30.94 | S206: Trasladado | T206: IVA | U206: 0.16 | V206: of:=[.R206]*0.16 -> 4.9504 | W206: of:=[.R206]*1.16 -> 35.8904 | X206: 44.2 | Y206: Trasladado | Z206: IVA | AA206: 0.16 | AB206: of:=[.X206]*0.16 -> 7.072 | AC206: of:=[.X206]*1.16 -> 51.272 | AD206: BROCHAS | AE206: BROCHAS Y PRODUCTOS S. DE R.L. DE C.V. | AL206: NO | AM206: SI | AN206: NO | AO206: 1.5 | AP206: 22 | AQ206: 10 | AR206: 0.08 | AS206: BYP
A207: BPM50 | B207: BROCHA PREMIUM 5" | C207: BROCHA CON MEZCLA DE FILAMENTOS QUE PERMITE MAYOR CARGA Y DESCARGA DE PINTURA | D207: Inventariable | N207: PIEZA | O207: 31211904 | Q207: MXN | R207: 39.55 | S207: Trasladado | T207: IVA | U207: 0.16 | V207: of:=[.R207]*0.16 -> 6.328 | W207: of:=[.R207]*1.16 -> 45.878 | X207: 56.5 | Y207: Trasladado | Z207: IVA | AA207: 0.16 | AB207: of:=[.X207]*0.16 -> 9.04 | AC207: of:=[.X207]*1.16 -> 65.54 | AD207: BROCHAS | AE207: BROCHAS Y PRODUCTOS S. DE R.L. DE C.V. | AL207: NO | AM207: SI | AN207: NO | AO207: 1.5 | AP207: 24 | AQ207: 13 | AR207: 0.09 | AS207: BYP
A208: BPM60 | B208: BROCHA PREMIUM 6" | C208: BROCHA CON MEZCLA DE FILAMENTOS QUE PERMITE MAYOR CARGA Y DESCARGA DE PINTURA | D208: Inventariable | N208: PIEZA | O208: 31211904 | Q208: MXN | R208: 43.29 | S208: Trasladado | T208: IVA | U208: 0.16 | V208: of:=[.R208]*0.16 -> 6.9264 | W208: of:=[.R208]*1.16 -> 50.2164 | X208: 61.85 | Y208: Trasladado | Z208: IVA | AA208: 0.16 | AB208: of:=[.X208]*0.16 -> 9.896 | AC208: of:=[.X208]*1.16 -> 71.746 | AD208: BROCHAS | AE208: BROCHAS Y PRODUCTOS S. DE R.L. DE C.V. | AL208: NO | AM208: SI | AN208: NO | AO208: 1.5 | AP208: 25 | AQ208: 15 | AR208: 0.2 | AS208: BYP
A209: RPR49 | B209: RODILLO 9" PROFESIONAL ALTA DENSIDAD 1-1/4" | C209: RODILLO PARA USO PROFESIONAL, COMBINA UNA FELPA DE ALTA DENSIDAD Y UN MANERAL CON JAULA DE 5 ALAMBRES, QUE MANTIENE LA FELPA EN SU LUGAR MIENTRAS SE APLICA LA PINTURA. | D209: Inventariable | N209: PIEZA | O209: 31211906 | Q209: MXN | R209: 42.59 | S209: Trasladado | T209: IVA | U209: 0.16 | V209: of:=[.R209]*0.16 -> 6.8144 | W209: of:=[.R209]*1.16 -> 49.4044 | X209: 60.85 | Y209: Trasladado | Z209: IVA | AA209: 0.16 | AB209: of:=[.X209]*0.16 -> 9.736 | AC209: of:=[.X209]*1.16 -> 70.586 | AD209: RODILLOS | AE209: BROCHAS Y PRODUCTOS S. DE R.L. DE C.V. | AL209: NO | AM209: SI | AN209: NO | AO209: 3.175 | AP209: 22.86 | AQ209: 22.86 | AR209: 0.2 | AS209: BYP
A210: RPR39 | B210: RODILLO 9" PROFESIONAL ALTA DENSIDAD 1" | C210: RODILLO PARA USO PROFESIONAL, COMBINA UNA FELPA DE ALTA DENSIDAD Y UN MANERAL CON JAULA DE 5 ALAMBRES, QUE MANTIENE LA FELPA EN SU LUGAR MIENTRAS SE APLICA LA PINTURA. | D210: Inventariable | N210: PIEZA | O210: 31211906 | Q210: MXN | R210: 42.31 | S210: Trasladado | T210: IVA | U210: 0.16 | V210: of:=[.R210]*0.16 -> 6.7696 | W210: of:=[.R210]*1.16 -> 49.0796 | X210: 60.45 | Y210: Trasladado | Z210: IVA | AA210: 0.16 | AB210: of:=[.X210]*0.16 -> 9.672 | AC210: of:=[.X210]*1.16 -> 70.122 | AD210: RODILLOS | AE210: BROCHAS Y PRODUCTOS S. DE R.L. DE C.V. | AL210: NO | AM210: SI | AN210: NO | AO210: 2.54 | AP210: 22.86 | AQ210: 22.86 | AR210: 0.2 | AS210: BYP
A211: RPR29 | B211: RODILLO 9" PROFESIONAL ALTA DENSIDAD 3/4" | C211: RODILLO PARA USO PROFESIONAL, COMBINA UNA FELPA DE ALTA DENSIDAD Y UN MANERAL CON JAULA DE 5 ALAMBRES, QUE MANTIENE LA FELPA EN SU LUGAR MIENTRAS SE APLICA LA PINTURA. | D211: Inventariable | N211: PIEZA | O211: 31211906 | Q211: MXN | R211: 41.82 | S211: Trasladado | T211: IVA | U211: 0.16 | V211: of:=[.R211]*0.16 -> 6.6912 | W211: of:=[.R211]*1.16 -> 48.5112 | X211: 59.75 | Y211: Trasladado | Z211: IVA | AA211: 0.16 | AB211: of:=[.X211]*0.16 -> 9.56 | AC211: of:=[.X211]*1.16 -> 69.31 | AD211: RODILLOS | AE211: BROCHAS Y PRODUCTOS S. DE R.L. DE C.V. | AL211: NO | AM211: SI | AN211: NO | AO211: 1.905 | AP211: 22.86 | AQ211: 22.86 | AR211: 0.2 | AS211: BYP
A212: RPR69 | B212: RODILLO 9" PROFESIONAL ALTA DENSIDAD 5/8" | C212: RODILLO PARA USO PROFESIONAL, COMBINA UNA FELPA DE ALTA DENSIDAD Y UN MANERAL CON JAULA DE 5 ALAMBRES, QUE MANTIENE LA FELPA EN SU LUGAR MIENTRAS SE APLICA LA PINTURA. | D212: Inventariable | N212: PIEZA | O212: 31211906 | Q212: MXN | R212: 40.95 | S212: Trasladado | T212: IVA | U212: 0.16 | V212: of:=[.R212]*0.16 -> 6.552 | W212: of:=[.R212]*1.16 -> 47.502 | X212: 58.5 | Y212: Trasladado | Z212: IVA | AA212: 0.16 | AB212: of:=[.X212]*0.16 -> 9.36 | AC212: of:=[.X212]*1.16 -> 67.86 | AD212: RODILLOS | AE212: BROCHAS Y PRODUCTOS S. DE R.L. DE C.V. | AL212: NO | AM212: SI | AN212: NO | AO212: 1.58 | AP212: 22.86 | AQ212: 22.86 | AR212: 0.2 | AS212: BYP
A213: RPR59 | B213: RODILLO 9" PROFESIONAL ALTA DENSIDAD 1/2" | C213: RODILLO PARA USO PROFESIONAL, COMBINA UNA FELPA DE ALTA DENSIDAD Y UN MANERAL CON JAULA DE 5 ALAMBRES, QUE MANTIENE LA FELPA EN SU LUGAR MIENTRAS SE APLICA LA PINTURA. | D213: Inventariable | N213: PIEZA | O213: 31211906 | Q213: MXN | R213: 40.07 | S213: Trasladado | T213: IVA | U213: 0.16 | V213: of:=[.R213]*0.16 -> 6.4112 | W213: of:=[.R213]*1.16 -> 46.4812 | X213: 57.25 | Y213: Trasladado | Z213: IVA | AA213: 0.16 | AB213: of:=[.X213]*0.16 -> 9.16 | AC213: of:=[.X213]*1.16 -> 66.41 | AD213: RODILLOS | AE213: BROCHAS Y PRODUCTOS S. DE R.L. DE C.V. | AL213: NO | AM213: SI | AN213: NO | AO213: 1.27 | AP213: 22.86 | AQ213: 22.86 | AR213: 0.2 | AS213: BYP
A214: RPR19 | B214: RODILLO 9" PROFESIONAL ALTA DENSIDAD 3/8" | C214: RODILLO PARA USO PROFESIONAL, COMBINA UNA FELPA DE ALTA DENSIDAD Y UN MANERAL CON JAULA DE 5 ALAMBRES, QUE MANTIENE LA FELPA EN SU LUGAR MIENTRAS SE APLICA LA PINTURA. | D214: Inventariable | N214: PIEZA | O214: 31211906 | Q214: MXN | R214: 39.9 | S214: Trasladado | T214: IVA | U214: 0.16 | V214: of:=[.R214]*0.16 -> 6.384 | W214: of:=[.R214]*1.16 -> 46.284 | X214: 57 | Y214: Trasladado | Z214: IVA | AA214: 0.16 | AB214: of:=[.X214]*0.16 -> 9.12 | AC214: of:=[.X214]*1.16 -> 66.12 | AD214: RODILLOS | AE214: BROCHAS Y PRODUCTOS S. DE R.L. DE C.V. | AL214: NO | AM214: SI | AN214: NO | AO214: 1.905 | AP214: 22.86 | AQ214: 22.86 | AR214: 0.18 | AS214: BYP
A215: RPR79 | B215: RODILLO 9" PROFESIONAL ALTA DENSIDAD 1/4" | C215: RODILLO PARA USO PROFESIONAL, COMBINA UNA FELPA DE ALTA DENSIDAD Y UN MANERAL CON JAULA DE 5 ALAMBRES, QUE MANTIENE LA FELPA EN SU LUGAR MIENTRAS SE APLICA LA PINTURA. | D215: Inventariable | N215: PIEZA | O215: 31211906 | Q215: MXN | R215: 36.82 | S215: Trasladado | T215: IVA | U215: 0.16 | V215: of:=[.R215]*0.16 -> 5.8912 | W215: of:=[.R215]*1.16 -> 42.7112 | X215: 52.6 | Y215: Trasladado | Z215: IVA | AA215: 0.16 | AB215: of:=[.X215]*0.16 -> 8.416 | AC215: of:=[.X215]*1.16 -> 61.016 | AD215: RODILLOS | AE215: BROCHAS Y PRODUCTOS S. DE R.L. DE C.V. | AL215: NO | AM215: SI | AN215: NO | AO215: 0.635 | AP215: 22.86 | AQ215: 22.86 | AR215: 0.2 | AS215: BYP
A216: FPR49 | B216: FELPA 9" ALTA DENSIDAD 1-1/4" | C216: FELPA PEINADA Y CON BORDES RECORTADOS PARA UN MEJOR ACABADO, EVITA EL DESPERDICIO DE PINTURA, CUBRIENDO MÃS ÃREA EN MENOS TIEMPO. | D216: Inventariable | N216: PIEZA | O216: 31211900 | Q216: MXN | R216: 21.14 | S216: Trasladado | T216: IVA | U216: 0.16 | V216: of:=[.R216]*0.16 -> 3.3824 | W216: of:=[.R216]*1.16 -> 24.5224 | X216: 30.2 | Y216: Trasladado | Z216: IVA | AA216: 0.16 | AB216: of:=[.X216]*0.16 -> 4.832 | AC216: of:=[.X216]*1.16 -> 35.032 | AD216: FELPAS | AE216: BROCHAS Y PRODUCTOS S. DE R.L. DE C.V. | AL216: NO | AM216: SI | AN216: NO | AO216: 1.905 | AP216: 22.86 | AQ216: 16 | AR216: 0.074 | AS216: BYP
A217: FPR39 | B217: FELPA 9" ALTA DENSIDAD 1" | C217: FELPA PEINADA Y CON BORDES RECORTADOS PARA UN MEJOR ACABADO, EVITA EL DESPERDICIO DE PINTURA, CUBRIENDO MÃS ÃREA EN MENOS TIEMPO. | D217: Inventariable | N217: PIEZA | O217: 31211900 | Q217: MXN | R217: 20.93 | S217: Trasladado | T217: IVA | U217: 0.16 | V217: of:=[.R217]*0.16 -> 3.3488 | W217: of:=[.R217]*1.16 -> 24.2788 | X217: 29.9 | Y217: Trasladado | Z217: IVA | AA217: 0.16 | AB217: of:=[.X217]*0.16 -> 4.784 | AC217: of:=[.X217]*1.16 -> 34.684 | AD217: FELPAS | AE217: BROCHAS Y PRODUCTOS S. DE R.L. DE C.V. | AL217: NO | AM217: SI | AN217: NO | AO217: 2.54 | AP217: 22.86 | AQ217: 10.5 | AR217: 0.27 | AS217: BYP
A218: FPR29 | B218: FELPA 9" ALTA DEDSIDAD 3/4" | C218: FELPA PEINADA Y CON BORDES RECORTADOS PARA UN MEJOR ACABADO, EVITA EL DESPERDICIO DE PINTURA, CUBRIENDO MÃS ÃREA EN MENOS TIEMPO. | D218: Inventariable | N218: PIEZA | O218: 31211900 | Q218: MXN | R218: 20.05 | S218: Trasladado | T218: IVA | U218: 0.16 | V218: of:=[.R218]*0.16 -> 3.208 | W218: of:=[.R218]*1.16 -> 23.258 | X218: 28.65 | Y218: Trasladado | Z218: IVA | AA218: 0.16 | AB218: of:=[.X218]*0.16 -> 4.584 | AC218: of:=[.X218]*1.16 -> 33.234 | AD218: FELPAS | AE218: BROCHAS Y PRODUCTOS S. DE R.L. DE C.V. | AL218: NO | AM218: SI | AN218: NO | AO218: 1.905 | AP218: 22.86 | AQ218: 22.86 | AR218: 0.264 | AS218: BYP
A219: FPR19 | B219: FELPA 9" ALTA DENSIDAD 3/8" | C219: FELPA PEINADA Y CON BORDES RECORTADOS PARA UN MEJOR ACABADO, EVITA EL DESPERDICIO DE PINTURA, CUBRIENDO MÃS ÃREA EN MENOS TIEMPO. | D219: Inventariable | N219: PIEZA | O219: 31211900 | Q219: MXN | R219: 18.13 | S219: Trasladado | T219: IVA | U219: 0.16 | V219: of:=[.R219]*0.16 -> 2.9008 | W219: of:=[.R219]*1.16 -> 21.0308 | X219: 25.9 | Y219: Trasladado | Z219: IVA | AA219: 0.16 | AB219: of:=[.X219]*0.16 -> 4.144 | AC219: of:=[.X219]*1.16 -> 30.044 | AD219: FELPAS | AE219: BROCHAS Y PRODUCTOS S. DE R.L. DE C.V. | AL219: NO | AM219: SI | AN219: NO | AO219: 0.9525 | AP219: 22.86 | AQ219: 10 | AR219: 0.044 | AS219: BYP
A220: FPR79 | B220: FELPA 9" ALTA DENSIDAD 1/4" | C220: FELPA PEINADA Y CON BORDES RECORTADOS PARA UN MEJOR ACABADO, EVITA EL DESPERDICIO DE PINTURA, CUBRIENDO MÃS ÃREA EN MENOS TIEMPO. | D220: Inventariable | N220: PIEZA | O220: 31211900 | Q220: MXN | R220: 17.64 | S220: Trasladado | T220: IVA | U220: 0.16 | V220: of:=[.R220]*0.16 -> 2.8224 | W220: of:=[.R220]*1.16 -> 20.4624 | X220: 25.2 | Y220: Trasladado | Z220: IVA | AA220: 0.16 | AB220: of:=[.X220]*0.16 -> 4.032 | AC220: of:=[.X220]*1.16 -> 29.232 | AD220: FELPAS | AE220: BROCHAS Y PRODUCTOS S. DE R.L. DE C.V. | AL220: NO | AM220: SI | AN220: NO | AO220: 0.635 | AP220: 22.86 | AQ220: 9.7 | AR220: 0.054 | AS220: BYP
A221: FBO49 | B221: FELPA 9" BORREGO 1-1/4" | C221: FELPA FABRICADA A BASE DE MERINO NATURAL, ES UNA DE LAS FAVORITAS ENTRE LOS PINTORES PROFESIONALES, PORQUE GRACIAS A SU MATERIAL HACE RENDIR LA FELPA HASTA 8 VECES MÃS QUE CUALQUIER OTRA FELPA. | D221: Inventariable | N221: PIEZA | O221: 31211900 | Q221: MXN | R221: 151.51 | S221: Trasladado | T221: IVA | U221: 0.16 | V221: of:=[.R221]*0.16 -> 24.2416 | W221: of:=[.R221]*1.16 -> 175.7516 | X221: 216.45 | Y221: Trasladado | Z221: IVA | AA221: 0.16 | AB221: of:=[.X221]*0.16 -> 34.632 | AC221: of:=[.X221]*1.16 -> 251.082 | AD221: FELPAS | AE221: BROCHAS Y PRODUCTOS S. DE R.L. DE C.V. | AL221: NO | AM221: SI | AN221: NO | AO221: 3.175 | AP221: 22.86 | AQ221: 22.86 | AR221: 0.06 | AS221: BYP
A222: FBO29 | B222: FELPA 9" BORREGO 3/4" | C222: FELPA FABRICADA A BASE DE MERINO NATURAL, ES UNA DE LAS FAVORITAS ENTRE LOS PINTORES PROFESIONALES, PORQUE GRACIAS A SU MATERIAL HACE RENDIR LA FELPA HASTA 8 VECES MÃS QUE CUALQUIER OTRA FELPA. | D222: Inventariable | N222: PIEZA | O222: 31211900 | Q222: MXN | R222: 136.95 | S222: Trasladado | T222: IVA | U222: 0.16 | V222: of:=[.R222]*0.16 -> 21.912 | W222: of:=[.R222]*1.16 -> 158.862 | X222: 195.65 | Y222: Trasladado | Z222: IVA | AA222: 0.16 | AB222: of:=[.X222]*0.16 -> 31.304 | AC222: of:=[.X222]*1.16 -> 226.954 | AD222: FELPAS | AE222: BROCHAS Y PRODUCTOS S. DE R.L. DE C.V. | AL222: NO | AM222: SI | AN222: NO | AO222: 1.905 | AP222: 22.86 | AQ222: 12 | AR222: 0.106 | AS222: BYP
A223: FMOH | B223: FELPA 9" MOHAIR 3/8" | C223: FELPA FABRICADA PARA EL USO ESPECIAL DE BARNICES, EPÃXICOS Y ESMALTES | D223: Inventariable | N223: PIEZA | O223: 31211900 | Q223: MXN | R223: 29.43 | S223: Trasladado | T223: IVA | U223: 0.16 | V223: of:=[.R223]*0.16 -> 4.7088 | W223: of:=[.R223]*1.16 -> 34.1388 | X223: 42.05 | Y223: Trasladado | Z223: IVA | AA223: 0.16 | AB223: of:=[.X223]*0.16 -> 6.728 | AC223: of:=[.X223]*1.16 -> 48.778 | AD223: FELPAS | AE223: BROCHAS Y PRODUCTOS S. DE R.L. DE C.V. | AL223: NO | AM223: SI | AN223: NO | AO223: 0.9525 | AP223: 22.86 | AQ223: 6.8 | AR223: 0.052 | AS223: BYP
A224: FEX79 | B224: FELPA 9" EPOXICA 1/4" DENSIDAD | C224: DE USO ESPECIAL PARA ADHESIVOS Y EPÃXICOS, CON SUS FIBRAS SINTÃTICAS DE ALTA RESISTENCIA FACILITA LA APLICACIÃN Y AYUDA A QUE NO SE DESPRENDEN AL APLICAR LOS MATERIALES. | D224: Inventariable | N224: PIEZA | O224: 31211900 | Q224: MXN | R224: 35.45 | S224: Trasladado | T224: IVA | U224: 0.16 | V224: of:=[.R224]*0.16 -> 5.672 | W224: of:=[.R224]*1.16 -> 41.122 | X224: 65.45 | Y224: Trasladado | Z224: IVA | AA224: 0.16 | AB224: of:=[.X224]*0.16 -> 10.472 | AC224: of:=[.X224]*1.16 -> 75.922 | AD224: FELPAS | AE224: BROCHAS Y PRODUCTOS S. DE R.L. DE C.V. | AL224: NO | AM224: SI | AN224: NO | AO224: 0.635 | AP224: 22.86 | AQ224: 22.86 | AR224: 0.044 | AS224: BYP
A225: FSL19 | B225: FELPA DE ESPUMA P/SUPERFICIES LISAS 3/8" | C225: FELPA DE ESPUMA QUE BRINDA CALIDAD PROFESIONAL, RECOMENDADA PARA SUPERFICIES LISAS, TECHOS, CONCRETO Y PAREDES DE BLOCK. | D225: Inventariable | N225: PIEZA | O225: 31211900 | Q225: MXN | R225: 32.27 | S225: Trasladado | T225: IVA | U225: 0.16 | V225: of:=[.R225]*0.16 -> 5.1632 | W225: of:=[.R225]*1.16 -> 37.4332 | X225: 46.1 | Y225: Trasladado | Z225: IVA | AA225: 0.16 | AB225: of:=[.X225]*0.16 -> 7.376 | AC225: of:=[.X225]*1.16 -> 53.476 | AD225: FELPAS | AE225: BROCHAS Y PRODUCTOS S. DE R.L. DE C.V. | AL225: NO | AM225: SI | AN225: NO | AO225: 0.9525 | AP225: 22.86 | AQ225: 8 | AR225: 0.072 | AS225: BYP
A226: FAN19 | B226: FELPA 9" MICRO FIBRA 9" X 3/8" VERDE | C226: FELPA IDEAL PARA REALIZAR ACABADOS FINOS, LAS MICROFIBRAS DE POLIÃSTER PERMITEN TENER UNA MEJOR RETENCIÃN DE PINTURA EN LA PARTE SUPERIOR. | D226: Inventariable | N226: PIEZA | O226: 31211900 | Q226: MXN | R226: 39.23 | S226: Trasladado | T226: IVA | U226: 0.16 | V226: of:=[.R226]*0.16 -> 6.2768 | W226: of:=[.R226]*1.16 -> 45.5068 | X226: 56.05 | Y226: Trasladado | Z226: IVA | AA226: 0.16 | AB226: of:=[.X226]*0.16 -> 8.968 | AC226: of:=[.X226]*1.16 -> 65.018 | AD226: FELPAS | AE226: BROCHAS Y PRODUCTOS S. DE R.L. DE C.V. | AL226: NO | AM226: SI | AN226: NO | AO226: 0.9525 | AP226: 22.86 | AQ226: 9.5 | AR226: 0.07 | AS226: BYP
A227: MPR9 | B227: MANERAL 9" PROFESIONAL CON JAULA | C227: DE USO PROFESIONAL Y FABRICACIÃN ROBUSTA, CUENTA CON UNA JAULA DE 5 ALAMBRES Y TAPAS LATERALES QUE BRINDAN MAYOR SOPORTE PARA LAS FELPAS. | D227: Inventariable | N227: PIEZA | O227: 31211900 | Q227: MXN | R227: 30.94 | S227: Trasladado | T227: IVA | U227: 0.16 | V227: of:=[.R227]*0.16 -> 4.9504 | W227: of:=[.R227]*1.16 -> 35.8904 | X227: 44.2 | Y227: Trasladado | Z227: IVA | AA227: 0.16 | AB227: of:=[.X227]*0.16 -> 7.072 | AC227: of:=[.X227]*1.16 -> 51.272 | AD227: MANERALES | AE227: BROCHAS Y PRODUCTOS S. DE R.L. DE C.V. | AL227: NO | AM227: SI | AN227: NO | AO227: 4.6 | AP227: 22.86 | AQ227: 32 | AR227: 0.21 | AS227: BYP
A228: MSP7 | B228: MANERAL 7" SEMIPROFESIONAL CON JAULA | C228: DE USO PROFESIONAL Y FABRICACIÃN ROBUSTA, CUENTA CON UNA JAULA DE 5 ALAMBRES Y TAPAS LATERALES QUE BRINDAN MAYOR SOPORTE PARA LAS FELPAS. | D228: Inventariable | N228: PIEZA | O228: 31211900 | Q228: MXN | R228: 28.9 | S228: Trasladado | T228: IVA | U228: 0.16 | V228: of:=[.W228]-[.R228] -> 4.624 | W228: of:=[.R228]*1.16 -> 33.524 | X228: 28.9 | Y228: Trasladado | Z228: IVA | AA228: 0.16 | AB228: of:=[.AC228]-[.X228] -> 4.624 | AC228: of:=[.X228]*1.16 -> 33.524 | AD228: MANERALES | AE228: BROCHAS Y PRODUCTOS S. DE R.L. DE C.V. | AL228: NO | AM228: SI | AN228: NO | AO228: 4.6 | AP228: 17.78 | AQ228: 32 | AR228: 0.184
A229: MSP9 | B229: MANERAL 9" SEMIPROFESIONAL CON JAULA | C229: RECOMENDADO PARA FELPAS DE MEDIA Y ALTA DENSIDAD. EL MANGO ES DE PLÃSTICO Y CUENTA CON ROSCA REFORZADA PARA EXTENSIÃN. USO GENERAL. JAULA DE 5 ALAMBRES. VARILLA DE 6MM. ROSCA REFORZADA PARA EXTENSIÃN. REUTILIZABLE. | D229: Inventariable | N229: PIEZA | O229: 31211900 | Q229: MXN | R229: 23.06 | S229: Trasladado | T229: IVA | U229: 0.16 | V229: of:=[.R229]*0.16 -> 3.6896 | W229: of:=[.R229]*1.16 -> 26.7496 | X229: 32.95 | Y229: Trasladado | Z229: IVA | AA229: 0.16 | AB229: of:=[.X229]*0.16 -> 5.272 | AC229: of:=[.X229]*1.16 -> 38.222 | AD229: MANERALES | AE229: BROCHAS Y PRODUCTOS S. DE R.L. DE C.V. | AL229: NO | AM229: SI | AN229: NO | AO229: 4.6 | AP229: 22.86 | AQ229: 32 | AR229: 0.21 | AS229: BYP
A230: MSE9 | B230: MANERAL 9" SENCILLO | C230: MANERAL LIVIANO SIN JAULA, ES IDEAL PARA FELPAS DE BAJA Y MEDIA DENSIDAD. RECOMENDADO PARA USO GENERAL, MEDIDA DE 9" DE LARGO Y CUERPO CON VARILLA DE 5.5MM. CUENTA CON ROSCA REFORZADA PARA EXTENSIÃN Y MANGO DE PLÃSTICO REFORZADO. | D230: Inventariable | N230: PIEZA | O230: 31211900 | Q230: MXN | R230: 14.84 | S230: Trasladado | T230: IVA | U230: 0.16 | V230: of:=[.R230]*0.16 -> 2.3744 | W230: of:=[.R230]*1.16 -> 17.2144 | X230: 21.2 | Y230: Trasladado | Z230: IVA | AA230: 0.16 | AB230: of:=[.X230]*0.16 -> 3.392 | AC230: of:=[.X230]*1.16 -> 24.592 | AD230: MANERALES | AE230: BROCHAS Y PRODUCTOS S. DE R.L. DE C.V. | AL230: NO | AM230: SI | AN230: NO | AO230: 4.6 | AP230: 22.86 | AQ230: 32 | AR230: 0.144 | AS230: BYP
A231: EME12 | B231: EXTENSION METALICA 1.20 MTS BYP | C231: EXTENSION METALICA CON ROSCA DE PLÃSTICO ESTÃNDAR. | D231: Inventariable | M231: 21 | N231: PIEZA | O231: 31211900 | Q231: MXN | R231: 19.98 | S231: Trasladado | T231: IVA | U231: 0.16 | V231: 3.2 | W231: 23.18 | X231: 27.82 | Y231: Trasladado | Z231: IVA | AA231: 0.16 | AB231: 4.44 | AC231: 32.26 | AD231: EXTENSIONES | AE231: BROCHAS Y PRODUCTOS S. DE R.L. DE C.V. | AL231: NO | AM231: SI | AN231: NO | AO231: 2.4 | AP231: 1.2 | AQ231: 1.2 | AR231: 0.4 | AS231: BYP
A232: EAL12 | B232: EXTENSION ALUMINIO 1.20 M | C232: EXTENSIONES DE CUERPO DE ALUMINIO ULTRA LIGERO Y RESISTENTE, CON ROSCA DE PLÃSTICO ESTÃNDAR 3/4â TIPO AMERICANO, REFORZADA EN SU INTERIOR CON ESTRUCTURA DE ACERO. | D232: Inventariable | M232: 4 | N232: PIEZA | O232: 31211900 | Q232: MXN | R232: 34.65 | S232: Trasladado | T232: IVA | U232: 0.16 | V232: of:=[.R232]*0.16 -> 5.544 | W232: of:=[.R232]*1.16 -> 40.194 | X232: 49.5 | Y232: Trasladado | Z232: IVA | AA232: 0.16 | AB232: of:=[.X232]*0.16 -> 7.92 | AC232: of:=[.X232]*1.16 -> 57.42 | AD232: EXTENSIONES | AE232: BROCHAS Y PRODUCTOS S. DE R.L. DE C.V. | AL232: NO | AM232: SI | AN232: NO | AO232: 2.4 | AP232: 1.2 | AQ232: 1.2 | AR232: 0.152 | AS232: BYP
A233: EAL24 | B233: EXTENSION ALUMINIO 1.2M-2.4 M | C233: EXTENSIONES DE CUERPO DE ALUMINIO ULTRA LIGERO Y RESISTENTE, CON ROSCA DE PLÃSTICO ESTÃNDAR 3/4â TIPO AMERICANO, REFORZADA EN SU INTERIOR CON ESTRUCTURA DE ACERO. | D233: Inventariable | M233: 2 | N233: PIEZA | O233: 31211900 | Q233: MXN | R233: 107.2 | S233: Trasladado | T233: IVA | U233: 0.16 | V233: of:=[.R233]*0.16 -> 17.152 | W233: of:=[.R233]*1.16 -> 124.352 | X233: 153.15 | Y233: Trasladado | Z233: IVA | AA233: 0.16 | AB233: of:=[.X233]*0.16 -> 24.504 | AC233: of:=[.X233]*1.16 -> 177.654 | AD233: EXTENSIONES | AE233: BROCHAS Y PRODUCTOS S. DE R.L. DE C.V. | AL233: NO | AM233: SI | AN233: NO | AO233: 2.4 | AP233: 2.4 | AQ233: 2.4 | AR233: 358 | AS233: BYP
A234: CSU9 | B234: CHAROLA SUPER 9" | C234: UNA HERRAMIENTA INDISPENSABLE SI TIENES PLANEADO UN PROYECTO DE PINTURA, ES RESISTENTE A LA INTEMPERIE, ES RECOMENDADA PARA INTERIOR O EXTERIOR. | D234: Inventariable | M234: 24 | N234: PIEZA | O234: 31211909 | Q234: MXN | R234: 12.35 | S234: Trasladado | T234: IVA | U234: 0.16 | V234: of:=[.R234]*0.16 -> 1.976 | W234: of:=[.R234]*1.16 -> 14.326 | X234: 32.25 | Y234: Trasladado | Z234: IVA | AA234: 0.16 | AB234: of:=[.X234]*0.16 -> 5.16 | AC234: of:=[.X234]*1.16 -> 37.41 | AD234: CHAROLAS | AE234: BROCHAS Y PRODUCTOS S. DE R.L. DE C.V. | AL234: NO | AM234: SI | AN234: NO | AO234: 36.7 | AP234: 27.7 | AQ234: 6 | AR234: 0.274 | AS234: BYP
A235: CPL4 | B235: CHAROLA PLASTICA BLANCA DE 4" | C235: UNA HERRAMIENTA INDISPENSABLE SI TIENES PLANEADO UN PROYECTO DE PINTURA, ES RESISTENTE A LA INTEMPERIE, ES RECOMENDADA PARA INTERIOR O EXTERIOR. | D235: Inventariable | M235: 8 | N235: PIEZA | O235: 31211909 | Q235: MXN | R235: 42.14 | S235: Trasladado | T235: IVA | U235: 0.16 | V235: of:=[.R235]*0.16 -> 6.7424 | W235: of:=[.R235]*1.16 -> 48.8824 | X235: 14.2 | Y235: Trasladado | Z235: IVA | AA235: 0.16 | AB235: of:=[.X235]*0.16 -> 2.272 | AC235: of:=[.X235]*1.16 -> 16.472 | AD235: CHAROLAS | AE235: BROCHAS Y PRODUCTOS S. DE R.L. DE C.V. | AL235: NO | AM235: SI | AN235: NO | AO235: 7 | AP235: 37 | AQ235: 16.7 | AR235: 0.072 | AS235: BYP
A236: EMF15 | B236: ESPATULA FLEXIBLE MANGO MADERA 1-1/2" | C236: FABRICADA CON HOJA DE ACERO A TODO LO LARGO DEL MANGO PARA UNA MAYOR RESISTENCIA. IDEAL PARA LIMPIAR, QUITAR RESTOS DE PINTURA, APLICAR PASTAS Y RELLENAR PEQUEÃOS HUECOS Y GRIETAS. | D236: Inventariable | N236: PIEZA | O236: 27112202 | Q236: MXN | R236: 18.16 | S236: Trasladado | T236: IVA | U236: 0.16 | V236: of:=[.R236]*0.16 -> 2.9056 | W236: of:=[.R236]*1.16 -> 21.0656 | X236: 25.95 | Y236: Trasladado | Z236: IVA | AA236: 0.16 | AB236: of:=[.X236]*0.16 -> 4.152 | AC236: of:=[.X236]*1.16 -> 30.102 | AD236: ESPATULA | AE236: BROCHAS Y PRODUCTOS S. DE R.L. DE C.V. | AL236: NO | AM236: SI | AN236: NO | AO236: 3.81 | AP236: 20.4 | AQ236: 3.81 | AR236: 0.084 | AS236: BYP
A237: EMF20 | B237: ESPATULA FLEXIBLE MANGO MADERA 2" | C237: FABRICADA CON HOJA DE ACERO A TODO LO LARGO DEL MANGO PARA UNA MAYOR RESISTENCIA. IDEAL PARA LIMPIAR, QUITAR RESTOS DE PINTURA, APLICAR PASTAS Y RELLENAR PEQUEÃOS HUECOS Y GRIETAS. | D237: Inventariable | N237: PIEZA | O237: 27112202 | Q237: MXN | R237: 19.77 | S237: Trasladado | T237: IVA | U237: 0.16 | V237: of:=[.R237]*0.16 -> 3.1632 | W237: of:=[.R237]*1.16 -> 22.9332 | X237: 28.25 | Y237: Trasladado | Z237: IVA | AA237: 0.16 | AB237: of:=[.X237]*0.16 -> 4.52 | AC237: of:=[.X237]*1.16 -> 32.77 | AD237: ESPATULA | AE237: BROCHAS Y PRODUCTOS S. DE R.L. DE C.V. | AL237: NO | AM237: SI | AN237: NO | AO237: 5.08 | AP237: 20.4 | AQ237: 5.08 | AR237: 0.09 | AS237: BYP
A238: EMF30 | B238: ESPATULA FLEXIBLE MANGO MADERA 3" | C238: FABRICADA CON HOJA DE ACERO A TODO LO LARGO DEL MANGO PARA UNA MAYOR RESISTENCIA. IDEAL PARA LIMPIAR, QUITAR RESTOS DE PINTURA, APLICAR PASTAS Y RELLENAR PEQUEÃOS HUECOS Y GRIETAS. | D238: Inventariable | N238: PIEZA | O238: 27112202 | Q238: MXN | R238: 24.32 | S238: Trasladado | T238: IVA | U238: 0.16 | V238: of:=[.R238]*0.16 -> 3.8912 | W238: of:=[.R238]*1.16 -> 28.2112 | X238: 34.75 | Y238: Trasladado | Z238: IVA | AA238: 0.16 | AB238: of:=[.X238]*0.16 -> 5.56 | AC238: of:=[.X238]*1.16 -> 40.31 | AD238: ESPATULA | AE238: BROCHAS Y PRODUCTOS S. DE R.L. DE C.V. | AL238: NO | AM238: SI | AN238: NO | AO238: 7.62 | AP238: 20.5 | AQ238: 7.62 | AR238: 0.108 | AS238: BYP
A239: EPF40 | B239: ESPATULA FLEXIBLE MANGO PLASTICO ACABADO NATURAL 4" | C239: FABRICADA CON HOJA DE ACERO A TODO LO LARGO DEL MANGO PARA UNA MAYOR RESISTENCIA. IDEAL PARA LIMPIAR, QUITAR RESTOS DE PINTURA, APLICAR PASTAS Y RELLENAR PEQUEÃOS HUECOS Y GRIETAS. | D239: Inventariable | N239: PIEZA | O239: 27112202 | Q239: MXN | R239: 21.84 | S239: Trasladado | T239: IVA | U239: 16%% | V239: 3.49 | W239: 25.33 | X239: 30.4 | Y239: Trasladado | Z239: IVA | AA239: 16%% | AB239: 4.86 | AC239: 35.26 | AD239: ESPATULA | AE239: BROCHAS Y PRODUCTOS S. DE R.L. DE C.V. | AL239: NO | AM239: SI | AN239: NO | AO239: 21 | AP239: 21 | AQ239: 10.16 | AR239: 0.09 | AS239: BYP
A240: EMF40 | B240: ESPATULA FLEXIBLE MANGO MADERA 4" | C240: FABRICADA CON HOJA DE ACERO A TODO LO LARGO DEL MANGO PARA UNA MAYOR RESISTENCIA. IDEAL PARA LIMPIAR, QUITAR RESTOS DE PINTURA, APLICAR PASTAS Y RELLENAR PEQUEÃOS HUECOS Y GRIETAS. | D240: Inventariable | N240: PIEZA | O240: 27112202 | Q240: MXN | R240: 29.26 | S240: Trasladado | T240: IVA | U240: 0.16 | V240: of:=[.R240]*0.16 -> 4.6816 | W240: of:=[.R240]*1.16 -> 33.9416 | X240: 41.8 | Y240: Trasladado | Z240: IVA | AA240: 0.16 | AB240: of:=[.X240]*0.16 -> 6.688 | AC240: of:=[.X240]*1.16 -> 48.488 | AD240: ESPATULA | AE240: BROCHAS Y PRODUCTOS S. DE R.L. DE C.V. | AL240: NO | AM240: SI | AN240: NO | AO240: 21 | AP240: 21 | AQ240: 10.16 | AR240: 0.128 | AS240: BYP
A241: EMR15 | B241: ESPATULA RIGIDA MANGO MADERA 1-1/2" | C241: FABRICADA CON HOJA DE ACERO A TODO LO LARGO DEL MANGO PARA UNA MAYOR RESISTENCIA. IDEAL PARA LIMPIAR, QUITAR RESTOS DE PINTURA, APLICAR PASTAS Y RELLENAR PEQUEÃOS HUECOS Y GRIETAS. | D241: Inventariable | N241: PIEZA | O241: 27112202 | Q241: MXN | R241: 18.16 | S241: Trasladado | T241: IVA | U241: 0.16 | V241: of:=[.R241]*0.16 -> 2.9056 | W241: of:=[.R241]*1.16 -> 21.0656 | X241: 25.95 | Y241: Trasladado | Z241: IVA | AA241: 0.16 | AB241: of:=[.X241]*0.16 -> 4.152 | AC241: of:=[.X241]*1.16 -> 30.102 | AD241: ESPATULA | AE241: BROCHAS Y PRODUCTOS S. DE R.L. DE C.V. | AL241: NO | AM241: SI | AN241: NO | AO241: 3.81 | AP241: 20.4 | AQ241: 3.81 | AR241: 0.084 | AS241: BYP
A242: EMR20 | B242: ESPATULA RIGIDA MANGO MADERA 2" | C242: FABRICADA CON HOJA DE ACERO A TODO LO LARGO DEL MANGO PARA UNA MAYOR RESISTENCIA. IDEAL PARA LIMPIAR, QUITAR RESTOS DE PINTURA, APLICAR PASTAS Y RELLENAR PEQUEÃOS HUECOS Y GRIETAS. | D242: Inventariable | M242: 24 | N242: PIEZA | O242: 27112202 | Q242: MXN | R242: 20.23 | S242: Trasladado | T242: IVA | U242: 0.16 | V242: of:=[.R242]*0.16 -> 3.2368 | W242: of:=[.R242]*1.16 -> 23.4668 | X242: 28.9 | Y242: Trasladado | Z242: IVA | AA242: 0.16 | AB242: of:=[.X242]*0.16 -> 4.624 | AC242: of:=[.X242]*1.16 -> 33.524 | AD242: ESPATULA | AE242: BROCHAS Y PRODUCTOS S. DE R.L. DE C.V. | AL242: NO | AM242: SI | AN242: NO | AO242: 5.08 | AP242: 20.4 | AQ242: 5.08 | AR242: 0.09 | AS242: BYP
A243: EMR31 | B243: ESPATULA RIGIDA MANGO MADERA 3" | C243: FABRICADA CON HOJA DE ACERO A TODO LO LARGO DEL MANGO PARA UNA MAYOR RESISTENCIA. IDEAL PARA LIMPIAR, QUITAR RESTOS DE PINTURA, APLICAR PASTAS Y RELLENAR PEQUEÃOS HUECOS Y GRIETAS. | D243: Inventariable | M243: 32 | N243: PIEZA | O243: 27112202 | Q243: MXN | R243: 23.9 | S243: Trasladado | T243: IVA | U243: 0.16 | V243: of:=[.R243]*0.16 -> 3.824 | W243: of:=[.R243]*1.16 -> 27.724 | X243: 34.15 | Y243: Trasladado | Z243: IVA | AA243: 0.16 | AB243: of:=[.X243]*0.16 -> 5.464 | AC243: of:=[.X243]*1.16 -> 39.614 | AD243: ESPATULA | AE243: BROCHAS Y PRODUCTOS S. DE R.L. DE C.V. | AL243: NO | AM243: SI | AN243: NO | AO243: 7.62 | AP243: 20.5 | AQ243: 7.62 | AR243: 0.108 | AS243: BYP
A244: EMR40 | B244: ESPATULA RIGIDA MANGO MADERA 4" | C244: FABRICADA CON HOJA DE ACERO A TODO LO LARGO DEL MANGO PARA UNA MAYOR RESISTENCIA. IDEAL PARA LIMPIAR, QUITAR RESTOS DE PINTURA, APLICAR PASTAS Y RELLENAR PEQUEÃOS HUECOS Y GRIETAS. | D244: Inventariable | M244: 48 | N244: PIEZA | O244: 27112202 | Q244: MXN | R244: 29.26 | S244: Trasladado | T244: IVA | U244: 0.16 | V244: of:=[.R244]*0.16 -> 4.6816 | W244: of:=[.R244]*1.16 -> 33.9416 | X244: 41.8 | Y244: Trasladado | Z244: IVA | AA244: 0.16 | AB244: of:=[.X244]*0.16 -> 6.688 | AC244: of:=[.X244]*1.16 -> 48.488 | AD244: ESPATULA | AE244: BROCHAS Y PRODUCTOS S. DE R.L. DE C.V. | AL244: NO | AM244: SI | AN244: NO | AO244: 21 | AP244: 21 | AQ244: 10.16 | AR244: 0.128 | AS244: BYP
A245: CACMA4P | B245: JGO 4PZS CUÃAS ACERO C/MANGO (50,80,100,120 mm) | C245: CUÃAS FABRICADAS CON ACERO AL CARBONO, RESISTENTES Y ALTAMENTE FLEXIBLES. CON MANGO DE PLÃSTICO QUE PROTEGE AL USUARIO DE CORTADURAS. | D245: Inventariable | M245: 6 | N245: PIEZA | O245: 27112202 | Q245: MXN | R245: 16.45 | S245: Trasladado | T245: IVA | U245: 0.16 | V245: of:=[.R245]*0.16 -> 2.632 | W245: of:=[.R245]*1.16 -> 19.082 | X245: 23.5 | Y245: Trasladado | Z245: IVA | AA245: 0.16 | AB245: of:=[.X245]*0.16 -> 3.76 | AC245: of:=[.X245]*1.16 -> 27.26 | AD245: CUÃAS | AE245: BROCHAS Y PRODUCTOS S. DE R.L. DE C.V. | AL245: NO | AM245: SI | AN245: NO | AO245: 0.001 | AP245: 11 | AQ245: 10 | AR245: 0.086 | AS245: BYP
A246: CNR00 | B246: CHALECO SEGURIDAD CON BANDAS REFLEJANTES NARANJA | C246: PRENDA DE VESTIR ES UN MODELO DE MALLA LIGERA DE POLIÃSTER, RESPIRABLE DE ALTA VISIBILIDAD. | D246: Inventariable | M246: 5 | N246: PIEZA | O246: 46181500 | Q246: MXN | R246: 36.12 | S246: Trasladado | T246: IVA | U246: 0.16 | V246: of:=[.R246]*0.16 -> 5.7792 | W246: of:=[.R246]*1.16 -> 41.8992 | X246: 51.6 | Y246: Trasladado | Z246: IVA | AA246: 0.16 | AB246: of:=[.X246]*0.16 -> 8.256 | AC246: of:=[.X246]*1.16 -> 59.856 | AD246: CHALECOS | AE246: BROCHAS Y PRODUCTOS S. DE R.L. DE C.V. | AL246: NO | AM246: SI | AN246: NO | AO246: 40 | AP246: 73 | AQ246: 43 | AR246: 0.86 | AS246: BYP
A247: CVR00 | B247: CHALECO SEGURIDAD CON BANDAS REFLEJANTES VERDE | C247: PRENDA DE VESTIR ES UN MODELO DE MALLA LIGERA DE POLIÃSTER, RESPIRABLE DE ALTA VISIBILIDAD. | D247: Inventariable | M247: 4 | N247: PIEZA | O247: 46181500 | Q247: MXN | R247: 36.12 | S247: Trasladado | T247: IVA | U247: 0.16 | V247: of:=[.R247]*0.16 -> 5.7792 | W247: of:=[.R247]*1.16 -> 41.8992 | X247: 51.6 | Y247: Trasladado | Z247: IVA | AA247: 0.16 | AB247: of:=[.X247]*0.16 -> 8.256 | AC247: of:=[.X247]*1.16 -> 59.856 | AD247: CHALECOS | AE247: BROCHAS Y PRODUCTOS S. DE R.L. DE C.V. | AL247: NO | AM247: SI | AN247: NO | AO247: 40 | AP247: 73 | AQ247: 43 | AR247: 0.86 | AS247: BYP
A248: CAL64 | B248: CEPILLO DE ALAMBRE NO.64 | C248: LOS CEPILLOS DE ALAMBRE DE ACERO CON ALTO CARBONO SON UNA HERRAMIENTA IDEAL PARA QUITAR PINTURA DESCASCARADA, ÃXIDO, ARAÃAZOS, SUCIEDAD Y PEQUEÃAS IMPERFECCIONES DE SUPERFICIES DE CONCRETO, METAL, PIEDRA Y MADERA. | D248: Inventariable | N248: PIEZA | O248: 27111907 | Q248: MXN | R248: 15.57 | S248: Trasladado | T248: IVA | U248: 0.16 | V248: of:=[.R248]*0.16 -> 2.4912 | W248: of:=[.R248]*1.16 -> 18.0612 | X248: 22.5 | Y248: Trasladado | Z248: IVA | AA248: 0.16 | AB248: of:=[.X248]*0.16 -> 3.6 | AC248: of:=[.X248]*1.16 -> 26.1 | AD248: CEPILLOS | AE248: BROCHAS Y PRODUCTOS S. DE R.L. DE C.V. | AL248: NO | AM248: SI | AN248: NO | AO248: 5 | AP248: 7 | AQ248: 26.5 | AR248: 0.2 | AS248: BYP
A249: CAZ20 | B249: CINTA AZUL PARA PINTOR 2"x 50 M | C249: LA CINTA MASKING AZUL BYP ESTÃ ESPECIALMENTE DISEÃADA PARA TRABAJOS Y PROYECTOS DE PINTURA EN EXTERIORES. | D249: Inventariable | M249: 25 | N249: PIEZA | O249: 31201503 | Q249: MXN | R249: 64.33 | S249: Trasladado | T249: IVA | U249: 0.16 | V249: of:=[.R249]*0.16 -> 10.2928 | W249: of:=[.R249]*1.16 -> 74.6228 | X249: 91.9 | Y249: Trasladado | Z249: IVA | AA249: 0.16 | AB249: of:=[.X249]*0.16 -> 14.704 | AC249: of:=[.X249]*1.16 -> 106.604 | AD249: CINTAS | AE249: BROCHAS Y PRODUCTOS S. DE R.L. DE C.V. | AL249: NO | AM249: SI | AN249: NO | AO249: 5.08 | AP249: 50 | AQ249: 50 | AR249: 0.25 | AS249: BYP
A250: CAZ | B250: CINTA AZUL PINTOR 1" X 50 M. | C250: LA CINTA MASKING AZUL BYP ESTÃ ESPECIALMENTE DISEÃADA PARA TRABAJOS Y PROYECTOS DE PINTURA EN EXTERIORES. | D250: Inventariable | M250: 34 | N250: PIEZA | O250: 31201503 | Q250: MXN | R250: 35.94 | S250: Trasladado | T250: IVA | U250: 0.16 | V250: of:=[.R250]*0.16 -> 5.7504 | W250: of:=[.R250]*1.16 -> 41.6904 | X250: 51.35 | Y250: Trasladado | Z250: IVA | AA250: 0.16 | AB250: of:=[.X250]*0.16 -> 8.216 | AC250: of:=[.X250]*1.16 -> 59.566 | AD250: CINTAS | AE250: BROCHAS Y PRODUCTOS S. DE R.L. DE C.V. | AL250: NO | AM250: SI | AN250: NO | AO250: 2.54 | AP250: 50 | AQ250: 50 | AR250: 0.125 | AS250: BYP
A251: CAZ75 | B251: CINTA AZUL PINTOR 3/4" X 50 M. | C251: LA CINTA MASKING AZUL BYP ESTÃ ESPECIALMENTE DISEÃADA PARA TRABAJOS Y PROYECTOS DE PINTURA EN EXTERIORES. | D251: Inventariable | M251: 21 | N251: PIEZA | O251: 31201503 | Q251: MXN | R251: 26.67 | S251: Trasladado | T251: IVA | U251: 0.16 | V251: of:=[.R251]*0.16 -> 4.2672 | W251: of:=[.R251]*1.16 -> 30.9372 | X251: 38.1 | Y251: Trasladado | Z251: IVA | AA251: 0.16 | AB251: of:=[.X251]*0.16 -> 6.096 | AC251: of:=[.X251]*1.16 -> 44.196 | AD251: CINTAS | AE251: BROCHAS Y PRODUCTOS S. DE R.L. DE C.V. | AL251: NO | AM251: SI | AN251: NO | AO251: 1.905 | AP251: 50 | AQ251: 50 | AR251: 0.09 | AS251: BYP
A252: CUG20 | B252: CINTA USO GENERAL 2"x 50 M | C252: PAPEL CREPADO QUE RESISTE TEMPERATURAS DE HASTA 80 CÂ°. RECOMENDADO PARA PROTECCIÃN EN TRABAJOS DE PINTURA, IDEAL PARA USAR CON SOLVENTES LIGEROS. | D252: Inventariable | M252: 0 | N252: PIEZA | O252: 31201500 | Q252: MXN | R252: 34.72 | S252: Trasladado | T252: IVA | U252: 0.16 | V252: of:=[.R252]*0.16 -> 5.5552 | W252: of:=[.R252]*1.16 -> 40.2752 | X252: 49.6 | Y252: Trasladado | Z252: IVA | AA252: 0.16 | AB252: of:=[.X252]*0.16 -> 7.936 | AC252: of:=[.X252]*1.16 -> 57.536 | AD252: CINTAS | AE252: BROCHAS Y PRODUCTOS S. DE R.L. DE C.V. | AL252: NO | AM252: SI | AN252: NO | AO252: 5.08 | AP252: 50 | AQ252: 50 | AR252: 0.25 | AS252: BYP
A253: CUG15 | B253: CINTA USO GENERAL 1-1/2" X 50 M. | C253: PAPEL CREPADO QUE RESISTE TEMPERATURAS DE HASTA 80 CÂ°. RECOMENDADO PARA PROTECCIÃN EN TRABAJOS DE PINTURA, IDEAL PARA USAR CON SOLVENTES LIGEROS. | D253: Inventariable | M253: 0 | N253: PIEZA | O253: 31201500 | Q253: MXN | R253: 26.11 | S253: Trasladado | T253: IVA | U253: 0.16 | V253: of:=[.R253]*0.16 -> 4.1776 | W253: of:=[.R253]*1.16 -> 30.2876 | X253: 37.3 | Y253: Trasladado | Z253: IVA | AA253: 0.16 | AB253: of:=[.X253]*0.16 -> 5.968 | AC253: of:=[.X253]*1.16 -> 43.268 | AD253: CINTAS | AE253: BROCHAS Y PRODUCTOS S. DE R.L. DE C.V. | AL253: NO | AM253: SI | AN253: NO | AO253: 3.175 | AP253: 50 | AQ253: 50 | AR253: 0.188 | AS253: BYP
A254: CUG | B254: CINTA USO GENERAL 1" X 50 M. | C254: PAPEL CREPADO QUE RESISTE TEMPERATURAS DE HASTA 80 CÂ°. RECOMENDADO PARA PROTECCIÃN EN TRABAJOS DE PINTURA, IDEAL PARA USAR CON SOLVENTES LIGEROS. | D254: Inventariable | M254: 26 | N254: PIEZA | O254: 31201500 | Q254: MXN | R254: 17.36 | S254: Trasladado | T254: IVA | U254: 0.16 | V254: of:=[.R254]*0.16 -> 2.7776 | W254: of:=[.R254]*1.16 -> 20.1376 | X254: 24.8 | Y254: Trasladado | Z254: IVA | AA254: 0.16 | AB254: of:=[.X254]*0.16 -> 3.968 | AC254: of:=[.X254]*1.16 -> 28.768 | AD254: CINTAS | AE254: BROCHAS Y PRODUCTOS S. DE R.L. DE C.V. | AL254: NO | AM254: SI | AN254: NO | AO254: 2.54 | AP254: 50 | AQ254: 50 | AR254: 0.125 | AS254: BYP
A255: CUG75 | B255: CINTA USO GENERAL 3/4" X 50 M. | C255: PAPEL CREPADO QUE RESISTE TEMPERATURAS DE HASTA 80 CÂ°. RECOMENDADO PARA PROTECCIÃN EN TRABAJOS DE PINTURA, IDEAL PARA USAR CON SOLVENTES LIGEROS. | D255: Inventariable | M255: 30 | N255: PIEZA | O255: 31201500 | Q255: MXN | R255: 13.96 | S255: Trasladado | T255: IVA | U255: 0.16 | V255: of:=[.R255]*0.16 -> 2.2336 | W255: of:=[.R255]*1.16 -> 16.1936 | X255: 19.95 | Y255: Trasladado | Z255: IVA | AA255: 0.16 | AB255: of:=[.X255]*0.16 -> 3.192 | AC255: of:=[.X255]*1.16 -> 23.142 | AD255: CINTAS | AE255: BROCHAS Y PRODUCTOS S. DE R.L. DE C.V. | AL255: NO | AM255: SI | AN255: NO | AO255: 1.905 | AP255: 50 | AQ255: 50 | AR255: 0.09 | AS255: BYP
A256: CET50 | B256: CINTA PARA EMPAQUE TRANSPARENTE 48 X 50 | M256: 18 | N256: PIEZA | O256: 31201500 | Q256: MXN | R256: 10.85 | S256: Trasladado | T256: IVA | U256: 0.16 | V256: 1.74 | W256: 12.59 | X256: 15.11 | Y256: Trasladado | Z256: IVA | AA256: 16%% | AB256: 2.42 | AC256: 17.53 | AD256: CINTAS | AE256: BROCHAS Y PRODUCTOS S. DE R.L. DE C.V. | AL256: NO | AM256: SI | AN256: NO | AO256: 4.8 | AP256: 50 | AQ256: 50 | AR256: 0.09 | AS256: BYP
A257: CEC50 | B257: CINTA CANELA 50 X 48 MM | C257: CINTA CANELA COMÃNMENTE USADA PARA APLICACIONES INDUSTRIALES. RECOMENDADA PARA EMPACAR, SELLAR Y FLEJAR. ALTA CALIDAD RESISTENTE AL AGUA Y SOLVENTES COMUNES. | D257: Inventariable | M257: 36 | N257: PIEZA | O257: 31191507 | Q257: MXN | R257: 10.85 | S257: Trasladado | T257: IVA | U257: 0.16 | V257: of:=[.R257]*0.16 -> 1.736 | W257: of:=[.R257]*1.16 -> 12.586 | X257: 15.5 | Y257: Trasladado | Z257: IVA | AA257: 0.16 | AB257: of:=[.X257]*0.16 -> 2.48 | AC257: of:=[.X257]*1.16 -> 17.98 | AD257: CINTAS | AE257: BROCHAS Y PRODUCTOS S. DE R.L. DE C.V. | AL257: NO | AM257: SI | AN257: NO | AO257: 4.8 | AP257: 50 | AQ257: 50 | AR257: 0.09 | AS257: BYP
A258: EST05 | B258: ESTOPA 1/2 KILO | C258: LA ESTOPA ES UN MATERIAL QUE SE COMPONE DE FIBRAS DE LINO, SU USO ES BASICO Y GENERAL, ES IDEAL P/LIMPIEZA, TODO TIPO DE SUPERFICIES, MANTENIMIENTO DE MAQUINARIA Y APLICACION DE ACABADOS SOBRE MADERA,SE RECOMIENDA PARA TRABAJOS DE PLOMERIAS, CARPINTERIA, HERRERIA Y PINTURA. | D258: Inventariable | M258: 11 | N258: PIEZA | O258: 11162116 | Q258: MXN | R258: 20.65 | S258: Trasladado | T258: IVA | U258: 0.16 | V258: of:=[.R258]*0.16 -> 3.304 | W258: of:=[.R258]*1.16 -> 23.954 | X258: 47.5 | Y258: Trasladado | Z258: IVA | AA258: 0.16 | AB258: of:=[.X258]*0.16 -> 7.6 | AC258: of:=[.X258]*1.16 -> 55.1 | AD258: ESTOPA | AE258: BROCHAS Y PRODUCTOS S. DE R.L. DE C.V. | AL258: NO | AM258: SI | AN258: NO | AO258: 6 | AP258: 30 | AQ258: 24 | AR258: 1 | AS258: BYP
A259: EST01 | B259: ESTOPA 1 KILO | C259: LA ESTOPA ES UN MATERIAL QUE SE COMPONE DE FIBRAS DE LINO, SU USO ES BASICO Y GENERAL, ES IDEAL P/LIMPIEZA, TODO TIPO DE SUPERFICIES, MANTENIMIENTO DE MAQUINARIA Y APLICACION DE ACABADOS SOBRE MADERA,SE RECOMIENDA PARA TRABAJOS DE PLOMERIAS, CARPINTERIA, HERRERIA Y PINTURA. | D259: Inventariable | M259: 18 | N259: PIEZA | O259: 11162116 | Q259: MXN | R259: 39.23 | S259: Trasladado | T259: IVA | U259: 0.16 | V259: of:=[.R259]*0.16 -> 6.2768 | W259: of:=[.R259]*1.16 -> 45.5068 | X259: 25 | Y259: Trasladado | Z259: IVA | AA259: 0.16 | AB259: of:=[.X259]*0.16 -> 4 | AC259: of:=[.X259]*1.16 -> 29 | AD259: ESTOPA | AE259: BROCHAS Y PRODUCTOS S. DE R.L. DE C.V. | AL259: NO | AM259: SI | AN259: NO | AO259: 8 | AP259: 40 | AQ259: 36 | AR259: 0.5 | AS259: BYP
A260: CPM05 | B260: CUTTER PROFESIONAL 5" CON ALMA METALICA | C260: CUTTER CON CUERPO ABS CON ALMA METALICA QUE BRINDA UNA MAYOR PRESION LOGRANDO CORTES MAS EXACTOS | D260: Inventariable | M260: 10 | N260: PIEZA | O260: 44121612 | Q260: MXN | R260: 13.12 | S260: Trasladado | T260: IVA | U260: 0.16 | V260: 2.1 | W260: 15.22 | X260: 18.26 | Y260: Trasladado | Z260: IVA | AA260: 0.16 | AB260: 2.92 | AC260: 21.18 | AD260: CUTTER | AE260: BROCHAS Y PRODUCTOS S. DE R.L. DE C.V. | AL260: NO | AM260: SI | AN260: NO | AO260: 0.5 | AP260: 14 | AQ260: 2.5 | AR260: 0.4 | AS260: BYP

Sheet: Tipos
A1: Tipo | C1: Tipo de Impuesto | E1: Moneda | G1: Se vende en lÃ­nea Se permite su venta
A2: Inventariable | C2: Trasladado | E2: MXN | G2: SI
A3: Servicio | C3: Retenido | E3: USD | G3: NO
A4: Compuesto | E4: EUR
A5: Variante